"","VisitNo","SampleID_key","SampleID_frp","QAQC.x","GearType","GearTypeAbbreviation","Habitat","SeineCode","TowDirection","HabitatMorphology","DepthOfWater","CableOut","LengthOfTrawl","Width","Netter","StartTime","EndTime","Duration","PercentOpen","DepthOfSample","LatitudeStart","LongitudeStart","LatitudeEnd","LongitudeEnd","NetMeterSerial","NetMeterStart","NetMeterEnd","Volts","DutyCycle","Amps","PulseRate","VolumeEstimated","SeineDeploymentType","GearDetail","Silt","Sand","Gravel","Cobble","Boulder","Organics","MassOfStandardLow","MassOfStandardHigh","QuestionableData.x","VegetationInSample","FlowType","DragMethod","NetNumber","CodEnd","CodEndPercent","GpsUnit","GpsAccuracy","DepthSource","Comments","QAQC.y","Boat","Crew","Location","Visit.Date","Station","Weather","WindWaves","WindDirection","Tide","Secchi","SurfTemp","DO","SC","pH","Turbidity","Phycocyanin","Chlorophyll","FDOM","Microcystis","SondeNo","Wetland","DataQuality","QuestionableData.y","SiteComments","Visit.Date2","year","month","DateTime","Season"
"1",7241,12241,"BEASEI01-HORS-03JAN2023","true","Seine","BEASEI",""," 1. No twists; snags; or tears"," 2= against flow"," ",1,NA,6,15,"","09:10","",NA,NA,NA,38.098501,121.70949,NA,NA,NA,NA,NA,NA,NA,NA,NA,NA," Crew Members"," ",NA,NA,NA,NA,NA,NA,NA,NA," false"," "," ","","2",NA," 0%"," ",NA," "," GPS #6; ACCURACY 3M. NOT PAIRED. SALMON! GPS manually updated from geo-tagged photos taken that day - ED 21JUL2023","true","Mudsucker","AC;ED;KS","Horseshoe Bend","01/03/2023","HORS-N","3=66-100% clouds","1=wind 1-3 mph; scaley ripples"," NA"," 4=flood",15,9.5,9.83,126,7.5,64.3,0.43,0.71,14.7," 1=absent",2," Inside",NA," false"," ",2023-01-03,2023,1,"2023-01-03 09:10","Winter"
"2",7242,12242,"BEASEI02-HORS-03JAN2023","true","Seine","BEASEI",""," 1. No twists; snags; or tears"," 2= against flow"," ",1,NA,6.5,9,"","09:54","",NA,NA,NA,38.097405,121.709736,NA,NA,NA,NA,NA,NA,NA,NA,NA,NA," Crew Members"," ",NA,NA,NA,NA,NA,NA,NA,NA," false"," "," ","","2",NA," 1-33%"," ",NA," "," GPS 6; ACCURACY 2M. NOT PAIRED. DOMINANT VEGETATION IN NET: EGEDEN. TIDE FLOWING OUT STILL BECAUSE OF AMOUNT OF WATER THERE IS. GPS manually updated based on fixed beach seine locations - ED 21JUL2023","true","Mudsucker","AC;ED;KS","Horseshoe Bend","01/03/2023","HORS-N","3=66-100% clouds","2= wind 4-7 mph; small wavelets"," NA"," 4=flood",18,9.5,9.92,130,7.4,62.3,0.44,0.68,14.9," 1=absent",2," Inside",NA," false"," ",2023-01-03,2023,1,"2023-01-03 09:54","Winter"
"3",7243,12243,"LAMOPE01-HORS-03JAN2023","true","Seine","LAMOPE",""," 1. No twists; snags; or tears"," 2= against flow"," ",2.9,NA,NA,NA,"","10:31","",NA,NA,NA,38.083104,121.712136,NA,NA,NA,NA,NA,NA,NA,NA,NA,NA," Boat"," ",NA,NA,NA,NA,NA,NA,NA,NA," false"," "," ","","1",NA," 0%"," ",NA," "," GPS 6; ACCURACY 3M. NOT PAIRED.GPS calculated and corrected in 2023 Sample Inventory - ED 21JUL2023","true","Mudsucker","AC;ED;KS","Horseshoe Bend","01/03/2023","HORS-M","3=66-100% clouds","2= wind 4-7 mph; small wavelets"," NW"," 4=flood",15,9.5,9.88,143,7.3,55.6,0.44,0.67,15.5," 1=absent",2," Inside",NA," false"," ",2023-01-03,2023,1,"2023-01-03 10:31","Winter"
"4",7244,12244,"LAMOPE02-HORS-03JAN2023","true","Seine","LAMOPE",""," 1. No twists; snags; or tears"," 2= against flow"," ",1.6,NA,NA,NA,"","10:59","",NA,NA,NA,38.084148,121.720405,NA,NA,NA,NA,NA,NA,NA,NA,NA,NA," Boat"," ",NA,NA,NA,NA,NA,NA,NA,NA," false"," "," ","","1",NA," 1-33%"," ",NA," "," GPS 6; ACCURACY 3M. NOT PAIRED. DOMINANT VEGETATION IN NET: EGEDEN; HYACINTH. GPS calculated and corrected in 2023 Sample Inventory - ED 21JUL2023","true","Mudsucker","AC;ED;KS","Horseshoe Bend","01/03/2023","HORS-M","3=66-100% clouds","0=Calm; glassy"," NW"," 4=flood",17,9.4,9.58,179,7.3,48.1,0.39,0.66,16.3," 1=absent",2," Inside",1," false"," ",2023-01-03,2023,1,"2023-01-03 10:59","Winter"
"5",7245,12245,"LAMOPE03-DECK-03JAN2023","true","Seine","LAMOPE",""," 1. No twists; snags; or tears"," 2= against flow"," ",1.3,NA,NA,NA,"","11:20","",NA,NA,NA,38.084279,121.724097,NA,NA,NA,NA,NA,NA,NA,NA,NA,NA," Boat"," ",NA,NA,NA,NA,NA,NA,NA,NA," false"," "," ","","1",NA," 1-33%"," ",NA," "," GPS 6; ACCURACY 3M. NOT PAIRED. DOMINANT VEGETATION IN NET: HYACINTH. GPS manually corrected from geo-tagged photos from that day - ED 21JUL2023","true","Mudsucker","AC;ED;KS","Decker Island","01/03/2023","DECK-UNK","3=66-100% clouds","0=Calm; glassy"," NW"," 4=flood",18,9.4,9.7,158,7.2,44.4,0.85,0.67,16.1," 1=absent",2," Inside",NA," false"," GPS 6; ACCURACY 3M. NOT PAIRED; HIGH FLOW COMING IN ",2023-01-03,2023,1,"2023-01-03 11:20","Winter"
"6",7246,12246,"LAMOPE04-HORS-03JAN2023","true","Seine","LAMOPE",""," 1. No twists; snags; or tears"," 2= against flow"," ",2.4,NA,NA,NA,"","11:40","",NA,NA,NA,38.080321,121.728292,NA,NA,NA,NA,NA,NA,NA,NA,NA,NA," Boat"," ",NA,NA,NA,NA,NA,NA,NA,NA," false"," "," ","","1",NA," 1-33%"," ",NA," "," GPS 6; ACCURACY 3M. NOT PAIRED. DOMINANT VEGETATION IN NET: EGEDEN. GPS manually updated from geo-tagged photos taken that day - ED 21JUL2023 ","true","Mudsucker","AC;ED;KS","Horseshoe Bend","01/03/2023","HORS-S","3=66-100% clouds","1=wind 1-3 mph; scaley ripples"," NW"," 4=flood",17,9.5,9.95,135,7.3,58.2,0.39,0.64,15.4," 1=absent",2," Inside",NA," false"," ",2023-01-03,2023,1,"2023-01-03 11:40","Winter"
"7",7247,12247,"LAMOPE05-WTIB-03JAN2023","true","Seine","LAMOPE",""," 2. Partial twist; snag; or tear"," 2= against flow"," ",12,NA,NA,NA,"","12:40","",NA,NA,NA,38.095686,121.591478,NA,NA,NA,NA,NA,NA,NA,NA,NA,NA," Boat"," ",NA,NA,NA,NA,NA,NA,NA,NA," false"," "," ","","1",NA," 0%"," ",NA," "," GPS 6; ACCURACY 3M. NOT PAIRED. CODE 2- DEPTH. GPS calculated and fixed in 2023 sample inventory - ED 21JUL2023","true","Mudsucker","AC;ED;KS","Webb Tract Island and Berms","01/03/2023","WTIB-CH-S","3=66-100% clouds","1=wind 1-3 mph; scaley ripples"," SW"," 4=flood",13,9.8,9.38,142,7.1,88.3,0.54,0.86,16.2," 1=absent",2," Inside",NA," false"," ",2023-01-03,2023,1,"2023-01-03 12:40","Winter"
"8",7248,12251,"LAMOPE06-WTIB-03JAN2023","true","Seine","LAMOPE",""," 2. Partial twist; snag; or tear"," 2= against flow"," ",7.1,NA,NA,NA,"","12:52","",NA,NA,NA,38.094711,121.584098,NA,NA,NA,NA,NA,NA,NA,NA,NA,NA," Boat"," ",NA,NA,NA,NA,NA,NA,NA,NA," false"," "," ","","1",NA," 0%"," ",NA," "," GPS 6; ACCURACY 3M. NOT PAIRED. CODE 2 - DEEP. GPS calculated and fixed in 2023 Sample Inventory - ED 21JUL2023","true","Mudsucker","AC;ED;KS","Webb Tract Island and Berms","01/03/2023","WTIB-CH-S","3=66-100% clouds","1=wind 1-3 mph; scaley ripples"," SW"," 4=flood",10,9.8,9.24,143,7.1,89.8,0.54,0.88,16.5," 1=absent",2," Inside",NA," false"," ",2023-01-03,2023,1,"2023-01-03 12:52","Winter"
"9",7249,12252,"LAMOPE07-WTIB-03JAN2023","true","Seine","LAMOPE",""," 1. No twists; snags; or tears"," 2= against flow"," ",2.1,NA,NA,NA,"","13:08","",NA,NA,NA,38.096616,121.589746,NA,NA,NA,NA,NA,NA,NA,NA,NA,NA," Boat"," ",NA,NA,NA,NA,NA,NA,NA,NA," false"," "," ","","1",NA," 1-33%"," ",NA," "," GPS 6; ACCURACY 3M. NOT PAIRED. DOMINANT VEGETATION IN NET: EGEDEN. PULLED NET THROUGH TULES. GPS calculated and fixed in 2023 Sample Inventory - ED 21JUL2023","true","Mudsucker","AC;ED;KS","Webb Tract Island and Berms","01/03/2023","WTIB-CH-N","3=66-100% clouds","1=wind 1-3 mph; scaley ripples"," SW"," 4=flood",13,9.8,9.45,145,7.1,89,0.54,0.81,16.3," 1=absent",2," Inside",NA," false"," ",2023-01-03,2023,1,"2023-01-03 13:08","Winter"
"10",7250,12253,"LAMOPE01-WINT-12JAN2023","true","Seine","LAMOPE",""," 2. Partial twist; snag; or tear"," 2= against flow"," ",1.2,NA,NA,NA,"","08:26","",NA,NA,NA,38.046178,121.849661,NA,NA,NA,NA,NA,NA,NA,NA,NA,NA," Boat"," ",NA,NA,NA,NA,NA,NA,NA,NA," false"," "," ","","1",NA," 0%"," ",NA," "," GPS 5; ACCURACY 2M. NOT PAIRED. NET BRIEFLY CAUGHT ON SOMETHING BUT IT CAME LOOSE WHEN IT WAS BEING PULLED IN; NO HOLES FOUND","true","Mudsucker","MA;AC;ED;GP","Winter Island","01/12/2023","WINT-CH-BREACH-E","3=66-100% clouds","1=wind 1-3 mph; scaley ripples"," SE"," 1=high slack",22,10.1,9.83,231,7.3,57.3,0.86,0.69,24.1," 1=absent",1," Inside",NA," false"," ",2023-01-12,2023,1,"2023-01-12 08:26","Winter"
"11",7251,12254,"LAMOPE02-WINT-12JAN2023","true","Seine","LAMOPE",""," 2. Partial twist; snag; or tear"," 2= against flow"," ",3.6,NA,NA,NA,"","08:44","",NA,NA,NA,38.044494,121.846909,NA,NA,NA,NA,NA,NA,NA,NA,NA,NA," Boat"," ",NA,NA,NA,NA,NA,NA,NA,NA," false"," "," ","","1",NA," 0%"," ",NA," "," GPS 5; ACCURACY 2M. NOT PAIRED. SEINE CODE 2 DUE TO DEPTH; FIXED HOLE ON LEAD LINE (~4IN) AFTER SAMPLE","true","Mudsucker","MA;AC;ED;GP","Winter Island","01/12/2023","WINT-CH-E","3=66-100% clouds","1=wind 1-3 mph; scaley ripples"," SE"," 2=ebb",18,10.1,9.78,224,7.3,54.7,0.87,0.71,24.2," 1=absent",1," Inside",NA," false"," ",2023-01-12,2023,1,"2023-01-12 08:44","Winter"
"12",7252,12255,"LAMOPE03-WINT-12JAN2023","true","Seine","LAMOPE",""," 2. Partial twist; snag; or tear"," 2= against flow"," ",3.6,NA,NA,NA,"","09:09","",NA,NA,NA,38.031796,121.842607,NA,NA,NA,NA,NA,NA,NA,NA,NA,NA," Boat"," ",NA,NA,NA,NA,NA,NA,NA,NA," false"," "," ","","1",NA," 0%"," ",NA," "," GPS 5; ACCURACY 2M. NOT PAIRED. SEINE CODE 2 DUE TO DEPTH. REPAIRED HOLE IN NET ON COD END SEAM (~3IN) AFTER SAMPLE","true","Mudsucker","MA;AC;ED;GP","Winter Island","01/12/2023","WINT-CH-INT","3=66-100% clouds","1=wind 1-3 mph; scaley ripples"," SE"," 2=ebb",21,10.1,9.5,211,7.3,58.2,0.89,0.73,24.4," 1=absent",1," Inside",NA," false"," ",2023-01-12,2023,1,"2023-01-12 09:09","Winter"
"13",7253,12257,"LAMOPE04-BROW-12JAN2023","true","Seine","LAMOPE",""," 2. Partial twist; snag; or tear"," 2= against flow"," ",1.4,NA,NA,NA,"","09:54","",NA,NA,NA,38.040131,121.858524,NA,NA,NA,NA,NA,NA,NA,NA,NA,NA," Boat"," ",NA,NA,NA,NA,NA,NA,NA,NA," false"," "," ","","1",NA," 0%"," ",NA," "," GPS 5; ACCURACY 3M. NOT PAIRED. COD END 1/4 FULL OF MUD AND DETRITUS","true","Mudsucker","MA;AC;ED;GP","Browns Island","01/12/2023","BROW-TP","3=66-100% clouds","1=wind 1-3 mph; scaley ripples"," SE"," 2=ebb",43,9.9,6.72,1170,6.9,19.5,0.8,0.95,33.1," 1=absent",1," Inside",NA," false"," ",2023-01-12,2023,1,"2023-01-12 09:54","Winter"
"14",7254,12258,"LAMOPE05-BROW-12JAN2023","true","Seine","LAMOPE",""," 2. Partial twist; snag; or tear"," 2= against flow"," ",3.8,NA,NA,NA,"","10:27","",NA,NA,NA,38.039703,121.864099,NA,NA,NA,NA,NA,NA,NA,NA,NA,NA," Boat"," ",NA,NA,NA,NA,NA,NA,NA,NA," false"," "," ","","1",NA," 0%"," ",NA," "," GPS 5; ACCURACY 3M. NOT PAIRED. SEINE CODE 2 DUE TO DEPTH.","true","Mudsucker","MA;AC;ED;GP","Browns Island","01/12/2023","BROW-CH-MAIN","3=66-100% clouds","1=wind 1-3 mph; scaley ripples"," SE"," 2=ebb",34,10,7.57,937,6.9,27.6,0.84,0.85,29.8," 1=absent",1," Inside",NA," false"," ",2023-01-12,2023,1,"2023-01-12 10:27","Winter"
"15",7255,12259,"LAMOPE06-BROW-12JAN2023","true","Seine","LAMOPE",""," 1. No twists; snags; or tears"," 2= against flow"," ",2.6,NA,NA,NA,"","10:52","",NA,NA,NA,38.042799,121.871486,NA,NA,NA,NA,NA,NA,NA,NA,NA,NA," Boat"," ",NA,NA,NA,NA,NA,NA,NA,NA," false"," "," ","","1",NA," 0%"," ",NA," "," GPS 5; ACCURACY 2M. NOT PAIRED. FISH COLLECTIONS: FRP23-001 HITCH 290 0 FIN CLIP ETOH; FRP23-500 CHISAL-F 37 0 WHOLE ICE; FRP23-501 THRSTI 44 0 WHOLE ETOH","true","Mudsucker","MA;AC;ED;GP","Browns Island","01/12/2023","BROW-CH-MAIN","3=66-100% clouds","1=wind 1-3 mph; scaley ripples"," SE"," 2=ebb",20,10.2,9.77,263,7.3,58.4,0.88,0.74,23.2," 1=absent",1," Inside",NA," false"," ",2023-01-12,2023,1,"2023-01-12 10:52","Winter"
"16",7256,12260,"LAMOPE07-CHIP-12JAN2023","true","Seine","LAMOPE",""," 1. No twists; snags; or tears"," 2= against flow"," ",1.2,NA,NA,NA,"","11:40","",NA,NA,NA,38.059639,121.918052,NA,NA,NA,NA,NA,NA,NA,NA,NA,NA," Boat"," ",NA,NA,NA,NA,NA,NA,NA,NA," false"," "," ","","1",NA," 0%"," ",NA," "," GPS 5; ACCURACY 2M. NOT PAIRED.","true","Mudsucker","MA;AC;ED;GP","Chipps Island","01/12/2023","CHIP-UNK","2=33-66% clouds","1=wind 1-3 mph; scaley ripples"," SE"," 2=ebb",19,10.2,9.02,555,7.2,66.9,0.86,0.6,17," 1=absent",1," Inside",NA," false"," ",2023-01-12,2023,1,"2023-01-12 11:40","Winter"
"17",7257,12261,"LAMOPE08-CHIP-12JAN2023","true","Seine","LAMOPE",""," 1. No twists; snags; or tears"," 2= against flow"," ",2.2,NA,NA,NA,"","12:10","",NA,NA,NA,38.057301,121.920764,NA,NA,NA,NA,NA,NA,NA,NA,NA,NA," Boat"," ",NA,NA,NA,NA,NA,NA,NA,NA," false"," "," ","","1",NA," 0%"," ",NA," "," GPS 5; ACCURACY 2M. NOT PAIRED.","true","Mudsucker","MA;AC;ED;GP","Chipps Island","01/12/2023","CHIP-UNK","3=66-100% clouds","1=wind 1-3 mph; scaley ripples"," NE"," 2=ebb",24,10.2,9.32,439,7.3,67,0.87,0.56,16.3," 1=absent",1," Inside",NA," false"," ",2023-01-12,2023,1,"2023-01-12 12:10","Winter"
"18",7258,12262,"LAMOPE09-HONK-12JAN2023","true","Seine","LAMOPE",""," 1. No twists; snags; or tears"," 2= against flow"," ",0.6,NA,NA,NA,"","12:32","",NA,NA,NA,38.079453,121.91,NA,NA,NA,NA,NA,NA,NA,NA,NA,NA," Boat"," ",NA,NA,NA,NA,NA,NA,NA,NA," false"," "," ","","1",NA," 0%"," ",NA," "," GPS 5; ACCURACY 2M. NOT PAIRED.","true","Mudsucker","MA;AC;ED;GP","Honker-Spoonbill","01/12/2023","HONK-HONK","2=33-66% clouds","1=wind 1-3 mph; scaley ripples"," NE"," 2=ebb",14,10.7,10.45,311,7.5,88.7,0.92,0.61,14.6," 1=absent",1," Inside",NA," false"," ",2023-01-12,2023,1,"2023-01-12 12:32","Winter"
"19",7259,12263,"LAMOPE10-HONK-12JAN2023","true","Seine","LAMOPE",""," 1. No twists; snags; or tears"," 2= against flow"," ",1.9,NA,NA,NA,"","12:58","",NA,NA,NA,38.071505,121.910893,NA,NA,NA,NA,NA,NA,NA,NA,NA,NA," Boat"," ",NA,NA,NA,NA,NA,NA,NA,NA," false"," "," ","","1",NA," 1-33%"," ",NA," "," GPS 5; ACCURACY 2M. NOT PAIRED. ","true","Mudsucker","MA;AC;ED;GP","Honker-Spoonbill","01/12/2023","HONK-HONK","2=33-66% clouds","1=wind 1-3 mph; scaley ripples"," NE"," 2=ebb",10,10.7,10.22,233,7.5,104.3,0.93,0.64,14.3," 1=absent",1," Inside",NA," false"," ",2023-01-12,2023,1,"2023-01-12 12:58","Winter"
"20",7260,12264,"LAMOPE11-CHIP-12JAN2023","true","Seine","LAMOPE",""," 1. No twists; snags; or tears"," 2= against flow"," ",2.2,NA,NA,NA,"","13:28","",NA,NA,NA,38.06507,121.911757,NA,NA,NA,NA,NA,NA,NA,NA,NA,NA," Boat"," ",NA,NA,NA,NA,NA,NA,NA,NA," false"," "," ","","1",NA," 0%"," Garmin 5",2," "," GPS 5; ACCURACY 2. NOT PAIRED. FRP23-502 CHISAL-F 37 0 WHOLE ICE","true","Mudsucker","MA;AC;ED;GP","Chipps Island","01/12/2023","CHIP-UNK","3=66-100% clouds","1=wind 1-3 mph; scaley ripples"," NE"," 2=ebb",14,10.5,9.63,270,7.3,95.2,0.94,0.65,14.9," 1=absent",1," Inside",NA," false"," ",2023-01-12,2023,1,"2023-01-12 13:28","Winter"
"21",7261,12265,"LAMOPE12-HONK-12JAN2023","true","Seine","LAMOPE",""," 2. Partial twist; snag; or tear"," 2= against flow"," ",5.6,NA,NA,NA,"","14:03","",NA,NA,NA,38.055171,121.894993,NA,NA,NA,NA,NA,NA,NA,NA,NA,NA," Boat"," ",NA,NA,NA,NA,NA,NA,NA,NA," false"," "," ","","1",NA," 0%"," ",NA," "," GPS 5; ACCURACY 2. NOT PAIRED. Code 2: Depth","true","Mudsucker","MA;AC;ED;GP","Honker-Spoonbill","01/12/2023","HONK-SPOON","3=66-100% clouds","1=wind 1-3 mph; scaley ripples"," NE"," 2=ebb",12,10.5,10.13,153,7.5,97.4,0.94,0.6,14.4," 1=absent",1," Inside",NA," false"," ",2023-01-12,2023,1,"2023-01-12 14:03","Winter"
"22",7262,12266,"LAMOPE13-BROA-12JAN2023","true","Seine","LAMOPE",""," 2. Partial twist; snag; or tear"," 2= against flow"," ",3.4,NA,NA,NA,"","14:26","",NA,NA,NA,38.048597,121.848221,NA,NA,NA,NA,NA,NA,NA,NA,NA,NA," Boat"," ",NA,NA,NA,NA,NA,NA,NA,NA," false"," "," ","","1",NA," 0%"," ",NA," "," GPS 5; ACCURACY 2. NOT PAIRED. SEINE CODE 2 -DEPTH","true","Mudsucker","MA;AC;ED;GP","Broad Slough","01/12/2023","BROA-INT","3=66-100% clouds","1=wind 1-3 mph; scaley ripples"," E"," 4=flood",21,10.6,9.85,211,7.4,62.4,0.81,0.69,22.6," 1=absent",1," Inside",NA," false"," ",2023-01-12,2023,1,"2023-01-12 14:26","Winter"
"23",7263,12267,"LAMOPE14-BROA-12JAN2023","true","Seine","LAMOPE",""," 2. Partial twist; snag; or tear"," 2= against flow"," ",3.8,NA,NA,NA,"","14:42","",NA,NA,NA,38.038558,121.844333,NA,NA,NA,NA,NA,NA,NA,NA,NA,NA," Boat"," ",NA,NA,NA,NA,NA,NA,NA,NA," false"," "," ","","1",NA," 0%"," ",NA," "," GPS 5; ACCURACY 2. NOT PAIRED. SEINE CODE 2 - DEPTH","true","Mudsucker","MA;AC;ED;GP","Broad Slough","01/12/2023","BROA-INT","3=66-100% clouds","1=wind 1-3 mph; scaley ripples"," E"," 4=flood",17,10.6,10.14,206,7.4,68.7,0.85,0.71,22.6," 1=absent",1," Inside",NA," false"," ",2023-01-12,2023,1,"2023-01-12 14:42","Winter"
"24",7264,12268,"LAMOPE15-BROA-12JAN2023","true","Seine","LAMOPE",""," 1. No twists; snags; or tears"," 2= against flow"," ",3,NA,NA,NA,"","15:01","",NA,NA,NA,38.032679,121.839569,NA,NA,NA,NA,NA,NA,NA,NA,NA,NA," Boat"," ",NA,NA,NA,NA,NA,NA,NA,NA," false"," "," ","","1",NA," 0%"," ",NA," "," GPS 5; ACCURACY 2. NOT PAIRED.","true","Mudsucker","MA;AC;ED;GP","Broad Slough","01/12/2023","BROA-INT","3=66-100% clouds","1=wind 1-3 mph; scaley ripples"," E"," 4=flood",17,10.4,10.12,214,7.4,65.6,0.86,0.73,23.4," 1=absent",1," Inside",NA," false"," ",2023-01-12,2023,1,"2023-01-12 15:01","Winter"
"25",7265,12269,"LAMOPE01-PEYT-19JAN2023","true","Seine","LAMOPE",""," 1. No twists; snags; or tears"," 2= against flow"," ",0.7,NA,NA,NA,"","07:35","",NA,NA,NA,38.226707,122.034588,NA,NA,NA,NA,NA,NA,NA,NA,NA,NA," Boat"," ",NA,NA,NA,NA,NA,NA,NA,NA," false"," "," ","","1",NA," 0%"," ",NA," "," GPS 5; ACCURACY 2M. NOT PAIRED. SAMPLED THROUGH TULE. FRP23-503 THRSTI 36 0 WHOLE ETOH","true","Mudsucker","AC;ED;GP;KS","Peytonia-Suisun","01/19/2023","PEYT-PEYT","1=0-33% clouds","1=wind 1-3 mph; scaley ripples"," W"," 4=flood",22,10.3,7.95,1026,7.5,38.5,0.93,1.5,37.6," 1=absent",1," Inside",NA," false"," ",2023-01-19,2023,1,"2023-01-19 07:35","Winter"
"26",7266,12270,"LAMOPE02-PEYT-19JAN2023","true","Seine","LAMOPE",""," 1. No twists; snags; or tears"," 2= against flow"," ",2.7,NA,NA,NA,"","08:00","",NA,NA,NA,38.222181,122.04348,NA,NA,NA,NA,NA,NA,NA,NA,NA,NA," Boat"," ",NA,NA,NA,NA,NA,NA,NA,NA," false"," "," ","","1",NA," 0%"," Garmin 5",2," "," ","true","Mudsucker","AC;ED;GP;KS","Peytonia-Suisun","01/19/2023","PEYT-PEYT","1=0-33% clouds","1=wind 1-3 mph; scaley ripples"," W"," 4=flood",30,11.1,8.86,1064,7.6,24.3,0.94,1.58,34.3," 1=absent",1," Inside",NA," false"," ",2023-01-19,2023,1,"2023-01-19 08:00","Winter"
"27",7267,12271,"LAMOPE03-WING-19JAN2023","true","Seine","LAMOPE",""," 1. No twists; snags; or tears"," 2= against flow"," ",0.8,NA,NA,NA,"","08:20","",NA,NA,NA,38.222538,122.041185,NA,NA,NA,NA,NA,NA,NA,NA,NA,NA," Boat"," ",NA,NA,NA,NA,NA,NA,NA,NA," false"," "," ","","1",NA," 0%"," ",NA," "," GPS 5; ACCURACY 2. NOT PAIRED","true","Mudsucker","AC;ED;GP;KS","Wings Landing","01/19/2023","WING-TP-INT","1=0-33% clouds","1=wind 1-3 mph; scaley ripples"," E"," 4=flood",12,8.9,9,1061,7.6,63.8,1.15,1.73,34.5," 1=absent",1," Inside",NA," false"," ",2023-01-19,2023,1,"2023-01-19 08:20","Winter"
"28",7268,12272,"LAMOPE04-WING-19JAN2023","true","Seine","LAMOPE",""," 1. No twists; snags; or tears"," 2= against flow"," ",0.8,NA,NA,NA,"","08:35","",NA,NA,NA,38.220765,122.041146,NA,NA,NA,NA,NA,NA,NA,NA,NA,NA," Boat"," ",NA,NA,NA,NA,NA,NA,NA,NA," false"," "," ","","1",NA," 0%"," ",NA," "," GPS 5; ACCURACY 2. NOT PAIRED.","true","Mudsucker","AC;ED;GP;KS","Wings Landing","01/19/2023","WING-TP-INT","1=0-33% clouds","1=wind 1-3 mph; scaley ripples"," E"," 4=flood",21,10.9,8.8,1048,7.6,27,0.92,1.46,34.3," 1=absent",1," Inside",NA," false"," ",2023-01-19,2023,1,"2023-01-19 08:35","Winter"
"29",7269,12273,"LAMOPE05-WING-19JAN2023","true","Seine","LAMOPE",""," 1. No twists; snags; or tears"," 2= against flow"," ",1.1,NA,NA,NA,"","08:49","",NA,NA,NA,38.219083,122.039343,NA,NA,NA,NA,NA,NA,NA,NA,NA,NA," Boat"," ",NA,NA,NA,NA,NA,NA,NA,NA," false"," "," ","","1",NA," 0%"," ",NA," "," GPS 5; ACCURACY 2. NOT PAIRED","true","Mudsucker","AC;ED;GP;KS","Wings Landing","01/19/2023","WING-TP-INT","1=0-33% clouds","1=wind 1-3 mph; scaley ripples"," E"," 4=flood",20,9.3,8.23,969,7.5,43.6,0.98,1.44,37.6," 1=absent",1," Inside",NA," false"," ",2023-01-19,2023,1,"2023-01-19 08:49","Winter"
"30",7270,12274,"LAMOPE06-PEYT-19JAN2023","true","Seine","LAMOPE",""," 1. No twists; snags; or tears"," 2= against flow"," ",1.3,NA,NA,NA,"","09:15","",NA,NA,NA,38.210755,122.035481,NA,NA,NA,NA,NA,NA,NA,NA,NA,NA," Boat"," ",NA,NA,NA,NA,NA,NA,NA,NA," false"," "," ","","1",NA," 0%"," ",NA," "," GPS 5; ACCURACY 3. NOT PAIRED. PULLED NET THROUGH TULE (CALIFORNICUS). FRP23-504 THRSTI @32","true","Mudsucker","AC;ED;GP;KS","Peytonia-Suisun","01/19/2023","PEYT-SUIS","2=33-66% clouds","1=wind 1-3 mph; scaley ripples"," E"," 4=flood",17,10.5,7.95,1091,7.5,56.3,1,1.39,34.8," 1=absent",1," Inside",NA," false"," ",2023-01-19,2023,1,"2023-01-19 09:15","Winter"
"31",7271,12275,"LAMOPE07-NURS-19JAN2023","true","Seine","LAMOPE",""," 1. No twists; snags; or tears"," 2= against flow"," ",2.3,NA,NA,NA,"","10:20","",NA,NA,NA,38.17696,121.920852,NA,NA,NA,NA,NA,NA,NA,NA,NA,NA," Boat"," ",NA,NA,NA,NA,NA,NA,NA,NA," false"," "," ","","1",NA," 1-33%"," ",NA," "," GPS 5; ACCURACY 2. NOT PAIRED. PULLED NET THROUGH TULE (CALIFORNICUS)","true","Mudsucker","AC;ED;GP;KS","Nurse-Denverton","01/19/2023","NURS-LHB-SW","1=0-33% clouds","2= wind 4-7 mph; small wavelets"," NW"," 4=flood",12,10.1,8.56,894,7.3,97.8,1.07,1.06,22.9," 1=absent",1," Inside",NA," false"," ",2023-01-19,2023,1,"2023-01-19 10:20","Winter"
"32",7272,12276,"LAMOPE08-NURS-19JAN2023","true","Seine","LAMOPE",""," 2. Partial twist; snag; or tear"," 2= against flow"," ",3.9,NA,NA,NA,"","10:42","",NA,NA,NA,38.176481,121.910579,NA,NA,NA,NA,NA,NA,NA,NA,NA,NA," Boat"," ",NA,NA,NA,NA,NA,NA,NA,NA," false"," "," ","","1",NA," 0%"," ",NA," "," GPS 5; ACCURACY 5. NOT PAIRED. CODE 2 - DEPTH","true","Mudsucker","AC;ED;GP;KS","Nurse-Denverton","01/19/2023","NURS-EXT-ARNO-SW","1=0-33% clouds","2= wind 4-7 mph; small wavelets"," NW"," 4=flood",14,10.1,8.72,904,7.3,90.5,1.06,1.01,23.3," 1=absent",1," Inside",NA," false"," ",2023-01-19,2023,1,"2023-01-19 10:42","Winter"
"33",7273,12277,"LAMOPE09-NURS-19JAN2023","true","Seine","LAMOPE",""," 1. No twists; snags; or tears"," 2= against flow"," ",1.8,NA,NA,NA,"","11:04","",NA,NA,NA,38.182996,121.915176,NA,NA,NA,NA,NA,NA,NA,NA,NA,NA," Boat"," ",NA,NA,NA,NA,NA,NA,NA,NA," false"," "," ","","1",NA," 1-33%"," ",NA," "," GPS 5; ACCURACY 2. NOT PAIRED.","true","Mudsucker","AC;ED;GP;KS","Nurse-Denverton","01/19/2023","NURS-LHB-NE","1=0-33% clouds","1=wind 1-3 mph; scaley ripples"," NE"," 4=flood",13,10.2,8.68,886,7.3,89.5,1.04,0.97,23.2," 1=absent",1," Inside",NA," false"," ",2023-01-19,2023,1,"2023-01-19 11:04","Winter"
"34",7274,12278,"LAMOPE10-ARNO-19JAN2023","true","Seine","LAMOPE",""," 1. No twists; snags; or tears"," 2= against flow"," ",1.6,NA,NA,NA,"","11:25","",NA,NA,NA,38.175538,121.907831,NA,NA,NA,NA,NA,NA,NA,NA,NA,NA," Boat"," ",NA,NA,NA,NA,NA,NA,NA,NA," false"," "," ","","1",NA," 0%"," ",NA," "," GPS 5; ACCURACY 2. NOT PAIRED. THRSTI collected in ETOH FRP23-505","true","Mudsucker","AC;ED;GP;KS","Arnold Slough","01/19/2023","ARNO-CH-NE","1=0-33% clouds","1=wind 1-3 mph; scaley ripples"," NE"," 4=flood",12,10,8.73,898,7.3,84.2,1.02,1.04,24," 1=absent",1," Inside",NA," false"," ",2023-01-19,2023,1,"2023-01-19 11:25","Winter"
"35",7275,12279,"LAMOPE11-ARNO-19JAN2023","true","Seine","LAMOPE",""," 1. No twists; snags; or tears"," 2= against flow"," ",0.9,NA,NA,NA,"","11:55","",NA,NA,NA,38.180359,121.900047,NA,NA,NA,NA,NA,NA,NA,NA,NA,NA," Boat"," ",NA,NA,NA,NA,NA,NA,NA,NA," false"," "," ","","1",NA," 0%"," ",NA," "," GPS 5; ACCURACY 2M. NOT PAIRED.","true","Mudsucker","AC;ED;GP;KS","Arnold Slough","01/19/2023","ARNO-UNK","1=0-33% clouds","3= wind 8-12 mph; large wavelets"," NE"," 4=flood",15,9.1,8.53,1316,7.2,54.5,0.99,1.36,37.6," 1=absent",1," Inside",NA," false"," ",2023-01-19,2023,1,"2023-01-19 11:55","Winter"
"36",7276,12280,"LAMOPE12-ARNO-19JAN2023","true","Seine","LAMOPE",""," 1. No twists; snags; or tears"," 2= against flow"," ",1,NA,NA,NA,"","12:12","",NA,NA,NA,38.177095,121.900665,NA,NA,NA,NA,NA,NA,NA,NA,NA,NA," Boat"," ",NA,NA,NA,NA,NA,NA,NA,NA," false"," "," ","","1",NA," 1-33%"," ",NA," "," GPS 5; ACCURACY 2M. NOT PAIRED. WAKASA=FRP23-506. CHISAL-F=FRP23-507. UNID PLANT = TERRESTRIAL GRASS MAYBE.","true","Mudsucker","AC;ED;GP;KS","Arnold Slough","01/19/2023","ARNO-UNK","1=0-33% clouds","3= wind 8-12 mph; large wavelets"," NE"," 4=flood",14,9.6,9.08,950,7.3,80.3,1.04,1.05,23.4," 1=absent",1," Inside",NA," false"," ",2023-01-19,2023,1,"2023-01-19 12:12","Winter"
"37",7281,12281,"LAMOPE01-LIBE-25JAN2023","true","Seine","LAMOPE",""," 1. No twists; snags; or tears"," 2= against flow"," ",1.1,NA,NA,NA,"","08:42","",NA,NA,NA,38.298788,121.680292,NA,NA,NA,NA,NA,NA,NA,NA,NA,NA," Boat"," ",NA,NA,NA,NA,NA,NA,NA,NA," false"," "," ","","1",NA," 1-33%"," ",NA," "," NOT PAIRED. GPS 5; ACCURACY 2M. LEIGH SANDERS IS A GUEST. UNID SHRIMPS HAD BROKEN ROSTRUMS.","true","Mudsucker","ED;GU;GN;GP","Liberty Island","01/25/2023","LIBE_UNK","1=0-33% clouds","1=wind 1-3 mph; scaley ripples"," N"," 1=high slack",12,7.7,9.14,250,7.5,98.5,1.06,0.65,16.6," 1=absent",1," Inside",NA," false"," Guest: Leigh Sanders",2023-01-25,2023,1,"2023-01-25 08:42","Winter"
"38",7282,12282,"LAMOPE02-LIBE-25JAN2023","true","Seine","LAMOPE",""," 1. No twists; snags; or tears"," 2= against flow"," ",1.5,NA,NA,NA,"","09:26","",NA,NA,NA,38.291193,121.678204,NA,NA,NA,NA,NA,NA,NA,NA,NA,NA," Boat"," ",NA,NA,NA,NA,NA,NA,NA,NA," false"," "," ","","1",NA," 1-33%"," ",NA," "," GPS 5; ACCURACY 3M. ","true","Mudsucker","ED;GU;GN;GP","Liberty Island","01/25/2023","LIBE_UNK","1=0-33% clouds","1=wind 1-3 mph; scaley ripples"," N"," 1=high slack",11,7.1,9.25,271,7.5,109.5,1.18,0.77,17," 1=absent",1," Inside",NA," false"," LEIGH SANDERS - GUEST",2023-01-25,2023,1,"2023-01-25 09:26","Winter"
"39",7283,12283,"LAMOPE03-LOWE-25JAN2023","true","Seine","LAMOPE",""," 2. Partial twist; snag; or tear"," 1= with flow"," ",0.9,NA,NA,NA,"","10:30","",NA,NA,NA,38.349324,121.679599,NA,NA,NA,NA,NA,NA,NA,NA,NA,NA," Crew Members and Boat"," ",NA,NA,NA,NA,NA,NA,NA,NA," false"," "," ","","1",NA," 0%"," ",NA," "," NOT PAIRED. GPS 5; ACCURACY 2M. PHYSICALLY CANNOT TURN BOAT AROUND TO TOW AGAINST (CODE 2). 57 PRICKLY SCULPIN WAS VERY GRAVID. ","true","Mudsucker","ED;GU;GN;GP","Lower Yolo Ranch","01/25/2023","LOWE-CH-W","1=0-33% clouds","0=Calm; glassy"," N"," 2=ebb",7,7.3,5.3,290,7.2,214.5,1.66,1.68,14.2," 1=absent",1," Inside",NA," false"," LEIGH SANDERS (GUEST)",2023-01-25,2023,1,"2023-01-25 10:30","Winter"
"40",7284,12284,"LAMOPE04-LOWE-25JAN2023","true","Seine","LAMOPE",""," 1. No twists; snags; or tears"," 2= against flow"," ",1.1,NA,NA,NA,"","11:11","",NA,NA,NA,38.355914,121.654825,NA,NA,NA,NA,NA,NA,NA,NA,NA,NA," Boat"," ",NA,NA,NA,NA,NA,NA,NA,NA," false"," "," ","","1",NA," 1-33%"," ",NA," "," NOT PAIRED. GPS 5; ACCURACY 2M. ","true","Mudsucker","ED;GU;GN;GP","Lower Yolo Ranch","01/25/2023","LOWE-CH-NE","1=0-33% clouds","1=wind 1-3 mph; scaley ripples"," N"," 2=ebb",14,7.6,5.35,310,7.2,75.2,1.05,0.76,21.5," 1=absent",1," Inside",NA," false"," ",2023-01-25,2023,1,"2023-01-25 11:11","Winter"
"41",7285,12285,"LAMOPE05-LOWE-25JAN2023","true","Seine","LAMOPE",""," 1. No twists; snags; or tears"," 2= against flow"," ",2.6,NA,NA,NA,"","11:49","",NA,NA,NA,38.348953,121.662624,NA,NA,NA,NA,NA,NA,NA,NA,NA,NA," Boat"," ",NA,NA,NA,NA,NA,NA,NA,NA," false"," "," ","","1",NA," 1-33%"," ",NA," "," NOT PAIRED. GPS 5; ACCURACY 2M. STRONG EBB. ","true","Mudsucker","ED;GU;GN;GP","Lower Yolo Ranch","01/25/2023","LOWE-CH-ENTRANCE-S","1=0-33% clouds","0=Calm; glassy"," N"," 2=ebb",9,8.1,7.56,308,7.4,101.8,1.14,0.92,18," 1=absent",1," Inside",NA," false"," LEIGH SANDERS IS GUEST",2023-01-25,2023,1,"2023-01-25 11:49","Winter"
"42",7286,12286,"LAMOPE06-FLYW-25JAN2023","true","Seine","LAMOPE",""," 1. No twists; snags; or tears"," 2= against flow"," ",1.5,NA,NA,NA,"","12:24","",NA,NA,NA,38.365055,121.642861,NA,NA,NA,NA,NA,NA,NA,NA,NA,NA," Boat"," ",NA,NA,NA,NA,NA,NA,NA,NA," false"," "," ","","1",NA," 0%"," ",NA," "," NOT PAIRED. GPS 5; ACCURACY 2M. SPLITTAIL HAS TUBERCLES ON HEAD","true","Mudsucker","ED;GU;GN;GP","Flyway Farms","01/25/2023","FLYW-CH-N","1=0-33% clouds","1=wind 1-3 mph; scaley ripples"," N"," 2=ebb",9,9.3,6.02,279,7.2,97.6,1.04,0.83,17.4," 1=absent",1," Inside",NA," false"," LEIGH SANDERS IS GUEST",2023-01-25,2023,1,"2023-01-25 12:24","Winter"
"43",7287,12287,"LAMOPE07-FLYW-25JAN2023","true","Seine","LAMOPE",""," 1. No twists; snags; or tears"," 2= against flow"," ",2.1,NA,NA,NA,"","12:57","",NA,NA,NA,38.361017,121.643026,NA,NA,NA,NA,NA,NA,NA,NA,NA,NA," Boat"," ",NA,NA,NA,NA,NA,NA,NA,NA," false"," "," ","","1",NA," 0%"," ",NA," "," NOT PAIRED. GPS 5; ACCURACY 3M. ","true","Mudsucker","ED;GU;GN;GP","Flyway Farms","01/25/2023","FLYW-CH-N","1=0-33% clouds","1=wind 1-3 mph; scaley ripples"," N"," 2=ebb",9,9.3,6.2,281,7.3,107.9,1.11,0.85,16.7," 1=absent",1," Inside",NA," false"," LS LEIGH SANDERS (GUEST)",2023-01-25,2023,1,"2023-01-25 12:57","Winter"
"44",7288,12288,"LAMOPE08-STAI-25JAN2023","true","Seine","LAMOPE",""," 1. No twists; snags; or tears"," 2= against flow"," ",3.3,NA,NA,NA,"","13:15","",NA,NA,NA,38.350014,121.656044,NA,NA,NA,NA,NA,NA,NA,NA,NA,NA," Boat"," ",NA,NA,NA,NA,NA,NA,NA,NA," false"," "," ","","3",NA," 0%"," ",NA," "," NOT PAIRED. GPS 5; ACCURACY 2M.","true","Mudsucker","ED;GU;GN;GP","Stairsteps-Liberty Cut","01/25/2023","STAI-N","1=0-33% clouds","1=wind 1-3 mph; scaley ripples"," N"," 2=ebb",10,8.3,8.42,331,7.4,108.1,1.1,0.78,18," 1=absent",1," Inside",NA," false"," LS = LEIGH SANDERS (GUEST)",2023-01-25,2023,1,"2023-01-25 13:15","Winter"
"45",7289,12289,"LAMOPE09-STAI-25JAN2023","true","Seine","LAMOPE",""," 2. Partial twist; snag; or tear"," 2= against flow"," ",5.1,NA,NA,NA,"","13:52","",NA,NA,NA,38.327418,121.667073,NA,NA,NA,NA,NA,NA,NA,NA,NA,NA," Boat"," ",NA,NA,NA,NA,NA,NA,NA,NA," false"," "," ","","3",NA," 0%"," ",NA," "," NOT PAIRED. GPS 5; ACCURACY 2M. 2 SEINE CODE B/C OF DEPTH. MISSIL HAD SOME INTERNAL BLEEDING NEAR ANUS.","true","Mudsucker","ED;GU;GN;GP","Stairsteps-Liberty Cut","01/25/2023","STAI-LIBE","1=0-33% clouds","1=wind 1-3 mph; scaley ripples"," N"," 2=ebb",13,8.3,8.54,322,7.4,103.2,1.06,0.79,18," 1=absent",1," Inside",NA," false"," LS = LEIGH SANDERS (GUEST) ",2023-01-25,2023,1,"2023-01-25 13:52","Winter"
"46",7290,12290,"LAMOPE10-STAI-25JAN2023","true","Seine","LAMOPE",""," 1. No twists; snags; or tears"," 2= against flow"," ",2.8,NA,NA,NA,"","14:15","",NA,NA,NA,38.303006,121.667441,NA,NA,NA,NA,NA,NA,NA,NA,NA,NA," Boat"," ",NA,NA,NA,NA,NA,NA,NA,NA," false"," "," ","","3",NA," 1-33%"," ",NA," "," NOT PAIRED. GPS 5; ACCURACY 2M.","true","Mudsucker","ED;GU;GN;GP","Stairsteps-Liberty Cut","01/25/2023","STAI-LIBE","1=0-33% clouds","1=wind 1-3 mph; scaley ripples"," N"," 2=ebb",13,8.2,8.41,302,7.4,101.8,1.04,0.8,17.6," 1=absent",1," Inside",NA," false"," LS = LEIGH SANDERS (GUEST)",2023-01-25,2023,1,"2023-01-25 14:15","Winter"
"47",7291,12291,"LAMOPE11-LIBE-25JAN2023","true","Seine","LAMOPE",""," 1. No twists; snags; or tears"," 2= against flow"," ",1.8,NA,NA,NA,"","14:48","",NA,NA,NA,38.25602,121.686229,NA,NA,NA,NA,NA,NA,NA,NA,NA,NA," Boat"," ",NA,NA,NA,NA,NA,NA,NA,NA," false"," "," ","","3",NA," 34-66%"," ",NA," "," NOT PAIRED. GPS 5; ACCURACY 2M. MANY TINY SNAILS IN SAV. UNID SHRIMP DUE TO BROKEN ROSTRUM","true","Mudsucker","ED;GU;GN;GP","Liberty Island","01/25/2023","LIBE_UNK","1=0-33% clouds","2= wind 4-7 mph; small wavelets"," N"," 4=flood",13,8.7,9.6,252,7.5,101.5,1.08,0.66,16.1," 1=absent",1," Inside",NA," false"," LEIGH SANDERS IS GUEST",2023-01-25,2023,1,"2023-01-25 14:48","Winter"
"48",7292,12292,"LAMOPE01-TULE-26JAN2023","true","Seine","LAMOPE",""," 1. No twists; snags; or tears"," 2= against flow"," ",1.7,NA,NA,NA,"","08:01","",NA,NA,NA,38.128945,121.988682,NA,NA,NA,NA,NA,NA,NA,NA,NA,NA," Boat"," ",NA,NA,NA,NA,NA,NA,NA,NA," false"," "," ","","1",NA," 0%"," ",NA," "," NOT PAIRED. GPS 5; ACCURACY 2M. REPAIRED A 4-5 INCH SECTION ALONG FLOAT LINE THAT CAME DISCONNECTED","true","Mudsucker","ED;SH;GP;KS","Tule Red","01/26/2023","TULE-CH-LG-M","1=0-33% clouds","1=wind 1-3 mph; scaley ripples"," NE"," 2=ebb",16,8.5,11.02,657,7.6,108.3,0.63,1.14,13.9," 1=absent",2," Inside",NA," false"," ",2023-01-26,2023,1,"2023-01-26 08:01","Winter"
"49",7293,12293,"LAMOPE02-TULE-26JAN2023","true","Seine","LAMOPE",""," 1. No twists; snags; or tears"," 2= against flow"," ",1.7,NA,NA,NA,"","08:25","",NA,NA,NA,38.127657,121.987201,NA,NA,NA,NA,NA,NA,NA,NA,NA,NA," Boat"," ",NA,NA,NA,NA,NA,NA,NA,NA," false"," "," ","","1",NA," 0%"," ",NA," "," NOT PAIRED. GPS 5; ACCURACY 2M ","true","Mudsucker","ED;SH;GP;KS","Tule Red","01/26/2023","TULE-CH-LG-M","1=0-33% clouds","1=wind 1-3 mph; scaley ripples"," NE"," 2=ebb",13,8.6,11.1,679,7.6,102.7,0.63,1.18,13.9," 1=absent",2," Inside",NA," false"," ",2023-01-26,2023,1,"2023-01-26 08:25","Winter"
"50",7294,12294,"LAMOPE03-TULE-26JAN2023","true","Seine","LAMOPE",""," 1. No twists; snags; or tears"," 2= against flow"," ",1.5,NA,NA,NA,"","08:49","",NA,NA,NA,38.133493,121.992418,NA,NA,NA,NA,NA,NA,NA,NA,NA,NA," Boat"," ",NA,NA,NA,NA,NA,NA,NA,NA," false"," "," ","","1",NA," 0%"," ",NA," "," NOT PAIRED. GPS 5. PATCHED ANOTHER SECTION ALONG FLOAT LINE PRIOR TO THIS SAMPLE. DEPTH WAS SHALLOW; PROBABLY 1.4-1.7 AVG TO 1.5","true","Mudsucker","ED;SH;GP;KS","Tule Red","01/26/2023","TULE-CH-LG-NW","1=0-33% clouds",""," NE"," 2=ebb",12,8.2,10.74,804,7.4,86.4,0.6,1.23,15.8," 1=absent",2," Inside",NA," false"," ",2023-01-26,2023,1,"2023-01-26 08:49","Winter"
"51",7295,12296,"LAMOPE04-RYER-26JAN2023","true","Seine","LAMOPE",""," 1. No twists; snags; or tears"," 2= against flow"," ",1.4,NA,NA,NA,"","09:34","",NA,NA,NA,38.079369,122.011133,NA,NA,NA,NA,NA,NA,NA,NA,NA,NA," Boat"," ",NA,NA,NA,NA,NA,NA,NA,NA," false"," "," ","","1",NA," 0%"," ",NA," "," NOT PAIRED. GPS 5; ACCURACY 2M. FIRST SET; CODE 3 - TWIST IN COD END; RESET UPSTREAM; SAME ENVIRONMENTALS","true","Mudsucker","ED;SH;GP;KS","Ryer Island","01/26/2023","RYER-CH-LG-M","1=0-33% clouds","1=wind 1-3 mph; scaley ripples"," NE"," 2=ebb",14,8.2,10,488,7.3,100,0.44,0.58,14.7," 1=absent",2," Inside",NA," false"," ",2023-01-26,2023,1,"2023-01-26 09:34","Winter"
"52",7301,12301,"LAMOPE05-RYER-26JAN2023","true","Seine","LAMOPE",""," 2. Partial twist; snag; or tear"," 2= against flow"," ",3.8,NA,NA,NA,"","09:49","",NA,NA,NA,38.081122,122.017596,NA,NA,NA,NA,NA,NA,NA,NA,NA,NA," Boat"," ",NA,NA,NA,NA,NA,NA,NA,NA," false"," "," ","","1",NA," 0%"," ",NA," "," NOT PAIRED. GPS 5; ACCURACY 2M. CODE 2 - DEPTH","true","Mudsucker","ED;SH;GP;KS","Ryer Island","01/26/2023","RYER-CH-LG-M","1=0-33% clouds","1=wind 1-3 mph; scaley ripples"," NE"," 2=ebb",16,8.4,10.19,364,7.4,77.2,0.45,0.57,14.7," 1=absent",2," Inside",NA," false"," ",2023-01-26,2023,1,"2023-01-26 09:49","Winter"
"53",7302,12302,"LAMOPE06-RYER-26JAN2023","true","Seine","LAMOPE",""," 1. No twists; snags; or tears"," 2= against flow"," ",1.6,NA,NA,NA,"","10:04","",NA,NA,NA,38.078306,122.013944,NA,NA,NA,NA,NA,NA,NA,NA,NA,NA," Boat"," ",NA,NA,NA,NA,NA,NA,NA,NA," false"," "," ","","1",NA," 0%"," Garmin 5",2," "," NOT PAIRED. GPS 5; ACCURACY 2M. MACOMA ID BY MA 2/9/23","true","Mudsucker","ED;SH;GP;KS","Ryer Island","01/26/2023","RYER-S","1=0-33% clouds","2= wind 4-7 mph; small wavelets"," NE"," 2=ebb",14,8.5,10.45,344,7.4,95.1,0.53,0.64,13.4," 1=absent",2," Inside",NA," false"," ",2023-01-26,2023,1,"2023-01-26 10:04","Winter"
"54",7303,12303,"LAMOPE07-GRIZ-26JAN2023","true","Seine","LAMOPE",""," 1. No twists; snags; or tears"," 2= against flow"," ",1.7,NA,NA,NA,"","10:41","",NA,NA,NA,38.11611,122.003821,NA,NA,NA,NA,NA,NA,NA,NA,NA,NA," Boat"," ",NA,NA,NA,NA,NA,NA,NA,NA," false"," "," ","","1",NA," 0%"," ",NA," "," NOT PAIRED. GPS 5; ACCURACY 6M. POTAMOCORBULA MOST LIKELY FROM LAMPARA #6. THRSHA WITH SOME BLEEDING.","true","Mudsucker","ED;SH;GP;KS","Grizzly Bay","01/26/2023","GRIZ-UNK","1=0-33% clouds","2= wind 4-7 mph; small wavelets"," NE"," 2=ebb",11,8.9,11.29,317,7.7,115.8,0.58,0.63,11.9," 1=absent",2," Inside",NA," false"," ",2023-01-26,2023,1,"2023-01-26 10:41","Winter"
"55",7304,12304,"LAMOPE08-GRIZ-26JAN2023","true","Seine","LAMOPE",""," 1. No twists; snags; or tears"," 2= against flow"," ",1.3,NA,NA,NA,"","11:03","",NA,NA,NA,38.130554,122.008894,NA,NA,NA,NA,NA,NA,NA,NA,NA,NA," Boat"," ",NA,NA,NA,NA,NA,NA,NA,NA," false"," "," ","","3",NA," 0%"," Garmin 5",6," "," NOT PAIRED. GPS 5; ACCURACY 6M. RIPPED HOLE IN COD END OF LAM01; SWITCH TO LAM03. STRBAS WITH VERY FEW STRIPES; MORE CHECKERED PATTERN.","true","Mudsucker","ED;SH;GP;KS","Grizzly Bay","01/26/2023","GRIZ-UNK","1=0-33% clouds","2= wind 4-7 mph; small wavelets"," NE"," 2=ebb",14,9,11.25,658,7.7,116.4,0.59,1,14.7," 1=absent",2," Inside",NA," false"," ",2023-01-26,2023,1,"2023-01-26 11:03","Winter"
"56",7305,12305,"LAMOPE09-GRIZ-26JAN2023","true","Seine","LAMOPE",""," 1. No twists; snags; or tears"," 2= against flow"," ",1,NA,NA,NA,"","11:21","",NA,NA,NA,38.135858,122.005474,NA,NA,NA,NA,NA,NA,NA,NA,NA,NA," Boat"," ",NA,NA,NA,NA,NA,NA,NA,NA," false"," "," ","","3",NA," 0%"," ",NA," "," NOT PAIRED. GPS 5; ACCURACY 3M. THRSTI - ETHANOL; COLLECTED; SEE BACK. CHISAL - ON ICE; COLLECTED; SEE BACK.","true","Mudsucker","ED;SH;GP;KS","Grizzly Bay","01/26/2023","GRIZ-UNK","1=0-33% clouds","2= wind 4-7 mph; small wavelets"," NE"," 2=ebb",13,9.4,11.15,656,7.7,103.2,0.57,1.03,13.7," 1=absent",2," Inside",NA," false"," ",2023-01-26,2023,1,"2023-01-26 11:21","Winter"
"57",7306,12306,"BEASEI01-TULE-30JAN2023","true","Seine","BEASEI",""," 2. Partial twist; snag; or tear"," 2= against flow"," ",0.5,NA,15,15,"","10:01","",NA,NA,NA,38.114449,121.97918,NA,NA,NA,NA,NA,NA,NA,NA,NA,NA," Crew Members"," ",NA,NA,NA,NA,NA,NA,NA,NA," false"," "," ","","1",NA," 1-33%"," ",NA," "," NOT PAIRED. GPS 5; ACCURACY 2M. MOSTLY DETRITUS/MUD IN COD END. YSI TAKEN ON A BUCKET. CODE 2 BECAUSE THERE WASNT MUCH OF A BEACH; BAD TO PULL THROUGH VEG","true","Truck","ED;GN","Tule Red","01/30/2023","TULE-TP-4","1=0-33% clouds","1=wind 1-3 mph; scaley ripples"," NW"," 1=high slack",NA,6.7,10.59,1787,7.5,60.2,0.68,1.09,21.4," 1=absent",2," Inside",NA," false"," ",2023-01-30,2023,1,"2023-01-30 10:01","Winter"
"58",7307,12307,"BEASEI02-TULE-30JAN2023","true","Seine","BEASEI",""," 2. Partial twist; snag; or tear"," 2= against flow"," ",1.2,NA,10,NA,"","10:45","",NA,NA,NA,38.123869,121.979686,NA,NA,NA,NA,NA,NA,NA,NA,NA,NA," Crew Members"," ",NA,NA,NA,NA,NA,NA,NA,NA," false"," "," ","","1",NA," 0%"," ",NA," "," NOT PAIRED. GPS 5; ACCURACY 3M. YSI FROM BUCKET. LOTS OF MYSIDS IN NET. SEINE CODE 2 BECAUSE OF MODIFIED SEINE; DROP OFF; AND THROUGH VEG - SEE PHOTOS FOR DETAILS.","true","Truck","ED;GN","Tule Red","01/30/2023","TULE-UNK","1=0-33% clouds","1=wind 1-3 mph; scaley ripples"," NW"," 2=ebb",NA,7.2,11.46,1025,7.7,99.9,0.64,1.14,16," 1=absent",2," Inside",NA," false"," ",2023-01-30,2023,1,"2023-01-30 10:45","Winter"
"59",7308,12308,"BEASEI01-HORS-01FEB2023","true","Seine","BEASEI",""," 1. No twists; snags; or tears"," 2= against flow"," ",1,NA,7.5,15,"","08:30","",NA,NA,NA,38.098448,121.709436,NA,NA,NA,NA,NA,NA,NA,NA,NA,NA," Crew Members"," ",NA,NA,NA,NA,NA,NA,NA,NA," false"," "," ","","2",NA," 0%"," ",NA," "," NOT PAIRED. GPS 5; ACCURACY 7.7 FT. GPS FROM PHONE. SPC FROM 26 AND 30 OFF FOR SONDE #2","true","Mudsucker","DMC;ED;GU;GP","Horseshoe Bend","02/01/2023","HORS-N","1=0-33% clouds","1=wind 1-3 mph; scaley ripples"," NW"," 4=flood",27,8.2,10.65,232,7.6,28.5,0.34,0.6,16.7," 1=absent",2," Inside",NA," false"," LS - LEIGH SANDERS GUEST",2023-02-01,2023,2,"2023-02-01 08:30","Winter"
"60",7309,12309,"BEASEI02-HORS-01FEB2023","true","Seine","BEASEI",""," 1. No twists; snags; or tears"," 2= against flow"," ",0.95,NA,12.5,15,"","08:50","",NA,NA,NA,38.081493,121.719445,NA,NA,NA,NA,NA,NA,NA,NA,NA,NA," Crew Members"," ",NA,NA,NA,NA,NA,NA,NA,NA," false"," "," ","","2",NA," 0%"," ",NA," "," NOT PAIRED. GPS 5; ACCURACY 7.7 FT. GPS FROM PHONE.","true","Mudsucker","DMC;ED;GU;GP","Horseshoe Bend","02/01/2023","HORS-M","1=0-33% clouds","1=wind 1-3 mph; scaley ripples"," NW"," 4=flood",40,8,10.67,236,7.6,22.1,0.34,0.55,19.1," 1=absent",2," Inside",NA," false"," LS = LEIGH SANDERS",2023-02-01,2023,2,"2023-02-01 08:50","Winter"
"61",7310,12310,"LAMOPE01-HORS-01FEB2023","true","Seine","LAMOPE",""," 2. Partial twist; snag; or tear"," 2= against flow"," ",3.8,NA,NA,NA,"","09:21","",NA,NA,NA,38.084428,121.734674,NA,NA,NA,NA,NA,NA,NA,NA,NA,NA," Boat"," ",NA,NA,NA,NA,NA,NA,NA,NA," false"," "," ","","3",NA," 0%"," ",2.3," "," NOT PAIRED. GPS from phone -; ACCURACY 7.7 FT. CODE 2 - DEPTH","true","Mudsucker","DMC;ED;GU;GP","Horseshoe Bend","02/01/2023","HORS-S","1=0-33% clouds","1=wind 1-3 mph; scaley ripples"," NW"," 4=flood",32,8.2,10.69,234,7.6,25.5,0.31,0.52,17.3," 1=absent",2," Inside",NA," false"," LS = LEIGH SANDERS  ",2023-02-01,2023,2,"2023-02-01 09:21","Winter"
"62",7311,12311,"LAMOPE02-HORS-01FEB2023","true","Seine","LAMOPE",""," 3. Complete twist; snag; or large tear"," 2= against flow"," ",NA,NA,NA,NA,"","10:00","",NA,NA,NA,38.08145,121.72089,NA,NA,NA,NA,NA,NA,NA,NA,NA,NA," Boat"," ",NA,NA,NA,NA,NA,NA,NA,NA," false"," "," ","","3",NA," "," ",NA," "," NOT PAIRED. GPS FROM LOWRANCE. CODE 3 - MAJOR SNAG DURING DEPLOYMENT; NET RIPPED; NO SPARE; RESCHEDULE DAY","true","Mudsucker","DMC;ED;GP","Horseshoe Bend","02/01/2023","HORS-M","1=0-33% clouds","1=wind 1-3 mph; scaley ripples"," NW"," 4=flood",37,8.2,10.68,237,7.6,24.8,0.3,0.53,18.1," 1=absent",2," Inside",NA," false"," ",2023-02-01,2023,2,"2023-02-01 10:00","Winter"
"63",7312,12312,"LAMOPE01-BROA-02FEB2023","true","Seine","LAMOPE",""," 2. Partial twist; snag; or tear"," 2= against flow"," ",5.7,NA,NA,NA,"","08:27","",NA,NA,NA,38.031763,121.838429,NA,NA,NA,NA,NA,NA,NA,NA,NA,NA," Boat"," ",NA,NA,NA,NA,NA,NA,NA,NA," false"," "," ","","3",NA," 0%"," ",NA," "," NOT PAIRED. GPS 5; ACCURACY 3M. CODE 2: DEPTH. ALL HOLES IN LAM03 REPAIRED YESTERDAY","true","Mudsucker","AC;ED;GU;GP;KS","Broad Slough","02/02/2023","BROA-INT","1=0-33% clouds","1=wind 1-3 mph; scaley ripples"," NE"," 4=flood",26,8.4,10.42,250,7.6,27,0.32,0.61,21.1," 1=absent",2," Inside",NA," false"," ",2023-02-02,2023,2,"2023-02-02 08:27","Winter"
"64",7313,12313,"LAMOPE02-BROA-02FEB2023","true","Seine","LAMOPE",""," 1. No twists; snags; or tears"," 2= against flow"," ",2.6,NA,NA,NA,"","08:50","",NA,NA,NA,38.044829,121.846553,NA,NA,NA,NA,NA,NA,NA,NA,NA,NA," Boat"," ",NA,NA,NA,NA,NA,NA,NA,NA," false"," "," ","","3",NA," 0%"," ",NA," "," NOT PAIRED. GPS 5; ACCURACY 2M. ","true","Mudsucker","AC;ED;GU;GP;KS","Broad Slough","02/02/2023","BROA-INT","1=0-33% clouds","0=Calm; glassy"," NE"," 4=flood",35,8.2,10.44,252,7.5,25,0.34,0.62,22.3," 1=absent",2," Inside",NA," false"," ",2023-02-02,2023,2,"2023-02-02 08:50","Winter"
"65",7314,12314,"LAMOPE03-BROA-02FEB2023","true","Seine","LAMOPE",""," 2. Partial twist; snag; or tear"," 2= against flow"," ",3.5,NA,NA,NA,"","09:17","",NA,NA,NA,38.052573,121.849001,NA,NA,NA,NA,NA,NA,NA,NA,NA,NA," Boat"," ",NA,NA,NA,NA,NA,NA,NA,NA," false"," "," ","","3",NA," 0%"," ",NA," "," NOT PAIRED. GPS 5; ACCURACY 2M. CODE 2: DEPTH","true","Mudsucker","AC;ED;GU;GP;KS","Broad Slough","02/02/2023","BROA-INT","2=33-66% clouds","0=Calm; glassy"," NE"," 4=flood",32,8.3,10.37,260,7.4,26.5,0.32,0.59,21.8," 1=absent",2," Inside",NA," false"," Leigh Sanders : Guest",2023-02-02,2023,2,"2023-02-02 09:17","Winter"
"66",7315,12315,"LAMOPE04-WINT-02FEB2023","true","Seine","LAMOPE",""," 2. Partial twist; snag; or tear"," 2= against flow"," ",3.5,NA,NA,NA,"","09:40","",NA,NA,NA,38.05269,121.854722,NA,NA,NA,NA,NA,NA,NA,NA,NA,NA," Boat"," ",NA,NA,NA,NA,NA,NA,NA,NA," false"," "," ","","3",NA," 0%"," ",NA," "," NOT PAIRED. GPS 5; ACCURACY 3M. VERY STRONG CURRENT. CODE 2: DEPTH AND NET GOT SHAPED WEIRDLY BECAUSE OF CURRENT","true","Mudsucker","AC;ED;GU;GP;KS","Winter Island","02/02/2023","WINT-CH-INT","3=66-100% clouds","1=wind 1-3 mph; scaley ripples"," NE"," 4=flood",36,8.3,10.4,259,7.4,28,0.31,0.6,20.9," 1=absent",2," Inside",NA," false"," Leigh Sanders: guest",2023-02-02,2023,2,"2023-02-02 09:40","Winter"
"67",7316,12316,"LAMOPE05-WINT-02FEB2023","true","Seine","LAMOPE",""," 1. No twists; snags; or tears"," 2= against flow"," ",1,NA,NA,NA,"","10:02","",NA,NA,NA,38.051769,121.851131,NA,NA,NA,NA,NA,NA,NA,NA,NA,NA," Boat"," ",NA,NA,NA,NA,NA,NA,NA,NA," false"," "," ","","3",NA," 0%"," ",NA," "," NOT PAIRED. GPS 5; ACCURACY 2M. ","true","Mudsucker","AC;ED;GU;GP;KS","Winter Island","02/02/2023","WINT-T-PONDS-E","3=66-100% clouds","1=wind 1-3 mph; scaley ripples"," NE"," 4=flood",39,7.8,9.76,408,7.3,22.4,0.64,0.62,23.3," 1=absent",2," Inside",NA," false"," Leigh Sanders: Guest",2023-02-02,2023,2,"2023-02-02 10:02","Winter"
"68",7317,12317,"LAMOPE06-WINT-02FEB2023","true","Seine","LAMOPE",""," 1. No twists; snags; or tears"," 2= against flow"," ",2.8,NA,NA,NA,"","10:30","",NA,NA,NA,38.047749,121.851606,NA,NA,NA,NA,NA,NA,NA,NA,NA,NA," Boat"," ",NA,NA,NA,NA,NA,NA,NA,NA," false"," "," ","","3",NA," 0%"," ",NA," "," NOT PAIRED. GPS 5; ACCURACY 2M. ","true","Mudsucker","AC;ED;GU;GP;KS","Winter Island","02/02/2023","WINT-CH-INT","3=66-100% clouds","1=wind 1-3 mph; scaley ripples"," NE"," 4=flood",32,8.3,10.19,299,7.4,25.8,0.31,0.54,22.4," 1=absent",2," Inside",NA," false"," DAY ENDED DUE TO CREW HEALTH ISSUE. Leigh Sanders: Guest",2023-02-02,2023,2,"2023-02-02 10:30","Winter"
"69",7318,12318,"LAMOPE01-DECK-08FEB2023","true","Seine","LAMOPE",""," 2. Partial twist; snag; or tear"," 2= against flow"," ",1.2,NA,NA,NA,"","07:44","",NA,NA,NA,38.084277,121.723997,NA,NA,NA,NA,NA,NA,NA,NA,NA,NA," Boat"," ",NA,NA,NA,NA,NA,NA,NA,NA," false"," "," ","","3",NA," 0%"," ",NA," "," NOT PAIRED. GPS 5; ACCURACY 2M. COD END ~25% FULL OF MUD/DETRITUS","true","Mudsucker","CB;ED;GU;GN;GP","Decker Island","02/08/2023","DECK-TP","1=0-33% clouds","0=Calm; glassy"," NA"," 2=ebb",50,8,10.61,247,7.5,16.3,0.27,0.46,17.5," 1=absent",2," Inside",NA," false"," LS = LEIGH SANDERS GUEST; EDNA",2023-02-08,2023,2,"2023-02-08 07:44","Winter"
"70",7319,12319,"LAMOPE02-HORS-08FEB2023","true","Seine","LAMOPE",""," 1. No twists; snags; or tears"," 2= against flow"," ",1.8,NA,NA,NA,"","08:43","",NA,NA,NA,38.080553,121.729004,NA,NA,NA,NA,NA,NA,NA,NA,NA,NA," Boat"," ",NA,NA,NA,NA,NA,NA,NA,NA," false"," "," ","","3",NA," 1-33%"," ",NA," "," NOT PAIRED. GPS 5; ACCURACY 2M. ","true","Mudsucker","CB;ED;GU;GN;GP","Horseshoe Bend","02/08/2023","HORS-S","1=0-33% clouds","0=Calm; glassy"," NE"," 2=ebb",49,8.6,11.16,245,7.6,19.2,0.32,0.51,15," 1=absent",2," Inside",NA," false"," LS = LEIGH SANDERS; NO EDNA",2023-02-08,2023,2,"2023-02-08 08:43","Winter"
"71",7320,12320,"LAMOPE03-HORS-08FEB2023","true","Seine","LAMOPE",""," 2. Partial twist; snag; or tear"," 2= against flow"," ",3.7,NA,NA,NA,"","09:05","",NA,NA,NA,38.082879,121.730635,NA,NA,NA,NA,NA,NA,NA,NA,NA,NA," Boat"," ",NA,NA,NA,NA,NA,NA,NA,NA," false"," "," ","","3",NA," 0%"," Garmin 5",7," "," NOT PAIRED. GPS 5; ACCURACY 7M. CODE 2 - DEPTH","true","Mudsucker","CB;ED;GU;GN;GP","Horseshoe Bend","02/08/2023","HORS-S","1=0-33% clouds","0=Calm; glassy"," NE"," 2=ebb",47,8.6,10.95,242,7.6,16.6,0.28,0.45,15.3," 1=absent",2," Inside",NA," false"," LS = LEIGH SANDERS; NO EDNA IN HORS",2023-02-08,2023,2,"2023-02-08 09:05","Winter"
"72",7321,12321,"LAMOPE04-WTIB-08FEB2023","true","Seine","LAMOPE",""," 1. No twists; snags; or tears"," 2= against flow"," ",2.5,NA,NA,NA,"","10:02","",NA,NA,NA,38.095206,121.591541,NA,NA,NA,NA,NA,NA,NA,NA,NA,NA," Boat"," ",NA,NA,NA,NA,NA,NA,NA,NA," false"," "," ","","3",NA," 1-33%"," ",NA," "," NOT PAIRED. GPS 5; ACCURACY 2M. DOMINANT VEGETATION IN NET: EGERIA; CERDEM; CAROLINA FANWORT; TRACE; PICS","true","Mudsucker","CB;ED;GU;GN;GP","Webb Tract Island and Berms","02/08/2023","WTIB-CH-S","1=0-33% clouds","1=wind 1-3 mph; scaley ripples"," NE"," 2=ebb",54,9.1,10.3,231,7.4,23.7,0.34,0.72,20.8," 1=absent",2," Inside",NA," false"," LS = LEIGH SANDERS; EDNA",2023-02-08,2023,2,"2023-02-08 10:02","Winter"
"73",7322,12322,"LAMOPE05-WTIB-08FEB2023","true","Seine","LAMOPE",""," 2. Partial twist; snag; or tear"," 2= against flow"," ",1.3,NA,NA,NA,"","10:44","",NA,NA,NA,38.096114,121.589807,NA,NA,NA,NA,NA,NA,NA,NA,NA,NA," Boat"," ",NA,NA,NA,NA,NA,NA,NA,NA," false"," "," ","","3",NA," 34-66%"," ",NA," "," NOT PAIRED. GPS 5; ACCURACY 2M. A LOT OF VEG - CODE 2. ","true","Mudsucker","CB;ED;GU;GN;GP","Webb Tract Island and Berms","02/08/2023","WTIB-CH-INT","1=0-33% clouds","0=Calm; glassy"," NA"," 2=ebb",55,9,10.11,233,7.5,11.2,0.24,0.59,22.3," 1=absent",2," Inside",NA," false"," LS = LEIGH SANDERS; EDNA",2023-02-08,2023,2,"2023-02-08 10:44","Winter"
"74",7323,12323,"LAMOPE06-WTIB-08FEB2023","true","Seine","LAMOPE",""," 1. No twists; snags; or tears"," 2= against flow"," ",1.8,NA,NA,NA,"","11:37","",NA,NA,NA,38.096381,121.588315,NA,NA,NA,NA,NA,NA,NA,NA,NA,NA," Boat"," ",NA,NA,NA,NA,NA,NA,NA,NA," false"," "," ","","3",NA," 1-33%"," ",NA," "," NOT PAIRED. GPS 5; ACCURACY 2M.","true","Mudsucker","CB;ED;GU;GN;GP","Webb Tract Island and Berms","02/08/2023","WTIB-CH-N","1=0-33% clouds","0=Calm; glassy"," NE"," 2=ebb",52,10.1,10.24,232,7.4,11.2,0.26,0.5,21.9," 1=absent",2," Outside",NA," false"," LS = LEIGH SANDERS - EDNA",2023-02-08,2023,2,"2023-02-08 11:37","Winter"
"75",7324,12324,"LAMOPE07-BROW-08FEB2023","true","Seine","LAMOPE",""," 1. No twists; snags; or tears"," 2= against flow"," ",2.5,NA,NA,NA,"","12:40","",NA,NA,NA,38.032552,121.857327,NA,NA,NA,NA,NA,NA,NA,NA,NA,NA," Boat"," ",NA,NA,NA,NA,NA,NA,NA,NA," false"," "," ","","3",NA," 1-33%"," ",NA," "," NOT PAIRED. GPS 5; ACCURACY 2M. UNID SHRIMP - BROKEN ROSTRUM","true","Mudsucker","CB;ED;GU;GN;GP","Browns Island","02/08/2023","BROW-EXT-S","1=0-33% clouds","0=Calm; glassy"," NE"," 4=flood",NA,9.6,10.58,295,7.6,23.2,0.29,0.59,21," 1=absent",2," Inside",NA," false"," Guest: Leigh Sanders",2023-02-08,2023,2,"2023-02-08 12:40","Winter"
"76",7325,12325,"LAMOPE08-BROW-08FEB2023","true","Seine","LAMOPE",""," 2. Partial twist; snag; or tear"," 2= against flow"," ",NA,NA,NA,NA,"","13:44","",NA,NA,NA,38.039324,121.864605,NA,NA,NA,NA,NA,NA,NA,NA,NA,NA," Boat"," ",NA,NA,NA,NA,NA,NA,NA,NA," false"," "," ","","3",NA," 0%"," ",NA," "," NOT PAIRED. GPS: PHONE GPS. CODE 2 - DEPTH. No depth recorded; but volume is at max - ED 10AUG2023","true","Mudsucker","CB;ED;GU;GN;GP","Browns Island","02/08/2023","BROW-CH-MAIN","1=0-33% clouds","0=Calm; glassy"," NE"," 4=flood",42,9.4,9.71,639,7.4,21.7,0.3,0.56,21.8," 1=absent",2," Inside",NA," false"," LS = LEIGH SANDERS EDNA",2023-02-08,2023,2,"2023-02-08 13:44","Winter"
"77",7326,12326,"LAMOPE09-BROW-08FEB2023","true","Seine","LAMOPE",""," 2. Partial twist; snag; or tear"," 2= against flow"," ",3,NA,NA,NA,"","14:10","",NA,NA,NA,38.03919,121.857677,NA,NA,NA,NA,NA,NA,NA,NA,NA,NA," Boat"," ",NA,NA,NA,NA,NA,NA,NA,NA," false"," "," ","","3",NA," 0%"," ",NA," "," NOT PAIRED. GPS 5; ACCURACY 2M. CODE 2 - WEIRD TWIST/NET WRAPPED AROUND LINE BUT NOT A TOTAL TWIST; NARROW POSSIBLY CODE 3 BUT NOT REDOING DUE TO TIME CONSTRAINTS.","true","Mudsucker","ED;GU;GN;GP","Browns Island","02/08/2023","BROW-TP","1=0-33% clouds","0=Calm; glassy"," NE"," 4=flood",47,9.3,7.42,1396,7,19.1,0.3,0.69,27," 1=absent",2," Inside",NA," false"," COULDN'T GET TP 18 DUE TO ALLIGATOR WEED; SAMPLED IN 14. Guest: Leigh Sanders - EDNA",2023-02-08,2023,2,"2023-02-08 14:10","Winter"
"78",7327,12327,"LAMOPE10-CHIP-08FEB2023","true","Seine","LAMOPE",""," 1. No twists; snags; or tears"," 2= against flow"," ",1.4,NA,NA,NA,"","14:44","",NA,NA,NA,38.055937,121.932234,NA,NA,NA,NA,NA,NA,NA,NA,NA,NA," Boat"," ",NA,NA,NA,NA,NA,NA,NA,NA," false"," "," ","","3",NA," 0%"," ",NA," "," NOT PAIRED. GPS 5; ACCURACY 2M. ","true","Mudsucker","CB;ED;GU;GN;GP","Chipps Island","02/08/2023","CHIP-UNK","1=0-33% clouds","0=Calm; glassy"," NE"," 2=ebb",31,10.1,10.84,397,7.7,30.8,0.29,0.52,14.8," 1=absent",2," Inside",NA," false"," LS = LEIGH SANDERS GUEST",2023-02-08,2023,2,"2023-02-08 14:44","Winter"
"79",7328,12328,"LAMOPE11-HONK-08FEB2023","true","Seine","LAMOPE",""," 1. No twists; snags; or tears"," 2= against flow"," ",2.3,NA,NA,NA,"","14:59","",NA,NA,NA,38.073625,121.932065,NA,NA,NA,NA,NA,NA,NA,NA,NA,NA," Boat"," ",NA,NA,NA,NA,NA,NA,NA,NA," false"," "," ","","3",NA," 0%"," ",NA," "," NOT PAIRED. GPS 5; ACCURACY 2M. ","true","Mudsucker","CB;ED;GU;GN;GP","Honker-Spoonbill","02/08/2023","HONK-HONK","1=0-33% clouds","0=Calm; glassy"," NE"," 2=ebb",26,9.4,10.79,365,7.7,38.2,0.31,0.54,15.4," 1=absent",2," Inside",NA," false"," LS = LEIGH SANDERS GUEST",2023-02-08,2023,2,"2023-02-08 14:59","Winter"
"80",7329,12329,"LAMOPE12-HONK-08FEB2023","true","Seine","LAMOPE",""," 1. No twists; snags; or tears"," 2= against flow"," ",1.7,NA,NA,NA,"","15:16","",NA,NA,NA,38.077105,121.90784,NA,NA,NA,NA,NA,NA,NA,NA,NA,NA," Boat"," ",NA,NA,NA,NA,NA,NA,NA,NA," false"," "," ","","3",NA," 0%"," ",NA," "," NOT PAIRED. GPS 5; ACCURACY 2M. ","true","Mudsucker","CB;ED;GU;GN;GP","Honker-Spoonbill","02/08/2023","HONK-HONK","1=0-33% clouds","0=Calm; glassy"," NE"," 2=ebb",26,11.9,10.79,418,7.7,25,0.33,0.61,14.9," 1=absent",2," Inside",NA," false"," LS = LEIGH SANDERS GUEST  ",2023-02-08,2023,2,"2023-02-08 15:16","Winter"
"81",7330,12330,"LAMOPE13-CHIP-08FEB2023","true","Seine","LAMOPE",""," 1. No twists; snags; or tears"," 2= against flow"," ",2.5,NA,NA,NA,"","15:32","",NA,NA,NA,38.067256,121.91267,NA,NA,NA,NA,NA,NA,NA,NA,NA,NA," Boat"," ",NA,NA,NA,NA,NA,NA,NA,NA," false"," "," ","","3",NA," 0%"," ",NA," "," NOT PAIRED. GPS 5; ACCURACY 4M. ","true","Mudsucker","CB;ED;GU;GN;GP","Chipps Island","02/08/2023","CHIP-UNK","1=0-33% clouds","0=Calm; glassy"," NE"," 2=ebb",24,10.8,10.83,389,7.7,29.6,0.32,0.56,14.6," 1=absent",2," Inside",NA," false"," Guest: Leigh Sanders",2023-02-08,2023,2,"2023-02-08 15:32","Winter"
"82",7331,12331,"LAMOPE14-CHIP-08FEB2023","true","Seine","LAMOPE",""," 1. No twists; snags; or tears"," 2= against flow"," ",1.2,NA,NA,NA,"","15:44","",NA,NA,NA,38.064156,121.911284,NA,NA,NA,NA,NA,NA,NA,NA,NA,NA," Boat"," ",NA,NA,NA,NA,NA,NA,NA,NA," false"," "," ","","3",NA," 0%"," ",NA," "," NOT PAIRED. GPS 5; ACCURACY 4M. CHISAL-F COLLECTED FOR UCD","true","Mudsucker","CB;ED;GU;GN;GP","Chipps Island","02/08/2023","CHIP-UNK","1=0-33% clouds","0=Calm; glassy"," NE"," 2=ebb",23,10.9,10.82,416,7.7,30.5,0.32,0.58,14.7," 1=absent",2," Inside",NA," false"," Guest: Leigh Sanders",2023-02-08,2023,2,"2023-02-08 15:44","Winter"
"83",7332,12332,"LAMOPE15-HONK-08FEB2023","true","Seine","LAMOPE",""," 2. Partial twist; snag; or tear"," 2= against flow"," ",5.3,NA,NA,NA,"","16:04","",NA,NA,NA,38.058493,121.904973,NA,NA,NA,NA,NA,NA,NA,NA,NA,NA," Boat"," ",NA,NA,NA,NA,NA,NA,NA,NA," false"," "," ","","3",NA," 0%"," ",NA," "," NOT PAIRED. GPS 5; ACCURACY 2M. CODE 2 DUE TO DEPTH","true","Mudsucker","CB;ED;GU;GN;GP","Honker-Spoonbill","02/08/2023","HONK-SPOON","1=0-33% clouds","0=Calm; glassy"," NE"," 2=ebb",25,10.3,10.76,438,7.7,31.9,0.33,0.61,15," 1=absent",2," Inside",NA," false"," Guest: Leigh Sanders",2023-02-08,2023,2,"2023-02-08 16:04","Winter"
"84",7341,12361,"LAMOPE01-TULE-28FEB2023","true","Seine","LAMOPE",""," 1. No twists; snags; or tears"," 2= against flow"," ",2.4,NA,NA,NA,"","08:15","",NA,NA,NA,38.133988,121.994968,NA,NA,NA,NA,NA,NA,NA,NA,NA,NA," Boat"," ",NA,NA,NA,NA,NA,NA,NA,NA," false"," "," ","","3",NA," 0%"," ",NA," "," GPS 5; ACCURACY 2M. NOT PAIRED.","true","Mudsucker","AC;DMC;ED;GU;GN","Tule Red","02/28/2023","TULE-CH-LG-NW","4=rain","1=wind 1-3 mph; scaley ripples"," SE"," 4=flood",10,7.6,11.55,3713,7.8,110.1,0.56,0.63,9.5," 1=absent",2," Inside",NA," false"," LS= Leigh Sanders (Guest)",2023-02-28,2023,2,"2023-02-28 08:15","Winter"
"85",7342,12362,"LAMOPE02-TULE-28FEB2023","true","Seine","LAMOPE",""," 1. No twists; snags; or tears"," 2= against flow"," ",2,NA,NA,NA,"","08:40","",NA,NA,NA,38.127465,121.987033,NA,NA,NA,NA,NA,NA,NA,NA,NA,NA," Boat"," ",NA,NA,NA,NA,NA,NA,NA,NA," false"," "," ","","3",NA," 0%"," ",NA," "," GPS 5; ACCURACY 2M. NOT PAIRED.","true","Mudsucker","AC;DMC;ED;GU;GN","Tule Red","02/28/2023","TULE-CH-LG-M","4=rain","1=wind 1-3 mph; scaley ripples"," SE"," 4=flood",11,7.5,11.56,4069,7.8,105.7,0.52,0.67,10.1," 1=absent",2," Inside",NA," false"," LS= Leigh Sanders (Guest)",2023-02-28,2023,2,"2023-02-28 08:40","Winter"
"86",7343,12363,"LAMOPE03-TULE-28FEB2023","false","Seine","LAMOPE",""," 1. No twists; snags; or tears"," 2= against flow"," ",2.4,NA,NA,NA,"","09:05","",NA,NA,NA,38.121734,121.982853,NA,NA,NA,NA,NA,NA,NA,NA,NA,NA," Boat"," ",NA,NA,NA,NA,NA,NA,NA,NA," false"," "," ","","3",NA," 0%"," ",NA," "," GPS 5; ACCURACY 2M. NOT PAIRED.","true","Mudsucker","AC;DMC;ED;GU;GN","Tule Red","02/28/2023","TULE-CH-LG-SE","4=rain","1=wind 1-3 mph; scaley ripples"," SE"," 4=flood",18,7.4,11.55,4211,7.8,93.8,0.5,0.64,10.6," 1=absent",2," Inside",NA," false"," Guest: Leigh Sanders",2023-02-28,2023,2,"2023-02-28 09:05","Winter"
"87",7344,12364,"LAMOPE04-GRIZ-28FEB2023","true","Seine","LAMOPE",""," 2. Partial twist; snag; or tear"," 2= against flow"," ",2,NA,NA,NA,"","09:30","",NA,NA,NA,38.133383,122.007262,NA,NA,NA,NA,NA,NA,NA,NA,NA,NA," Boat"," ",NA,NA,NA,NA,NA,NA,NA,NA," false"," "," ","","3",NA," 0%"," ",NA," "," CODE 2 = CONDITIONS; NOT FINISHING GRIZZLY BECAUSE OF CONDITIONS (TOO CHOPPY/ROUGH). GPS 5; ACCURACY 2M. NOT PAIRED.","true","Mudsucker","AC;DMC;ED;GU;GN","Grizzly Bay","02/28/2023","GRIZ-UNK","4=rain","3= wind 8-12 mph; large wavelets"," SE"," 4=flood",10,8,11.36,3924,7.9,136.3,0.58,0.64,8.2," 1=absent",2," Inside",NA," false"," SECCHI UNRELIABLE DUE TO WAVES. Guest: Leigh Sanders",2023-02-28,2023,2,"2023-02-28 09:30","Winter"
"88",7345,12365,"LAMOPE05-RYER-28FEB2023","true","Seine","LAMOPE",""," 1. No twists; snags; or tears"," 2= against flow"," ",1.3,NA,NA,NA,"","10:22","",NA,NA,NA,38.082984,122.007132,NA,NA,NA,NA,NA,NA,NA,NA,NA,NA," Boat"," ",NA,NA,NA,NA,NA,NA,NA,NA," false"," "," ","","3",NA," 0%"," ",NA," "," UNID CLAM - STEPPED ON. GPS 5; ACCURACY 2M. NOT PAIRED.","true","Mudsucker","AC;DMC;ED;GU;GN","Ryer Island","02/28/2023","RYER-N","4=rain","1=wind 1-3 mph; scaley ripples"," SE"," 2=ebb",32,8.5,10.78,3698,7.7,26.6,0.25,0.51,14," 1=absent",2," Inside",NA," false"," Guest: Leigh Sanders",2023-02-28,2023,2,"2023-02-28 10:22","Winter"
"89",7346,12366,"LAMOPE06-RYER-28FEB2023","true","Seine","LAMOPE",""," 1. No twists; snags; or tears"," 2= against flow"," ",1.9,NA,NA,NA,"","10:45","",NA,NA,NA,38.089013,122.019887,NA,NA,NA,NA,NA,NA,NA,NA,NA,NA," Boat"," ",NA,NA,NA,NA,NA,NA,NA,NA," false"," "," ","","3",NA," 0%"," ",NA," "," GPS 5; ACCURACY 2M. NOT PAIRED.","true","Mudsucker","AC;DMC;ED;GU;GN","Ryer Island","02/28/2023","RYER-N","3=66-100% clouds","1=wind 1-3 mph; scaley ripples"," SE"," 2=ebb",29,8.6,10.8,5288,7.7,30.7,0.27,0.47,14.2," 1=absent",2," Inside",NA," false"," Guest: Leigh Sanders",2023-02-28,2023,2,"2023-02-28 10:45","Winter"
"90",7347,12367,"LAMOPE07-RYER-28FEB2023","true","Seine","LAMOPE",""," 1. No twists; snags; or tears"," 2= against flow"," ",2.4,NA,NA,NA,"","11:06","",NA,NA,NA,38.086035,122.019642,NA,NA,NA,NA,NA,NA,NA,NA,NA,NA," Boat"," ",NA,NA,NA,NA,NA,NA,NA,NA," false"," "," ","","3",NA," 0%"," ",NA," "," GPS 5; ACCURACY 2M. NOT PAIRED.","true","Mudsucker","AC;DMC;ED;GU;GN","Ryer Island","02/28/2023","RYER-CH-LG-M","3=66-100% clouds","1=wind 1-3 mph; scaley ripples"," SE"," 2=ebb",33,8.4,10.66,4302,7.6,27.8,0.28,0.49,14.4," 1=absent",2," Inside",NA," false"," Guest: Leigh Sanders",2023-02-28,2023,2,"2023-02-28 11:06","Winter"
"91",7348,12368,"LAMOPE08-WING-28FEB2023","true","Seine","LAMOPE",""," 1. No twists; snags; or tears"," 2= against flow"," ",0.6,NA,NA,NA,"","12:15","",NA,NA,NA,38.214344,122.039479,NA,NA,NA,NA,NA,NA,NA,NA,NA,NA," Boat"," ",NA,NA,NA,NA,NA,NA,NA,NA," false"," "," ","","3",NA," 0%"," ",NA," "," GPS #5 accuracy 2m","true","Mudsucker","AC;DMC;ED;GU;GN","Wings Landing","02/28/2023","WING-TP-INT","3=66-100% clouds","2= wind 4-7 mph; small wavelets"," SW"," 2=ebb",20,7.7,10.46,2843,7.8,40.3,0.54,2.18,39.5," 1=absent",2," Inside",NA," false"," LEIGH SANDERS IS GUEST",2023-02-28,2023,2,"2023-02-28 12:15","Winter"
"92",7349,12369,"LAMOPE09-WING-28FEB2023","true","Seine","LAMOPE",""," 1. No twists; snags; or tears"," 2= against flow"," ",0.7,NA,NA,NA,"","12:57","",NA,NA,NA,38.217038,122.034527,NA,NA,NA,NA,NA,NA,NA,NA,NA,NA," Boat"," ",NA,NA,NA,NA,NA,NA,NA,NA," false"," "," ","","3",NA," 0%"," ",NA," "," GPS 5; ACCURACY 2M. NOT PAIRED. ","true","Mudsucker","AC;DMC;ED;GU;GN","Wings Landing","02/28/2023","WING-TP-INT","3=66-100% clouds","2= wind 4-7 mph; small wavelets"," SE"," 2=ebb",19,8.8,10.7,3358,7.9,62.8,0.53,2.23,38.1," 1=absent",2," Inside",NA," false"," LEIGH SANDERS IS GUEST",2023-02-28,2023,2,"2023-02-28 12:57","Winter"
"93",7350,12370,"LAMOPE10-WING-28FEB2023","true","Seine","LAMOPE",""," 1. No twists; snags; or tears"," 2= against flow"," ",1.3,NA,NA,NA,"","13:22","",NA,NA,NA,38.220774,122.043359,NA,NA,NA,NA,NA,NA,NA,NA,NA,NA," Boat"," ",NA,NA,NA,NA,NA,NA,NA,NA," false"," "," ","","3",NA," 0%"," ",NA," "," GPS 5; ACCURACY 2M. NOT PAIRED.","true","Mudsucker","AC;DMC;ED;GU;GN","Wings Landing","02/28/2023","WING-TP-INT","3=66-100% clouds","2= wind 4-7 mph; small wavelets"," SE"," 2=ebb",18,8.6,10.72,2427,7.9,57.1,0.59,2.34,32.5," 1=absent",2," Inside",NA," false"," LEIGH SANDERS IS GUEST",2023-02-28,2023,2,"2023-02-28 13:22","Winter"
"94",7351,12371,"LAMOPE11-PEYT-28FEB2023","true","Seine","LAMOPE",""," 1. No twists; snags; or tears"," 2= against flow"," ",3.3,NA,NA,NA,"","13:33","",NA,NA,NA,38.220918,122.043939,NA,NA,NA,NA,NA,NA,NA,NA,NA,NA," Boat"," ",NA,NA,NA,NA,NA,NA,NA,NA," false"," "," ","","3",NA," 0%"," ",NA," "," GPS 5; ACCURACY 2M. NOT PAIRED","true","Mudsucker","AC;DMC;ED;GU;GN","Peytonia-Suisun","02/28/2023","PEYT-PEYT","3=66-100% clouds","2= wind 4-7 mph; small wavelets"," SW"," 2=ebb",11,8.4,10.05,1022,7.8,73.9,0.61,2.05,21," 1=absent",2," Inside",NA," false"," Guest: Leigh Sanders",2023-02-28,2023,2,"2023-02-28 13:33","Winter"
"95",7352,12372,"LAMOPE12-PEYT-28FEB2023","true","Seine","LAMOPE",""," 2. Partial twist; snag; or tear"," 2= against flow"," ",4.5,NA,NA,NA,"","14:11","",NA,NA,NA,38.223295,122.032035,NA,NA,NA,NA,NA,NA,NA,NA,NA,NA," Boat"," ",NA,NA,NA,NA,NA,NA,NA,NA," false"," "," ","","3",NA," 0%"," ",NA," "," GPS 5; ACCURACY 2M. NOT PAIRED.","true","Mudsucker","AC;DMC;ED;GU;GN","Peytonia-Suisun","02/28/2023","PEYT-SUIS","4=rain","2= wind 4-7 mph; small wavelets"," SW"," 2=ebb",15,8.7,9.75,2857,7.7,48.6,0.55,2.42,37," 1=absent",2," Inside",NA," false"," Guest: Leigh Sanders",2023-02-28,2023,2,"2023-02-28 14:11","Winter"
"96",7353,12373,"LAMOPE13-PEYT-28FEB2023","true","Seine","LAMOPE",""," 1. No twists; snags; or tears"," 2= against flow"," ",0.9,NA,NA,NA,"","14:28","",NA,NA,NA,38.2082,122.034395,NA,NA,NA,NA,NA,NA,NA,NA,NA,NA," Boat"," ",NA,NA,NA,NA,NA,NA,NA,NA," false"," "," ","","3",NA," 0%"," ",NA," "," GPS 5; ACCURACY 2M. NOT PAIRED.","true","Mudsucker","AC;DMC;ED;GU;GN","Peytonia-Suisun","02/28/2023","PEYT-SUIS","3=66-100% clouds","2= wind 4-7 mph; small wavelets"," SW"," 2=ebb",19,8.8,10.05,2975,7.8,44.7,0.48,2.06,39.4," 1=absent",2," Inside",NA," false"," LEIGH SANDERS IS GUEST",2023-02-28,2023,2,"2023-02-28 14:28","Winter"
"97",7354,12374,"LAMOPE01-WTIB-02MAR2023","true","Seine","LAMOPE",""," 2. Partial twist; snag; or tear"," 2= against flow"," ",6.9,NA,NA,NA,"","08:48","",NA,NA,NA,38.095843,121.592125,NA,NA,NA,NA,NA,NA,NA,NA,NA,NA," Boat"," ",NA,NA,NA,NA,NA,NA,NA,NA," false"," "," ","","3",NA," 0%"," ",NA," "," CODE 2 - DEPTH. GPS 5; ACCURACY 2M. NOT PAIRED","true","Mudsucker","AC;DMC;ED;GU;AM","Webb Tract Island and Berms","03/02/2023","WTIB-CH-S","1=0-33% clouds","1=wind 1-3 mph; scaley ripples"," NW"," 4=flood",59,8.3,11.13,261,7.7,8.8,0.49,0.62,24.4," 1=absent",1," Outside",NA," false"," BA= BRIAN ARMSTRONG GUEST",2023-03-02,2023,3,"2023-03-02 08:48","Spring"
"98",7355,12375,"LAMOPE02-WTIB-02MAR2023","true","Seine","LAMOPE",""," 2. Partial twist; snag; or tear"," 2= against flow"," ",8.2,NA,NA,NA,"","09:06","",NA,NA,NA,38.094484,121.587976,NA,NA,NA,NA,NA,NA,NA,NA,NA,NA," Boat"," ",NA,NA,NA,NA,NA,NA,NA,NA," false"," "," ","","3",NA," 0%"," ",NA," "," GPS 5; ACCURACY 2M. NOT PAIRED. CODE 2 - DEPTH","true","Mudsucker","AC;DMC;ED;GU;AM","Webb Tract Island and Berms","03/02/2023","WTIB-CH-S","1=0-33% clouds","1=wind 1-3 mph; scaley ripples"," NW"," 4=flood",65,8.3,11.14,266,7.6,9.2,0.49,0.59,24.8," 1=absent",1," Outside",NA," false"," BA= BRIAN ARMSTRONG; GUEST",2023-03-02,2023,3,"2023-03-02 09:06","Spring"
"99",7356,12376,"LAMOPE03-WTIB-02MAR2023","true","Seine","LAMOPE",""," 1. No twists; snags; or tears"," 2= against flow"," ",1.6,NA,NA,NA,"","09:46","",NA,NA,NA,38.095792,121.586405,NA,NA,NA,NA,NA,NA,NA,NA,NA,NA," Boat"," ",NA,NA,NA,NA,NA,NA,NA,NA," false"," "," ","","1",NA," 1-33%"," ",NA," "," GPS 5; ACCURACY 2M. NOT PAIRED. ","true","Mudsucker","AC;DMC;ED;GU;AM","Webb Tract Island and Berms","03/02/2023","WTIB-CH-N","1=0-33% clouds","1=wind 1-3 mph; scaley ripples"," NW"," 4=flood",66,8.5,11.12,264,7.6,8.2,0.49,0.54,24.5," 1=absent",1," Outside",NA," false"," BA = BRIAN ARMSTRONG (GUEST)",2023-03-02,2023,3,"2023-03-02 09:46","Spring"
"100",7357,12377,"BEASEI01-HORS-02MAR2023","true","Seine","BEASEI",""," 1. No twists; snags; or tears"," 2= against flow"," ",1.1,NA,10.5,8.75,"","10:47","",NA,NA,NA,38.097354,121.709718,NA,NA,NA,NA,NA,NA,NA,NA,NA,NA," Crew Members"," ",NA,NA,NA,NA,NA,NA,NA,NA," false"," "," ","","1",NA," 0%"," ",NA," "," GPS 5; ACCURACY 2M. NOT PAIRED.","true","Mudsucker","AC;DMC;ED;GU;AM","Horseshoe Bend","03/02/2023","HORS-N","1=0-33% clouds","1=wind 1-3 mph; scaley ripples"," NW"," 4=flood",53,8.3,11.36,229,7.7,10.9,0.48,0.43,16.6," 1=absent",1," Inside",NA," false"," BA=BRIAN ARMSTRONG (GUEST)",2023-03-02,2023,3,"2023-03-02 10:47","Spring"
"101",7358,12378,"BEASEI02-HORS-02MAR2023","true","Seine","BEASEI",""," 1. No twists; snags; or tears"," 2= against flow"," ",0.95,NA,10.5,15,"","11:38","",NA,NA,NA,38.08442,121.734377,NA,NA,NA,NA,NA,NA,NA,NA,NA,NA," Crew Members"," ",NA,NA,NA,NA,NA,NA,NA,NA," false"," "," ","","1",NA," 1-33%"," ",NA," "," GPS 5; ACCURACY 2M. NOT PAIRED. REDSHI BEING TAKEN BACK FOR BETTER ID","true","Mudsucker","AC;DMC;ED;GU;AM","Horseshoe Bend","03/02/2023","HORS-S","1=0-33% clouds","1=wind 1-3 mph; scaley ripples"," NW"," 4=flood",44,8.6,11.38,240,7.8,11.8,0.49,0.49,15," 1=absent",1," Inside",NA," false"," BA=BRIAN ARMSTRONG (GUEST) ",2023-03-02,2023,3,"2023-03-02 11:38","Spring"
"102",7359,12379,"LAMOPE04-HORS-02MAR2023","true","Seine","LAMOPE",""," 3. Complete twist; snag; or large tear"," 2= against flow"," ",NA,NA,NA,NA,"","12:25","",NA,NA,NA,38.082982,121.729777,NA,NA,NA,NA,NA,NA,NA,NA,NA,NA," Boat"," ",NA,NA,NA,NA,NA,NA,NA,NA," false"," "," ","","1",NA," "," ",NA," "," GPS 5; ACCURACY 2M. NOT PAIRED. HUGE HOLE IN COD END.","true","Mudsucker","AC;DMC;ED;GU;AM","Horseshoe Bend","03/02/2023","HORS-S","1=0-33% clouds","1=wind 1-3 mph; scaley ripples"," NW"," 4=flood",NA,9,11.29,245,7.7,8.8,0.44,0.36,16.7," 1=absent",1," Inside",NA," false"," Brian Armstrong= Guest",2023-03-02,2023,3,"2023-03-02 12:25","Spring"
"103",7360,12380,"LAMOPE05-HORS-02MAR2023","true","Seine","LAMOPE",""," 1. No twists; snags; or tears"," 2= against flow"," ",1.2,NA,NA,NA,"","12:47","",NA,NA,NA,38.083763,121.723609,NA,NA,NA,NA,NA,NA,NA,NA,NA,NA," Boat"," ",NA,NA,NA,NA,NA,NA,NA,NA," false"," "," ","","3",NA," 1-33%"," ",NA," "," GPS 5; ACCURACY 2M. NOT PAIRED. ","true","Mudsucker","AC;DMC;ED;GU;AM","Horseshoe Bend","03/02/2023","HORS-M","1=0-33% clouds","1=wind 1-3 mph; scaley ripples"," NW"," 1=high slack",71,9.7,11.3,255,7.7,8.7,0.41,0.39,19.2," 1=absent",1," Inside",NA," false"," Brian Armstrong = Guest",2023-03-02,2023,3,"2023-03-02 12:47","Spring"
"104",7361,12381,"LAMOPE06-DECK-02MAR2023","true","Seine","LAMOPE",""," 2. Partial twist; snag; or tear"," 2= against flow"," ",1.4,NA,NA,NA,"","13:06","",NA,NA,NA,38.084295,121.724026,NA,NA,NA,NA,NA,NA,NA,NA,NA,NA," Boat"," ",NA,NA,NA,NA,NA,NA,NA,NA," false"," "," ","","3",NA," 0%"," ",NA," "," GPS 5; ACCURACY 2M. NOT PAIRED.","true","Mudsucker","AC;DMC;ED;GU;AM","Decker Island","03/02/2023","DECK-TP","1=0-33% clouds","0=Calm; glassy"," W"," 2=ebb",81,8.9,11.23,253,7.7,8.4,0.43,0.39,19.1," 1=absent",1," Inside",NA," false"," Brian Armstrong = Guest",2023-03-02,2023,3,"2023-03-02 13:06","Spring"
"105",7362,12382,"LAMOPE07-HORS-02MAR2023","true","Seine","LAMOPE",""," 2. Partial twist; snag; or tear"," 2= against flow"," ",8.6,NA,NA,NA,"","13:57","",NA,NA,NA,38.082293,121.716995,NA,NA,NA,NA,NA,NA,NA,NA,NA,NA," Boat"," ",NA,NA,NA,NA,NA,NA,NA,NA," false"," "," ","","3",NA," 0%"," ",NA," "," GPS 5; ACCURACY 2M. NOT PAIRED. CODE 2: DEPTH. LAST LAMPARA FOR HORS; LARGE HOLE IN MONOFILAMENT CANNOT USE NET DUE TO MASSIVE HOLE","true","Mudsucker","AC;DMC;ED;GU;AM","Horseshoe Bend","03/02/2023","HORS-M","1=0-33% clouds","0=Calm; glassy"," W"," 2=ebb",69,9.2,11.23,246,7.7,9.7,0.42,0.39,17.4," 1=absent",1," Inside",NA," false"," Brian Armstrong = Guest",2023-03-02,2023,3,"2023-03-02 13:57","Spring"
"106",7363,12383,"BEASEI01-LIBE-08MAR2023","true","Seine","BEASEI",""," 1. No twists; snags; or tears"," 2= against flow"," ",1,NA,11,15,"","07:50","",NA,NA,NA,38.242036,121.682167,NA,NA,NA,NA,NA,NA,NA,NA,NA,NA," Crew Members"," ",NA,NA,NA,NA,NA,NA,NA,NA," false"," "," ","","1",NA," 1-33%"," ",NA," "," GPS 5; ACCURACY 2M. NOT PAIRED. ","true","Mudsucker","AC;ED;GU;AM;GP","Liberty Island","03/08/2023","LIBE_UNK","4=rain","1=wind 1-3 mph; scaley ripples"," NA"," 2=ebb",43,9.1,10.76,260,7.8,13.2,0.56,0.84,15," 1=absent",1," Inside",NA," false"," LS= LEIGH SANDERS (GUEST)",2023-03-08,2023,3,"2023-03-08 07:50","Spring"
"107",7364,12384,"LAMOPE01-LIBE-08MAR2023","true","Seine","LAMOPE",""," 1. No twists; snags; or tears"," 2= against flow"," ",1.3,NA,NA,NA,"","08:40","",NA,NA,NA,38.271996,121.669031,NA,NA,NA,NA,NA,NA,NA,NA,NA,NA," Boat"," ",NA,NA,NA,NA,NA,NA,NA,NA," false"," "," ","","3",NA," 34-66%"," ",NA," "," GPS 5; ACCURACY 2M. NOT PAIRED.SHRIMP UNID B/C BROKEN ROSTRUMS","true","Mudsucker","AC;ED;GU;AM;GP","Liberty Island","03/08/2023","LIBE_UNK","3=66-100% clouds","2= wind 4-7 mph; small wavelets"," SW"," 2=ebb",61,9.5,10.49,538,8,13.2,0.77,1.87,19.8," 1=absent",1," Inside",NA," false"," Leigh Sanders= Guest",2023-03-08,2023,3,"2023-03-08 08:40","Spring"
"108",7365,12385,"BEASEI02-FLYW-08MAR2023","true","Seine","BEASEI",""," 2. Partial twist; snag; or tear"," 2= against flow"," ",0.8,NA,13,7,"","10:05","",NA,NA,NA,38.365069,121.642923,NA,NA,NA,NA,NA,NA,NA,NA,NA,NA," Crew Members"," ",NA,NA,NA,NA,NA,NA,NA,NA," false"," "," ","","1",NA," 1-33%"," ",NA," "," GPS 5; ACCURACY 3M. NOT PAIRED. CODE 2 = NO ACTUAL BEACH; WEIRD DEPLOYMENT METHOD. VEG MOSTLY DEAD TULE. Length calculated from google earth (distance between 38.65072; -121.642926 and 38.365168; -121.642926 : Double check)","true","Mudsucker","AC;ED;GU;AM;GP","Flyway Farms","03/08/2023","FLYW-CH-N","1=0-33% clouds","1=wind 1-3 mph; scaley ripples"," SW"," 2=ebb",20,9.5,9.43,764,7.8,13.1,0.66,1.36,21.5," 1=absent",1," Inside",NA," false"," LS=LEIGH SANDERS (GUEST)",2023-03-08,2023,3,"2023-03-08 10:05","Spring"
"109",7366,12386,"LAMOPE02-FLYW-08MAR2023","true","Seine","LAMOPE",""," 2. Partial twist; snag; or tear"," 2= against flow"," ",0.9,NA,NA,NA,"","11:16","",NA,NA,NA,38.362298,121.642792,NA,NA,NA,NA,NA,NA,NA,NA,NA,NA," Crew Members and Boat"," ",NA,NA,NA,NA,NA,NA,NA,NA," false"," "," ","","3",NA," 1-33%"," ",NA," "," GPS 5; ACCURACY 2M. NOT PAIRED. ","true","Mudsucker","AC;ED;GU;AM;GP","Flyway Farms","03/08/2023","FLYW-CH-N","2=33-66% clouds","1=wind 1-3 mph; scaley ripples"," SW"," 2=ebb",17,10.4,10.05,769,7.9,29.8,0.88,2.18,20," 1=absent",1," Inside",NA," false"," LS= Leigh Sanders (guest)",2023-03-08,2023,3,"2023-03-08 11:16","Spring"
"110",7367,12387,"BEASEI03-LIBE-08MAR2023","true","Seine","BEASEI",""," 1. No twists; snags; or tears"," 2= against flow"," ",0.6,NA,13,15,"","13:18","",NA,NA,NA,38.266507,121.691488,NA,NA,NA,NA,NA,NA,NA,NA,NA,NA," Crew Members"," ",NA,NA,NA,NA,NA,NA,NA,NA," false"," "," ","","1",NA," 0%"," ",NA," "," GPS 5; ACCURACY 2M. NOT PAIRED. ","true","Mudsucker","AC;ED;GU;AM;GP","Liberty Island","03/08/2023","LIBE_UNK","1=0-33% clouds","1=wind 1-3 mph; scaley ripples"," SW"," 4=flood",49,10.9,11.28,377,8,15.6,0.48,0.86,17.9," 1=absent",1," Inside",NA," false"," LS = Leigh Sanders (Guest)",2023-03-08,2023,3,"2023-03-08 13:18","Spring"
"111",7368,12388,"LAMOPE03-LIBE-08MAR2023","true","Seine","LAMOPE",""," 1. No twists; snags; or tears"," 2= against flow"," ",0.8,NA,NA,NA,"","13:51","",NA,NA,NA,38.287551,121.691273,NA,NA,NA,NA,NA,NA,NA,NA,NA,NA," Boat"," ",NA,NA,NA,NA,NA,NA,NA,NA," false"," "," ","","3",NA," 1-33%"," ",NA," "," GPS 5; ACCURACY 2M. NOT PAIRED. CLAM UNID PICS - ID Sphaeriidae ; plikely Musculium DD 2/02/2024","true","Mudsucker","AC;ED;GU;AM;GP","Liberty Island","03/08/2023","LIBE_UNK","1=0-33% clouds","1=wind 1-3 mph; scaley ripples"," SW"," 4=flood",23,11.6,10.75,438,8,33.2,0.62,1.12,17.1," 1=absent",1," Inside",NA," false"," LS=LEIGH SANDERS (guest)",2023-03-08,2023,3,"2023-03-08 13:51","Spring"
"112",7369,12389,"LAMOPE01-WINT-15MAR2023","true","Seine","LAMOPE",""," 1. No twists; snags; or tears"," 2= against flow"," ",3.2,NA,NA,NA,"","09:07","",NA,NA,NA,38.03177,121.842671,NA,NA,NA,NA,NA,NA,NA,NA,NA,NA," Boat"," ",NA,NA,NA,NA,NA,NA,NA,NA," false"," "," ","","3",NA," 0%"," ",NA," "," GPS 5; ACCURACY 2M. NOT PAIRED. ","true","Mudsucker","DMC;ED;AM;KMP","Winter Island","03/15/2023","WINT-CH-INT","3=66-100% clouds","1=wind 1-3 mph; scaley ripples"," NW"," 2=ebb",40,11.2,10.19,211,7.5,16,0.42,0.71,22.2," 1=absent",1," Inside",NA," false"," ",2023-03-15,2023,3,"2023-03-15 09:07","Spring"
"113",7370,12390,"LAMOPE02-WINT-15MAR2023","true","Seine","LAMOPE",""," 1. No twists; snags; or tears"," 2= against flow"," ",2.1,NA,NA,NA,"","09:35","",NA,NA,NA,38.036755,121.845504,NA,NA,NA,NA,NA,NA,NA,NA,NA,NA," Boat"," ",NA,NA,NA,NA,NA,NA,NA,NA," false"," "," ","","3",NA," 1-33%"," ",NA," "," GPS 5. NOT PAIRED. ","true","Mudsucker","DMC;ED;AM;KMP","Winter Island","03/15/2023","WINT-CH-INT","3=66-100% clouds","1=wind 1-3 mph; scaley ripples"," NW"," 2=ebb",45,10.9,9.56,216,7.4,14.4,0.47,0.67,22.5," 1=absent",1," Inside",NA," false"," ",2023-03-15,2023,3,"2023-03-15 09:35","Spring"
"114",7371,12391,"LAMOPE03-WINT-15MAR2023","true","Seine","LAMOPE",""," 2. Partial twist; snag; or tear"," 2= against flow"," ",2.6,NA,NA,NA,"","09:56","",NA,NA,NA,38.052002,121.854518,NA,NA,NA,NA,NA,NA,NA,NA,NA,NA," Boat"," ",NA,NA,NA,NA,NA,NA,NA,NA," false"," "," ","","3",NA," 0%"," ",NA," "," GPS 5; ACCURACY 2M. NOT PAIRED. CHANNEL WAS NARROW","true","Mudsucker","DMC;ED;AM;KMP","Winter Island","03/15/2023","WINT-CH-INT","2=33-66% clouds","1=wind 1-3 mph; scaley ripples"," NW"," 1=high slack",38,10.8,10.1,212,7.5,17.6,0.47,0.59,20.5," 1=absent",1," Inside",NA," false"," ",2023-03-15,2023,3,"2023-03-15 09:56","Spring"
"115",7372,12392,"LAMOPE04-BROW-15MAR2023","true","Seine","LAMOPE",""," 1. No twists; snags; or tears"," 2= against flow"," ",2.4,NA,NA,NA,"","10:20","",NA,NA,NA,38.032635,121.857042,NA,NA,NA,NA,NA,NA,NA,NA,NA,NA," Boat"," ",NA,NA,NA,NA,NA,NA,NA,NA," false"," "," ","","3",NA," 1-33%"," ",NA," "," GPS 5; ACCURACY 2M. NOT PAIRED. ","true","Mudsucker","DMC;ED;AM;KMP","Browns Island","03/15/2023","BROW-EXT-S","1=0-33% clouds","1=wind 1-3 mph; scaley ripples"," NW"," 2=ebb",38,11.3,10.12,214,7.5,16.4,0.43,0.67,22.4," 1=absent",1," Inside",NA," false"," ",2023-03-15,2023,3,"2023-03-15 10:20","Spring"
"116",7373,12393,"LAMOPE05-BROW-15MAR2023","true","Seine","LAMOPE",""," 2. Partial twist; snag; or tear"," 2= against flow"," ",5,NA,NA,NA,"","10:53","",NA,NA,NA,38.038591,121.863868,NA,NA,NA,NA,NA,NA,NA,NA,NA,NA," Boat"," ",NA,NA,NA,NA,NA,NA,NA,NA," false"," "," ","","3",NA," 0%"," ",NA," "," GPS 5; ACCURACY 2M. NOT PAIRED. code 2: deep.","true","Mudsucker","DMC;ED;AM;KMP","Browns Island","03/15/2023","BROW-CH-MAIN","1=0-33% clouds","1=wind 1-3 mph; scaley ripples"," NW"," 2=ebb",55,11.9,8.84,469,7.3,12,0.41,0.57,25.8," 1=absent",1," Inside",NA," false"," ",2023-03-15,2023,3,"2023-03-15 10:53","Spring"
"117",7374,12394,"LAMOPE06-BROW-15MAR2023","true","Seine","LAMOPE",""," 2. Partial twist; snag; or tear"," 2= against flow"," ",4.1,NA,NA,NA,"","11:06","",NA,NA,NA,38.038218,121.861419,NA,NA,NA,NA,NA,NA,NA,NA,NA,NA," Boat"," ",NA,NA,NA,NA,NA,NA,NA,NA," false"," "," ","","3",NA," 0%"," ",NA," "," GPS 5; ACCURACY 2M. NOT PAIRED. code 2: depth","true","Mudsucker","DMC;ED;AM;KMP","Browns Island","03/15/2023","BROW-CH-MAIN","1=0-33% clouds","1=wind 1-3 mph; scaley ripples"," NW"," 2=ebb",64,12.2,8.27,644,7.2,9.6,0.42,0.66,28.4," 1=absent",1," Inside",NA," false"," ",2023-03-15,2023,3,"2023-03-15 11:06","Spring"
"118",7375,12395,"LAMOPE07-CHIP-15MAR2023","true","Seine","LAMOPE",""," 1. No twists; snags; or tears"," 2= against flow"," ",1.6,NA,NA,NA,"","11:43","",NA,NA,NA,38.0532,121.932045,NA,NA,NA,NA,NA,NA,NA,NA,NA,NA," Boat"," ",NA,NA,NA,NA,NA,NA,NA,NA," false"," "," ","","3",NA," 1-33%"," ",NA," "," GPS#5; accuracy: 3m; ","true","Mudsucker","DMC;ED;AM;KMP","Chipps Island","03/15/2023","CHIP-UNK","1=0-33% clouds","1=wind 1-3 mph; scaley ripples"," NW"," 2=ebb",24,10.8,10.41,177,7.6,38.3,0.55,0.64,13.1," 1=absent",1," Inside",NA," false"," ",2023-03-15,2023,3,"2023-03-15 11:43","Spring"
"119",7381,12401,"LAMOPE08-HONK-15MAR2023","true","Seine","LAMOPE",""," 1. No twists; snags; or tears"," 2= against flow"," ",2,NA,NA,NA,"","12:10","",NA,NA,NA,38.075546,121.930123,NA,NA,NA,NA,NA,NA,NA,NA,NA,NA," Boat"," ",NA,NA,NA,NA,NA,NA,NA,NA," false"," "," ","","3",NA," 0%"," ",NA," "," GPS 5; ACCURACY 3M. NOT PAIRED.","true","Mudsucker","DMC;ED;AM;KMP","Honker-Spoonbill","03/15/2023","HONK-HONK","1=0-33% clouds","2= wind 4-7 mph; small wavelets"," NW"," 2=ebb",33,10.2,11.04,131,7.7,26.6,0.48,0.46,11.2," 1=absent",1," Inside",NA," false"," ",2023-03-15,2023,3,"2023-03-15 12:10","Spring"
"120",7382,12402,"LAMOPE09-HONK-15MAR2023","true","Seine","LAMOPE",""," 1. No twists; snags; or tears"," 2= against flow"," ",2.1,NA,NA,NA,"","12:31","",NA,NA,NA,38.074482,121.917406,NA,NA,NA,NA,NA,NA,NA,NA,NA,NA," Boat"," ",NA,NA,NA,NA,NA,NA,NA,NA," false"," "," ","","3",NA," 1-33%"," ",NA," "," GPS 5; ACCURACY 3M. NOT PAIRED. ","true","Mudsucker","DMC;ED;AM;KMP","Honker-Spoonbill","03/15/2023","HONK-HONK","1=0-33% clouds","2= wind 4-7 mph; small wavelets"," NW"," 2=ebb",14,11.4,10.49,200,7.8,104.2,0.73,0.78,8.1," 1=absent",1," Inside",NA," false"," TURBIDITY IS 104.15",2023-03-15,2023,3,"2023-03-15 12:31","Spring"
"121",7383,12403,"LAMOPE10-CHIP-15MAR2023","true","Seine","LAMOPE",""," 1. No twists; snags; or tears"," 2= against flow"," ",1.9,NA,NA,NA,"","12:55","",NA,NA,NA,38.061236,121.90928,NA,NA,NA,NA,NA,NA,NA,NA,NA,NA," Boat"," ",NA,NA,NA,NA,NA,NA,NA,NA," false"," "," ","","3",NA," 0%"," ",NA," "," GPS 5; ACCURACY 3M. NOT PAIRED.","true","Mudsucker","DMC;ED;AM;KMP","Chipps Island","03/15/2023","CHIP-UNK","1=0-33% clouds","1=wind 1-3 mph; scaley ripples"," W"," 2=ebb",15,11.4,9.32,213,7.3,61.8,0.56,0.62,10.6," 1=absent",1," Inside",NA," false"," ",2023-03-15,2023,3,"2023-03-15 12:55","Spring"
"122",7384,12404,"LAMOPE11-CHIP-15MAR2023","true","Seine","LAMOPE",""," 1. No twists; snags; or tears"," 2= against flow"," ",2.2,NA,NA,NA,"","13:14","",NA,NA,NA,38.06171,121.909967,NA,NA,NA,NA,NA,NA,NA,NA,NA,NA," Boat"," ",NA,NA,NA,NA,NA,NA,NA,NA," false"," "," ","","3",NA," 0%"," ",NA," "," GPS 5; ACCURACY 3M. NOT PAIRED. ","true","Mudsucker","DMC;ED;AM;KMP","Chipps Island","03/15/2023","CHIP-UNK","1=0-33% clouds","1=wind 1-3 mph; scaley ripples"," W"," 2=ebb",16,11.8,9.06,231,7.4,65.3,0.57,0.72,10.4," 1=absent",1," Inside",NA," false"," ",2023-03-15,2023,3,"2023-03-15 13:14","Spring"
"123",7385,12405,"LAMOPE12-HONK-15MAR2023","true","Seine","LAMOPE",""," 2. Partial twist; snag; or tear"," 2= against flow"," ",5.5,NA,NA,NA,"","13:43","",NA,NA,NA,38.05487,121.895271,NA,NA,NA,NA,NA,NA,NA,NA,NA,NA," Boat"," ",NA,NA,NA,NA,NA,NA,NA,NA," false"," "," ","","3",NA," 0%"," ",NA," "," GPS 5; ACCURACY 3M. NOT PAIRED. Code 2: Depth","true","Mudsucker","DMC;ED;AM;KMP","Honker-Spoonbill","03/15/2023","HONK-SPOON","1=0-33% clouds","1=wind 1-3 mph; scaley ripples"," W"," 2=ebb",18,10,11.03,127,7.5,43.3,0.5,0.5,10.2," 1=absent",1," Inside",NA," false"," ",2023-03-15,2023,3,"2023-03-15 13:43","Spring"
"124",7386,12406,"LAMOPE13-BROA-15MAR2023","true","Seine","LAMOPE",""," 2. Partial twist; snag; or tear"," 2= against flow"," ",8.3,NA,NA,NA,"","14:10","",NA,NA,NA,38.062048,121.849328,NA,NA,NA,NA,NA,NA,NA,NA,NA,NA," Boat"," ",NA,NA,NA,NA,NA,NA,NA,NA," false"," "," ","","3",NA," 0%"," ",NA," "," GPS 5; ACCURACY 3M. NOT PAIRED. CODE 2 B/C OF DEPTH; WIND BLEW US OVER THE NET","true","Mudsucker","DMC;ED;AM;KMP","Broad Slough","03/15/2023","BROA-EXT","1=0-33% clouds","2= wind 4-7 mph; small wavelets"," W"," 2=ebb",38,11.7,10.42,207,7.6,17.5,0.41,0.56,20.6," 1=absent",1," Inside",NA," false"," ",2023-03-15,2023,3,"2023-03-15 14:10","Spring"
"125",7387,12407,"LAMOPE14-BROA-15MAR2023","true","Seine","LAMOPE",""," 2. Partial twist; snag; or tear"," 2= against flow"," ",5.5,NA,NA,NA,"","14:26","",NA,NA,NA,38.0474,121.842021,NA,NA,NA,NA,NA,NA,NA,NA,NA,NA," Boat"," ",NA,NA,NA,NA,NA,NA,NA,NA," false"," "," ","","3",NA," 0%"," ",NA," "," GPS 5; ACCURACY 5M. NOT PAIRED. code 2: Depth","true","Mudsucker","DMC;ED;AM;KMP","Broad Slough","03/15/2023","BROA-EXT","1=0-33% clouds","2= wind 4-7 mph; small wavelets"," W"," 2=ebb",38,10.9,10.45,167,7.5,28.9,0.48,0.66,16.7," 1=absent",1," Inside",NA," false"," ",2023-03-15,2023,3,"2023-03-15 14:26","Spring"
"126",7388,12408,"LAMOPE15-BROA-15MAR2023","true","Seine","LAMOPE",""," 2. Partial twist; snag; or tear"," 2= against flow"," ",4.6,NA,NA,NA,"","14:41","",NA,NA,NA,38.032914,121.839406,NA,NA,NA,NA,NA,NA,NA,NA,NA,NA," Boat"," ",NA,NA,NA,NA,NA,NA,NA,NA," false"," "," ","","3",NA," 0%"," ",NA," "," GPS 5; ACCURACY 4M. NOT PAIRED. code 2: depth","true","Mudsucker","DMC;ED;AM;KMP","Broad Slough","03/15/2023","BROA-INT","1=0-33% clouds","1=wind 1-3 mph; scaley ripples"," W"," 2=ebb",28,11.2,10.34,180,7.5,27.8,0.48,0.7,18.5," 1=absent",1," Inside",NA," false"," ",2023-03-15,2023,3,"2023-03-15 14:41","Spring"
"127",7401,12421,"LAMOPE01-STAI-17MAR2023","true","Seine","LAMOPE",""," 2. Partial twist; snag; or tear"," 2= against flow"," ",7.2,NA,NA,NA,"","09:25","",NA,NA,NA,38.317758,121.667412,NA,NA,NA,NA,NA,NA,NA,NA,NA,NA," Boat"," ",NA,NA,NA,NA,NA,NA,NA,NA," false"," "," ","","3",NA," 1-33%"," ",NA," "," GPS 5; ACCURACY 5M. NOT PAIRED. VERY HIGH FLOW. code 2: depth","true","Mudsucker","DMC;ED;AM;GP","Stairsteps-Liberty Cut","03/17/2023","STAI-LIBE","1=0-33% clouds","1=wind 1-3 mph; scaley ripples"," N"," 2=ebb",10,12.1,8.92,226,7.5,77.6,0.7,1.23,12.5," 1=absent",1," Inside",NA," false"," ",2023-03-17,2023,3,"2023-03-17 09:25","Spring"
"128",7402,12422,"LAMOPE02-STAI-17MAR2023","true","Seine","LAMOPE",""," 2. Partial twist; snag; or tear"," 2= against flow"," ",7.4,NA,NA,NA,"","09:46","",NA,NA,NA,38.329053,121.679236,NA,NA,NA,NA,NA,NA,NA,NA,NA,NA," Boat"," ",NA,NA,NA,NA,NA,NA,NA,NA," false"," "," ","","3",NA," 0%"," ",NA," "," GPS 5; ACCURACY 2M. NOT PAIRED. VERY HIGH FLOW. code 2: depth","true","Mudsucker","DMC;ED;AM;GP","Stairsteps-Liberty Cut","03/17/2023","STAI-M","1=0-33% clouds","1=wind 1-3 mph; scaley ripples"," N"," 2=ebb",20,12.9,8.02,414,7.7,48.1,0.79,2.43,18.5," 1=absent",1," Inside",NA," false"," ",2023-03-17,2023,3,"2023-03-17 09:46","Spring"
"129",7403,12423,"LAMOPE03-STAI-17MAR2023","true","Seine","LAMOPE",""," 2. Partial twist; snag; or tear"," 2= against flow"," ",4.7,NA,NA,NA,"","10:05","",NA,NA,NA,38.321763,121.686929,NA,NA,NA,NA,NA,NA,NA,NA,NA,NA," Boat"," ",NA,NA,NA,NA,NA,NA,NA,NA," false"," "," ","","3",NA," 0%"," ",NA," "," GPS 5; ACCURACY 7M. NOT PAIRED. VERY HIGH FLOW; NET WAS VERY NARROWLY OPENED. code 2: depth","true","Mudsucker","DMC;ED;AM;GP","Stairsteps-Liberty Cut","03/17/2023","STAI-S","1=0-33% clouds","1=wind 1-3 mph; scaley ripples"," N"," 2=ebb",43,12.8,7.92,395,7.6,50.3,0.76,2.43,18.6," 1=absent",1," Inside",NA," false"," ",2023-03-17,2023,3,"2023-03-17 10:05","Spring"
"130",7404,12424,"BEASEI01-LOWE-17MAR2023","true","Seine","BEASEI",""," 2. Partial twist; snag; or tear"," 2= against flow"," ",0.7,NA,15,15,"","10:35","",NA,NA,NA,38.329613,121.680934,NA,NA,NA,NA,NA,NA,NA,NA,NA,NA," Crew Members"," ",NA,NA,NA,NA,NA,NA,NA,NA," false"," "," ","","2",NA," 0%"," ",NA," "," GPS 5; ACCURACY 2M. NOT PAIRED. LOTS OF DEAD SLUGS; NO SECCHI. DEEPINER IN MIDDLE OF AREA SEINED. CONDUCTED ON FLOODPLAIN.","true","Mudsucker","DMC;ED;AM;GP","Lower Yolo Ranch","03/17/2023","LOWE-UNK","1=0-33% clouds","1=wind 1-3 mph; scaley ripples"," NW"," 2=ebb",NA,13.3,8.27,416,7.7,33.8,0.67,1.7,19.5," 1=absent",1," Inside",NA," false"," no secchi taken",2023-03-17,2023,3,"2023-03-17 10:35","Spring"
"131",7405,12425,"CASTNET01-LOWE-17MAR2023","true","Cast","CAST",""," "," "," ",NA,NA,NA,NA,"AM","11:14","",NA,NA,NA,38.352385,121.661029,NA,NA,NA,NA,NA,NA,NA,NA,NA,NA," "," ",NA,NA,NA,NA,NA,NA,NA,NA," false"," "," ","","",NA," "," ",NA," "," GPS 5; ACCURACY 2M. NOT PAIRED. INSIDE. 9 CASTS","true","Mudsucker","DMC;ED;AM;GP","Lower Yolo Ranch","03/17/2023","LOWE-CH-ENTRANCE-N","1=0-33% clouds","1=wind 1-3 mph; scaley ripples"," NW"," 2=ebb",NA,12.6,8.78,221,7.5,88.7,0.71,1.33,12.6," 1=absent",1," Inside",NA," false"," ",2023-03-17,2023,3,"2023-03-17 11:14","Spring"
"132",7406,12426,"CASTNET02-FLYW-17MAR2023","true","Cast","CAST",""," "," "," ",1.9,NA,NA,NA,"AM","12:25","",NA,NA,NA,38.360451,121.642178,NA,NA,NA,NA,NA,NA,NA,NA,NA,NA," "," ",NA,NA,NA,NA,NA,NA,NA,NA," false"," "," ","","",NA," "," ",NA," "," GPS 5; ACCURACY 2M. NOT PAIRED.CASTS DONE ""ON LAND"" SINCE SITE COVERED WITH WATER. VERY HIGH FLOW. 3 CASTS","true","Mudsucker","DMC;ED;AM;GP","Flyway Farms","03/17/2023","FLYW-UNK","1=0-33% clouds","0=Calm; glassy"," N"," 2=ebb",16,12.5,9.03,156,7.4,71.8,0.58,1.06,12.1," 1=absent",1," Inside",NA," false"," ",2023-03-17,2023,3,"2023-03-17 12:25","Spring"
"133",7421,12441,"LAMOPE01-GRIZ-20MAR2023","true","Seine","LAMOPE",""," 1. No twists; snags; or tears"," 2= against flow"," ",2,NA,NA,NA,"","09:54","",NA,NA,NA,38.136713,122.00625,NA,NA,NA,NA,NA,NA,NA,NA,NA,NA," Boat"," ",NA,NA,NA,NA,NA,NA,NA,NA," false"," "," ","","3",NA," 0%"," Garmin 5",2," "," GPS 5; ACCURACY 2M.NOT PAIRED. WATER MOVING DOWNSTREAM BECAUSE OF FLOW","true","Mudsucker","CB;ED;GN;GP","Grizzly Bay","03/20/2023","GRIZ-UNK","2=33-66% clouds","3= wind 8-12 mph; large wavelets"," W"," 4=flood",12,13,10.13,625,7.8,113.8,0.95,1.25,9.1," 1=absent",1," Inside",NA," false"," ",2023-03-20,2023,3,"2023-03-20 09:54","Spring"
"134",7422,12442,"LAMOPE02-GRIZ-20MAR2023","true","Seine","LAMOPE",""," 1. No twists; snags; or tears"," 2= against flow"," ",2,NA,NA,NA,"","10:16","",NA,NA,NA,38.12365,122.001351,NA,NA,NA,NA,NA,NA,NA,NA,NA,NA," Boat"," ",NA,NA,NA,NA,NA,NA,NA,NA," false"," "," ","","3",NA," 0%"," ",NA," "," GPS 5; ACCURACY 2;. NOT PAIRED. YSI READING DONE IN BUCKET DUE TO WAVES","true","Mudsucker","CB;ED;GN;GP","Grizzly Bay","03/20/2023","GRIZ-UNK","2=33-66% clouds","3= wind 8-12 mph; large wavelets"," W"," 4=flood",18,12.9,10.2,625,7.7,74.2,0.88,1.27,12.6," 1=absent",1," Inside",NA," false"," ",2023-03-20,2023,3,"2023-03-20 10:16","Spring"
"135",7423,12443,"LAMOPE03-GRIZ-20MAR2023","true","Seine","LAMOPE",""," 1. No twists; snags; or tears"," 2= against flow"," ",1.6,NA,NA,NA,"","10:33","",NA,NA,NA,38.119398,121.990999,NA,NA,NA,NA,NA,NA,NA,NA,NA,NA," Boat"," ",NA,NA,NA,NA,NA,NA,NA,NA," false"," "," ","","3",NA," 0%"," Garmin 5",2," "," GPS 5; ACCURACY 2M. ","true","Mudsucker","CB;ED;GN;GP","Grizzly Bay","03/20/2023","GRIZ-UNK","2=33-66% clouds","3= wind 8-12 mph; large wavelets"," W"," 4=flood",18,13,10.4,491,7.9,90.1,1.08,1.54,9.3," 1=absent",1," Inside",1," false"," NOT PAIRED. YSI TAKEN FROM BUCKET",2023-03-20,2023,3,"2023-03-20 10:33","Spring"
"136",7424,12444,"LAMOPE04-RYER-20MAR2023","true","Seine","LAMOPE",""," 1. No twists; snags; or tears"," 2= against flow"," ",2.3,NA,NA,NA,"","11:13","",NA,NA,NA,38.079469,122.015878,NA,NA,NA,NA,NA,NA,NA,NA,NA,NA," Boat"," ",NA,NA,NA,NA,NA,NA,NA,NA," false"," "," ","","3",NA," 0%"," Garmin 5",2," "," GPS 5; ACCURACY 2M. NOT PAIRED. UNID NOT BROUGH BACK FROM PREVIOUS SAMPLE MANGLED - UNID 25MM","true","Mudsucker","CB;ED;GN;GP","Ryer Island","03/20/2023","RYER-UNK","2=33-66% clouds","1=wind 1-3 mph; scaley ripples"," W"," 4=flood",15,12.3,9.37,164,7.3,66.1,0.69,0.66,12.9," 1=absent",1," Inside",NA," false"," ",2023-03-20,2023,3,"2023-03-20 11:13","Spring"
"137",7425,12445,"LAMOPE05-RYER-20MAR2023","true","Seine","LAMOPE",""," 1. No twists; snags; or tears"," 2= against flow"," ",2.5,NA,NA,NA,"","11:34","",NA,NA,NA,38.085896,122.020778,NA,NA,NA,NA,NA,NA,NA,NA,NA,NA," Boat"," ",NA,NA,NA,NA,NA,NA,NA,NA," false"," "," ","","3",NA," 0%"," ",NA," "," GPS 5; ACCURACY 2M. NOT PAIRED","true","Mudsucker","CB;ED;GN;GP","Ryer Island","03/20/2023","RYER-CH-LG-M","1=0-33% clouds","1=wind 1-3 mph; scaley ripples"," W"," 4=flood",20,12.1,9.72,159,7.4,49.9,0.61,0.66,12.8," 1=absent",1," Inside",NA," false"," ",2023-03-20,2023,3,"2023-03-20 11:34","Spring"
"138",7426,12446,"LAMOPE06-RYER-20MAR2023","true","Seine","LAMOPE",""," 1. No twists; snags; or tears"," 2= against flow"," ",2.1,NA,NA,NA,"","11:56","",NA,NA,NA,38.078129,122.007459,NA,NA,NA,NA,NA,NA,NA,NA,NA,NA," Boat"," ",NA,NA,NA,NA,NA,NA,NA,NA," false"," "," ","","3",NA," 0%"," ",NA," "," GPS 5; ACCURACY 2M. NOT PAIRED. ","true","Mudsucker","CB;ED;GN;GP","Ryer Island","03/20/2023","RYER-CH-LG-M","1=0-33% clouds","1=wind 1-3 mph; scaley ripples"," W"," 4=flood",19,12.4,9.48,161,7.4,59.3,0.61,0.63,13.3," 1=absent",1," Inside",NA," false"," ",2023-03-20,2023,3,"2023-03-20 11:56","Spring"
"139",7427,12447,"LAMOPE07-TULE-20MAR2023","true","Seine","LAMOPE",""," 1. No twists; snags; or tears"," 2= against flow"," ",2.9,NA,NA,NA,"","12:35","",NA,NA,NA,38.122114,121.983243,NA,NA,NA,NA,NA,NA,NA,NA,NA,NA," Boat"," ",NA,NA,NA,NA,NA,NA,NA,NA," false"," "," ","","1",NA," 0%"," ",NA," "," GPS 5; ACCURACY 2M. NOT PAIRED. ","true","Mudsucker","CB;ED;GN;GP","Tule Red","03/20/2023","TULE-CH-LG-SE","1=0-33% clouds","1=wind 1-3 mph; scaley ripples"," W"," 4=flood",10,13.5,10.1,680,7.8,143.9,1.02,1.27,8.4," 1=absent",1," Inside",NA," false"," ",2023-03-20,2023,3,"2023-03-20 12:35","Spring"
"140",7428,12448,"CAST01-TULE-20MAR2023","true","Cast","CAST",""," "," "," ",1.8,NA,NA,NA,"CB;ED;GN;GP","13:02","",NA,NA,NA,38.116551,121.981678,NA,NA,NA,NA,NA,NA,NA,NA,NA,NA," "," ",NA,NA,NA,NA,NA,NA,NA,NA," false"," "," ","","",NA," "," ",NA," "," GPS 5; ACCURACY 2M. NOT PAIRED. INSIDE. END TIME 13:10. 3 THROWS OF CAST NET. DEPTH IS 1.8 M.","true","Mudsucker","CB;ED;GN;GP","Tule Red","03/20/2023","TULE-CH-SM-12","1=0-33% clouds","1=wind 1-3 mph; scaley ripples"," W"," 4=flood",9,13.3,9.59,832,7.5,116.9,0.98,1.36,12.1," 1=absent",1," Inside",NA," false"," ",2023-03-20,2023,3,"2023-03-20 13:02","Spring"
"141",7429,12449,"BEASEI01-TULE-20MAR2023","true","Seine","BEASEI",""," 1. No twists; snags; or tears"," 2= against flow"," ",0.6,NA,15,15,"","13:25","",NA,NA,NA,38.122837,121.984081,NA,NA,NA,NA,NA,NA,NA,NA,NA,NA," Crew Members"," ",NA,NA,NA,NA,NA,NA,NA,NA," false"," "," ","","2",NA," 0%"," ",NA," "," GPS 5; ACCURACY 2M. NOT PAIRED. FLOODPLAIN; YSI TAKEN FROM BUCKET","true","Mudsucker","CB;ED;GN;GP","Tule Red","03/20/2023","TULE-UNK","1=0-33% clouds","1=wind 1-3 mph; scaley ripples"," W"," 4=flood",NA,14.1,9.91,813,7.7,154.4,1.31,2.61,8.9," 1=absent",1," Inside",NA," false"," ",2023-03-20,2023,3,"2023-03-20 13:25","Spring"
"142",7430,12450,"CAST02-TULE-20MAR2023","true","Cast","CAST",""," "," "," ",0.9,NA,NA,NA,"","14:00","",NA,NA,NA,38.12765,121.986978,NA,NA,NA,NA,NA,NA,NA,NA,NA,NA," "," ",NA,NA,NA,NA,NA,NA,NA,NA," false"," "," ","","",NA," "," ",NA," "," GPS 5; ACCURACY 2M. NOT PAIRED. DEPTH 0.9 M. 6 CASTS.","true","Mudsucker","CB;ED;GN;GP","Tule Red","03/20/2023","TULE-UNK","1=0-33% clouds","1=wind 1-3 mph; scaley ripples"," W"," 4=flood",9,14.2,9.92,842,7.8,115.8,1.05,1.53,9.8," 1=absent",1," Inside",NA," false"," ",2023-03-20,2023,3,"2023-03-20 14:00","Spring"
"143",7431,12451,"LAMOPE08-TULE-20MAR2023","true","Seine","LAMOPE",""," 1. No twists; snags; or tears"," 2= against flow"," ",2.7,NA,NA,NA,"","14:20","",NA,NA,NA,38.128521,121.98825,NA,NA,NA,NA,NA,NA,NA,NA,NA,NA," Boat"," ",NA,NA,NA,NA,NA,NA,NA,NA," false"," "," ","","3",NA," 0%"," ",NA," "," GPS 5; ACCURACY 2M. NOT PAIRED. ","true","Mudsucker","CB;ED;GN;GP","Tule Red","03/20/2023","TULE-CH-LG-M","1=0-33% clouds","1=wind 1-3 mph; scaley ripples"," W"," 4=flood",10,14.1,10,812,7.9,112.2,0.96,1.42,10.1," 1=absent",1," Inside",NA," false"," ",2023-03-20,2023,3,"2023-03-20 14:20","Spring"
"144",7432,12452,"LAMOPE09-TULE-20MAR2023","true","Seine","LAMOPE",""," 1. No twists; snags; or tears"," 2= against flow"," ",1.1,NA,NA,NA,"","14:42","",NA,NA,NA,38.133734,121.992623,NA,NA,NA,NA,NA,NA,NA,NA,NA,NA," Boat"," ",NA,NA,NA,NA,NA,NA,NA,NA," false"," "," ","","3",NA," 0%"," Garmin 5",2," "," GPS 5; ACCURACY 2M. NOT PAIRED.","true","Mudsucker","CB;ED;GN;GP","Tule Red","03/20/2023","TULE-CH-LG-M","1=0-33% clouds","1=wind 1-3 mph; scaley ripples"," W"," 4=flood",13,14.5,9.86,914,7.8,106.2,0.99,1.6,10.5," 1=absent",1," Inside",NA," false"," ",2023-03-20,2023,3,"2023-03-20 14:42","Spring"
"145",7433,12453,"LAMOPE01-PEYT-16MAR2023","true","Seine","LAMOPE",""," 2. Partial twist; snag; or tear"," 3= unknown"," ",6.8,NA,NA,NA,"","07:52","",NA,NA,NA,38.207697,122.033163,NA,NA,NA,NA,NA,NA,NA,NA,NA,NA," Boat"," ",NA,NA,NA,NA,NA,NA,NA,NA," false"," "," ","","3",NA," 34-66%"," ",NA," "," GPS 5; ACCURACY 2M. NOT PAIRED. TOW DIRECTION: NA PERPENDICULAR TO FLOW. MAJORITY OF VEG IN COD END DEAD TULE. WING CAUGHT ON PATCH OF DEAD TULE AND CAUSED DEPLOYMENT TO GO SIDEWAYS","true","Mudsucker","AC;ED;AM;GP","Peytonia-Suisun","03/16/2023","PEYT-SUIS","1=0-33% clouds","1=wind 1-3 mph; scaley ripples"," NA"," 4=flood",17,13.4,7.95,959,7.6,80.1,0.63,1.28,27.3," 1=absent",1," Inside",NA," false"," ",2023-03-16,2023,3,"2023-03-16 07:52","Spring"
"146",7434,12454,"LAMOPE02-PEYT-16MAR2023","true","Seine","LAMOPE",""," 2. Partial twist; snag; or tear"," 2= against flow"," ",3.4,NA,NA,NA,"","08:34","",NA,NA,NA,38.212277,122.035648,NA,NA,NA,NA,NA,NA,NA,NA,NA,NA," Boat"," ",NA,NA,NA,NA,NA,NA,NA,NA," false"," "," ","","3",NA," 0%"," ",NA," "," GPS 5; ACCURACY 2M. NOT PAIRED. CODE 2 B/C OF DEPTH","true","Mudsucker","AC;ED;AM;GP","Peytonia-Suisun","03/16/2023","PEYT-SUIS","1=0-33% clouds","1=wind 1-3 mph; scaley ripples"," W"," 4=flood",15,13.5,8.08,990,7.6,82.3,0.68,1.24,27.7," 1=absent",1," Inside",NA," false"," ",2023-03-16,2023,3,"2023-03-16 08:34","Spring"
"147",7435,12455,"LAMOPE03-WING-16MAR2023","true","Seine","LAMOPE",""," 1. No twists; snags; or tears"," 2= against flow"," ",0.8,NA,NA,NA,"","09:00","",NA,NA,NA,38.214311,122.040556,NA,NA,NA,NA,NA,NA,NA,NA,NA,NA," Boat"," ",NA,NA,NA,NA,NA,NA,NA,NA," false"," "," ","","3",NA," 0%"," ",NA," "," GPS 5. NOT PAIRED. ","true","Mudsucker","AC;ED;AM;GP","Wings Landing","03/16/2023","WING-TP-INT","1=0-33% clouds","1=wind 1-3 mph; scaley ripples"," W"," 4=flood",14,11.4,7.93,921,7.6,90.5,0.85,1.85,28.5," 1=absent",1," Inside",NA," false"," ",2023-03-16,2023,3,"2023-03-16 09:00","Spring"
"148",7436,12456,"LAMOPE04-WING-16MAR2023","true","Seine","LAMOPE",""," 1. No twists; snags; or tears"," 2= against flow"," ",0.9,NA,NA,NA,"","09:15","",NA,NA,NA,38.21567,122.03584,NA,NA,NA,NA,NA,NA,NA,NA,NA,NA," Boat"," ",NA,NA,NA,NA,NA,NA,NA,NA," false"," "," ","","3",NA," 0%"," ",NA," "," GPS 5; ACCURACY 2M. NOT PAIRED.","true","Mudsucker","AC;ED;AM;GP","Wings Landing","03/16/2023","WING-TP-INT","1=0-33% clouds","1=wind 1-3 mph; scaley ripples"," W"," 4=flood",15,13.5,8,994,7.6,79.6,0.65,1.32,27.6," 1=absent",1," Inside",NA," false"," ",2023-03-16,2023,3,"2023-03-16 09:15","Spring"
"149",7437,12457,"LAMOPE05-WING-16MAR2023","true","Seine","LAMOPE",""," 1. No twists; snags; or tears"," 2= against flow"," ",1.1,NA,NA,NA,"","09:40","",NA,NA,NA,38.222018,122.039636,NA,NA,NA,NA,NA,NA,NA,NA,NA,NA," Boat"," ",NA,NA,NA,NA,NA,NA,NA,NA," false"," "," ","","3",NA," 0%"," ",NA," "," GPS 5; ACCURACY 2M. NOT PAIRED. THRSTI @ 43: FRP23-517","true","Mudsucker","AC;ED;AM;GP","Wings Landing","03/16/2023","WING-TP-INT","1=0-33% clouds","1=wind 1-3 mph; scaley ripples"," W"," 1=high slack",18,13.2,8.42,1002,7.7,59.9,0.61,1.49,29.2," 1=absent",1," Inside",NA," false"," ",2023-03-16,2023,3,"2023-03-16 09:40","Spring"
"150",7438,12458,"LAMOPE06-PEYT-16MAR2023","true","Seine","LAMOPE",""," 2. Partial twist; snag; or tear"," 2= against flow"," ",3.7,NA,NA,NA,"","10:05","",NA,NA,NA,38.221715,122.04398,NA,NA,NA,NA,NA,NA,NA,NA,NA,NA," Boat"," ",NA,NA,NA,NA,NA,NA,NA,NA," false"," "," ","","3",NA," 0%"," ",NA," "," GPS 5; ACCURACY 2M. NOT PAIRED.  Code 2: Depth","true","Mudsucker","AC;ED;AM;GP","Peytonia-Suisun","03/16/2023","PEYT-PEYT","1=0-33% clouds","0=Calm; glassy"," W"," 1=high slack",11,13.5,7.83,882,7.6,85.9,0.66,1.33,26.9," 1=absent",1," Inside",NA," false"," ",2023-03-16,2023,3,"2023-03-16 10:05","Spring"
"151",7439,12459,"LAMOPE07-ARNO-16MAR2023","true","Seine","LAMOPE",""," 1. No twists; snags; or tears"," 2= against flow"," ",0.9,NA,NA,NA,"","11:22","",NA,NA,NA,38.178302,121.901038,NA,NA,NA,NA,NA,NA,NA,NA,NA,NA," Boat"," ",NA,NA,NA,NA,NA,NA,NA,NA," false"," "," ","","3",NA," 0%"," ",NA," "," GPS 5; ACCURACY 4M. NOT PAIRED. ","true","Mudsucker","AC;ED;AM;GP","Arnold Slough","03/16/2023","ARNO-UNK","1=0-33% clouds","1=wind 1-3 mph; scaley ripples"," N"," 2=ebb",28,13,9.49,1275,7.4,26.8,0.42,0.77,25.3," 1=absent",1," Inside",NA," false"," ",2023-03-16,2023,3,"2023-03-16 11:22","Spring"
"152",7440,12460,"LAMOPE08-ARNO-16MAR2023","true","Seine","LAMOPE",""," 1. No twists; snags; or tears"," 2= against flow"," ",1.3,NA,NA,NA,"","11:38","",NA,NA,NA,38.177148,121.902623,NA,NA,NA,NA,NA,NA,NA,NA,NA,NA," Boat"," ",NA,NA,NA,NA,NA,NA,NA,NA," false"," "," ","","3",NA," 0%"," ",NA," "," GPS 5; ACCURACY 2M. NOT PAIRED. ","true","Mudsucker","AC;ED;AM;GP","Arnold Slough","03/16/2023","ARNO-CH-M","1=0-33% clouds","2= wind 4-7 mph; small wavelets"," N"," 2=ebb",27,12.8,9.29,1336,7.4,30,0.49,1.04,28.1," 1=absent",1," Inside",NA," false"," ",2023-03-16,2023,3,"2023-03-16 11:38","Spring"
"153",7441,12461,"LAMOPE09-ARNO-16MAR2023","true","Seine","LAMOPE",""," 1. No twists; snags; or tears"," 2= against flow"," ",0.6,NA,NA,NA,"","11:52","",NA,NA,NA,38.174938,121.901754,NA,NA,NA,NA,NA,NA,NA,NA,NA,NA," Boat"," ",NA,NA,NA,NA,NA,NA,NA,NA," false"," "," ","","3",NA," 0%"," ",NA," "," GPS 5; ACCURACY 2M. NOT PAIRED","true","Mudsucker","AC;ED;AM;GP","Arnold Slough","03/16/2023","ARNO-UNK","1=0-33% clouds","2= wind 4-7 mph; small wavelets"," N"," 2=ebb",21,14.1,8.95,1624,7.4,39.1,0.73,1.79,35," 1=absent",1," Inside",NA," false"," ",2023-03-16,2023,3,"2023-03-16 11:52","Spring"
"154",7442,12462,"LAMOPE10-NURS-16MAR2023","true","Seine","LAMOPE",""," 1. No twists; snags; or tears"," 2= against flow"," ",1.8,NA,NA,NA,"","12:54","",NA,NA,NA,38.183715,121.91357,NA,NA,NA,NA,NA,NA,NA,NA,NA,NA," Boat"," ",NA,NA,NA,NA,NA,NA,NA,NA," false"," "," ","","3",NA," 0%"," ",NA," "," GPS 5; ACCURACY 2M. NOT PAIRED. ","true","Mudsucker","AC;ED;AM;GP","Nurse-Denverton","03/16/2023","NURS-LHB-NE","1=0-33% clouds","1=wind 1-3 mph; scaley ripples"," NE"," 2=ebb",30,12.9,9.27,1232,7.3,27.3,0.53,1.21,24.4," 1=absent",1," Inside",NA," false"," ",2023-03-16,2023,3,"2023-03-16 12:54","Spring"
"155",7443,12463,"LAMOPE11-NURS-16MAR2023","true","Seine","LAMOPE",""," 2. Partial twist; snag; or tear"," 2= against flow"," ",3.1,NA,NA,NA,"","13:19","",NA,NA,NA,38.182801,121.927091,NA,NA,NA,NA,NA,NA,NA,NA,NA,NA," Boat"," ",NA,NA,NA,NA,NA,NA,NA,NA," false"," "," ","","3",NA," 34-66%"," ",NA," "," GPS 5; ACCURACY 2M. NOT PAIRED. CODE 2 = NET WAS NARROW; CAUGHT ON TULE ROOT WAD","true","Mudsucker","AC;ED;AM;GP","Nurse-Denverton","03/16/2023","NURS-EXT-BRAD-W","1=0-33% clouds","1=wind 1-3 mph; scaley ripples"," NE"," 2=ebb",22,12.9,9.57,1221,7.4,30.3,0.45,0.89,23.5," 1=absent",1," Inside",NA," false"," ",2023-03-16,2023,3,"2023-03-16 13:19","Spring"
