"","SampleID_frp","OrganismCode","OrganismId","SampleID_key","VisitNo","QAQC.x","GearType","GearTypeAbbreviation","Habitat","SeineCode","TowDirection","HabitatMorphology","DepthOfWater","CableOut","LengthOfTrawl","Width","Netter","StartTime","EndTime","Duration","PercentOpen","DepthOfSample","LatitudeStart","LongitudeStart","LatitudeEnd","LongitudeEnd","NetMeterSerial","NetMeterStart","NetMeterEnd","Volts","DutyCycle","Amps","PulseRate","VolumeEstimated","SeineDeploymentType","GearDetail","Silt","Sand","Gravel","Cobble","Boulder","Organics","MassOfStandardLow","MassOfStandardHigh","QuestionableData.x","VegetationInSample","FlowType","DragMethod","NetNumber","CodEnd","CodEndPercent","GpsUnit","GpsAccuracy","DepthSource","Comments","Flagged_Data","QAQC.y","Boat","Crew","Location","Visit.Date","Station","Weather","WindWaves","WindDirection","Tide","Secchi","SurfTemp","DO","SC","pH","Turbidity","Phycocyanin","Chlorophyll","FDOM","Microcystis","SondeNo","Wetland","DataQuality","QuestionableData.y","SiteComments","Visit.Date2","year","month","DateTime","Season","DepthSource2","DepthOfWater2","DepthMeters","volume","SeineCode2","Casts","rotations","rotation.final","rpm","ave_vol","FishId","TotalCatch","PlusCount","IDer","IdDate","PercentSampled","FishCatchNotes","EntryOrder","FishLength","FishWeight","Hai","FinsHai","SkinHai","EyesHai","ParasiteHai","GillsHai","DeformHai","TagYear","TagSerial","AdClip","Mortality","FishLengthComments","FishCode","Code_UCDAVIS","Code_YBFM","CommonName","Category","Species","Genus","Family","Order","Class","Phylum","Native","State.Status","Federal.Status","Status.Abrev","LifeStage","FishDiet","Legend_Clams","Legend_Fish_Color_hex","Legend_Fish","Legend_Macro","Legend_Meso","Analy","Analy2","CN","length_count","fish4$SampleID_frp","fish4$CommonName","count_check","CPUEbySpp","CPUEbySpp2","tCPUE","PercentComp","fish5$SampleID_frp","fish5$CommonName"
"1","BEASEI01-BRAD-09MAY2023","164",329,13449,8047,"true","Seine","BEASEI","","1. No twists; snags; or tears"," 2= against flow"," ",0.5,NA,15,15,"","08:50","",NA,NA,NA,38.189129,121.920662,NA,NA,NA,NA,NA,NA,NA,NA,NA,NA,"Crew Members"," ",NA,NA,NA,NA,NA,NA,NA,NA," false"," "," ","",2,NA," 1-33%"," ",NA,""," gps 5; accuracy 2m. not paired.",NA,"true","Airboat","AC;ED;SH;AM","Bradmoor Island","05/09/2023","BRAD-SS","3=66-100% clouds","1=wind 1-3 mph; scaley ripples"," SW"," 2=ebb",NA,17,7.78,839,7.8,30.8,0.47,1.98,21.8," 1=absent",2," Inside",NA," false"," ",2023-05-09,2023,5,"2023-05-09 08:50","Spring","",0.5,0.5,56.25," 1. No twists; snags; or tears",NA,NA,NA,NA,NA,15305,1,0,"","",NA,"",29663,37,NA,"true",0,0,0,0,0,0,NA,"","false","false","","MOSQUI","MQF","MQF","Mosquitofish","Fish","affinis","Gambusia","Poeciliidae","Cyprinodontiformes","Actinopterygii","Chordata","Introduced","","","","larvae",FALSE,"Present",NA,"Mosquitofish","Fish Larvae","Fish Larvae","fish","fish","Mosquitofish",1,"BEASEI01-BRAD-09MAY2023","Mosquitofish",0,177.777777777778,177.777777777778,206933.333333333,0.000859106529209622,"BEASEI01-BRAD-09MAY2023","Mosquitofish"
"2","BEASEI01-HORS-01FEB2023","1361",1361,12308,7308,"true","Seine","BEASEI","","1. No twists; snags; or tears"," 2= against flow"," ",1,NA,7.5,15,"","08:30","",NA,NA,NA,38.098448,121.709436,NA,NA,NA,NA,NA,NA,NA,NA,NA,NA,"Crew Members"," ",NA,NA,NA,NA,NA,NA,NA,NA," false"," "," ","",2,NA," 0%"," ",NA,""," not paired. gps 5; accuracy 7.7 ft. gps from phone. spc from 26 and 30 off for sonde #2",NA,"true","Mudsucker","DMC;ED;GU;GP","Horseshoe Bend","02/01/2023","HORS-N","1=0-33% clouds","1=wind 1-3 mph; scaley ripples"," NW"," 4=flood",27,8.2,10.65,232,7.6,28.5,0.34,0.6,16.7," 1=absent",2," Inside",NA," false"," LS - LEIGH SANDERS GUEST",2023-02-01,2023,2,"2023-02-01 08:30","Winter","",1,1,56.25," 1. No twists; snags; or tears",NA,NA,NA,NA,NA,14540,2,0,"","",NA,"",28369,40,NA,"true",0,0,0,0,0,0,NA,"","false","false","","CHISAL-F","","","Chinook Salmon (fall)","Fish","tshawytscha","Oncorhynchus","Salmonidae","Salmoniformes","Actinopterygii","Chordata","Native","","","","",FALSE,"Present",NA,"Chinook Salmon (fall)","","","fish","fish","Chinook Salmon (fall)",2,"BEASEI01-HORS-01FEB2023","Chinook Salmon (fall)",0,355.555555555556,355.555555555556,1244.44444444444,0.285714285714286,"BEASEI01-HORS-01FEB2023","Chinook Salmon (fall)"
"3","BEASEI01-HORS-02MAR2023","1361",1361,12377,7357,"true","Seine","BEASEI","","1. No twists; snags; or tears"," 2= against flow"," ",1.1,NA,10.5,8.75,"","10:47","",NA,NA,NA,38.097354,121.709718,NA,NA,NA,NA,NA,NA,NA,NA,NA,NA,"Crew Members"," ",NA,NA,NA,NA,NA,NA,NA,NA," false"," "," ","",1,NA," 0%"," ",NA,""," gps 5; accuracy 2m. not paired.",NA,"true","Mudsucker","AC;DMC;ED;GU;AM","Horseshoe Bend","03/02/2023","HORS-N","1=0-33% clouds","1=wind 1-3 mph; scaley ripples"," NW"," 4=flood",53,8.3,11.36,229,7.7,10.9,0.48,0.43,16.6," 1=absent",1," Inside",NA," false"," BA=BRIAN ARMSTRONG (GUEST)",2023-03-02,2023,3,"2023-03-02 10:47","Spring","",1.1,1.1,50.53125," 1. No twists; snags; or tears",NA,NA,NA,NA,NA,14705,59,0,"","",NA,"",28536,52,NA,"true",0,0,0,0,0,0,NA,"","false","false","","CHISAL-F","","","Chinook Salmon (fall)","Fish","tshawytscha","Oncorhynchus","Salmonidae","Salmoniformes","Actinopterygii","Chordata","Native","","","","",FALSE,"Present",NA,"Chinook Salmon (fall)","","","fish","fish","Chinook Salmon (fall)",59,"BEASEI01-HORS-02MAR2023","Chinook Salmon (fall)",0,11675.9431045145,11675.9431045145,19393.9393939394,0.602040816326531,"BEASEI01-HORS-02MAR2023","Chinook Salmon (fall)"
"4","BEASEI01-HORS-03JAN2023","1361",1361,12241,7241,"true","Seine","BEASEI","","1. No twists; snags; or tears"," 2= against flow"," ",1,NA,6,15,"","09:10","",NA,NA,NA,38.098501,121.70949,NA,NA,NA,NA,NA,NA,NA,NA,NA,NA,"Crew Members"," ",NA,NA,NA,NA,NA,NA,NA,NA," false"," "," ","",2,NA," 0%"," ",NA,""," gps #6; accuracy 3m. not paired. salmon! gps manually updated from geo-tagged photos taken that day - ed 21jul2023",NA,"true","Mudsucker","AC;ED;KS","Horseshoe Bend","01/03/2023","HORS-N","3=66-100% clouds","1=wind 1-3 mph; scaley ripples"," NA"," 4=flood",15,9.5,9.83,126,7.5,64.3,0.43,0.71,14.7," 1=absent",2," Inside",NA," false"," ",2023-01-03,2023,1,"2023-01-03 09:10","Winter","",1,1,45," 1. No twists; snags; or tears",NA,NA,NA,NA,NA,14341,4,0,"","",NA,"",27983,37,NA,"true",0,0,0,0,0,0,NA,"CDFW_23FRP005","false","false","CDFW_23FRP005","CHISAL-F","","","Chinook Salmon (fall)","Fish","tshawytscha","Oncorhynchus","Salmonidae","Salmoniformes","Actinopterygii","Chordata","Native","","","","",FALSE,"Present",NA,"Chinook Salmon (fall)","","","fish","fish","Chinook Salmon (fall)",4,"BEASEI01-HORS-03JAN2023","Chinook Salmon (fall)",0,888.888888888889,888.888888888889,2444.44444444444,0.363636363636364,"BEASEI01-HORS-03JAN2023","Chinook Salmon (fall)"
"5","BEASEI01-HORS-10MAY2023","175",437,13384,7984,"true","Seine","BEASEI","","1. No twists; snags; or tears"," 2= against flow"," ",1.1,NA,7.5,15,"","09:09","",NA,NA,NA,38.096885,121.709762,NA,NA,NA,NA,NA,NA,NA,NA,NA,NA,"Crew Members"," ",NA,NA,NA,NA,NA,NA,NA,NA," false"," "," ","",2,NA," 0%"," ",NA,""," gps 6 accuracy 3m. mortality: spltai; splitai brought back to confirm id; 2 unids in vials; frp23-016: unid; frp23-017: spltai. gps calculated in 2023 sample inventory - ed 9/11/2023",NA,"true","Mudsucker","CB;AC;ED;AM","Horseshoe Bend","05/10/2023","HORS-N","1=0-33% clouds","1=wind 1-3 mph; scaley ripples"," SW"," 2=ebb",33,14.9,9.56,122,7.6,6.4,0.75,0.25,6.9," 1=absent",2," Inside",NA," false"," ",2023-05-10,2023,5,"2023-05-10 09:09","Spring","",1.1,1.1,61.875," 1. No twists; snags; or tears",NA,NA,NA,NA,NA,15202,1,0,"","",NA,"",30441,15,NA,"true",0,0,0,0,0,0,NA,"","false","false","","SACSUC","SKR","SASU","Sacramento Sucker","Fish","occidentalis","Catostomus","Catostomidae","Cypriniformes","Actinopterygii","Chordata","Native","","","","",FALSE,"Present",NA,"Sacramento Sucker","Fish Larvae","Fish Larvae","fish","fish","Sacramento Sucker",1,"BEASEI01-HORS-10MAY2023","Sacramento Sucker",0,161.616161616162,161.616161616162,41373.7373737374,0.00390625,"BEASEI01-HORS-10MAY2023","Sacramento Sucker"
"6","BEASEI01-HORS-11APR2023","1361",1361,12537,7497,"true","Seine","BEASEI","","2. Partial twist; snag; or tear"," 2= against flow"," ",0.6,NA,12,13.25,"","13:13","",NA,NA,NA,38.081527,121.719113,NA,NA,NA,NA,NA,NA,NA,NA,NA,NA,"Crew Members"," ",NA,NA,NA,NA,NA,NA,NA,NA," false"," "," ","",1,NA," 0%"," ",NA,""," seine code 2=lots of mud in cod end; needed to rinse net. salmon mortality. gps calculated in 2023 sample inventory by ed",NA,"true","Mudsucker","CB;AC;ED;GU","Horseshoe Bend","04/11/2023","HORS-M","1=0-33% clouds","2= wind 4-7 mph; small wavelets"," SW"," 2=ebb",58,14.7,10.12,166,7.6,14.3,0.19,0.54,11," 1=absent",1," Inside",NA," false"," Guest: Alec Strachan",2023-04-11,2023,4,"2023-04-11 13:13","Spring","",0.6,0.6,47.7," 2. Partial twist; snag; or tear",NA,NA,NA,NA,NA,14947,25,0,"","",NA,"",28967,42,NA,"true",0,0,0,0,0,0,NA,"","false","false","","CHISAL-F","","","Chinook Salmon (fall)","Fish","tshawytscha","Oncorhynchus","Salmonidae","Salmoniformes","Actinopterygii","Chordata","Native","","","","",FALSE,"Present",NA,"Chinook Salmon (fall)","","","fish","fish","Chinook Salmon (fall)",25,"BEASEI01-HORS-11APR2023","Chinook Salmon (fall)",0,5241.09014675052,5241.09014675052,9643.60587002097,0.543478260869565,"BEASEI01-HORS-11APR2023","Chinook Salmon (fall)"
"7","BEASEI01-HORS-15DEC2022","197",315,12124,7126,"true","Seine","BEASEI","","1. No twists; snags; or tears"," 2= against flow"," ",0.9,NA,7.5,10,"","09:20","",NA,NA,NA,38.098557,121.70943,NA,NA,NA,NA,NA,NA,NA,NA,NA,NA,"Crew Members"," ",NA,NA,NA,NA,NA,NA,NA,NA," false"," "," ","",2,NA," 0%"," ",NA,""," gearid bs02; dominant vegetation in sample: egeden",NA,"true","Mudsucker","AC;DMC;ED;GP","Horseshoe Bend","12/15/2022","HORS-UNK","1=0-33% clouds","0=Calm; glassy"," NA"," 4=flood",180,9.5,10.27,355,7.5,10.1,0.24,0.3,12.9," 1=absent",2," Inside",NA," false"," SECCHI DEEPER THAN DEPTH",2022-12-15,2022,12,"2022-12-15 09:20","Fall","",0.9,0.9,33.75," 1. No twists; snags; or tears",NA,NA,NA,NA,NA,14085,143,113,"","",NA,"",26563,59,NA,"true",0,0,0,0,0,0,NA,"","false","false","","MISSIL","ISS","MSS","Mississippi Silverside","Fish","berryllia","Menidia","Atherinopsidae","Atheriniformes","Actinopterygii","Chordata","Introduced","","","","larvae",FALSE,"Present",NA,"Mississippi Silverside","Fish Larvae","Fish Larvae","fish","fish","Mississippi Silverside",30,"BEASEI01-HORS-15DEC2022","Mississippi Silverside",0,42370.3703703704,42370.3703703704,42666.6666666667,0.993055555555555,"BEASEI01-HORS-15DEC2022","Mississippi Silverside"
"8","BEASEI01-HORS-30NOV2022","197",315,12216,7214,"true","Seine","BEASEI","","1. No twists; snags; or tears"," "," ",1,NA,10.75,8,"","09:23","",NA,NA,NA,38.097474,121.709693,NA,NA,NA,NA,NA,NA,NA,NA,NA,NA,"Crew Members"," ",NA,NA,NA,NA,NA,NA,NA,NA," false"," "," ","",2,NA," 0%"," ",NA,""," gps 5; accuracy 2m. not paired",NA,"true","Mudsucker","AC;ED;GP;KS","Horseshoe Bend","11/30/2022","HORS-UNK","1=0-33% clouds","0=Calm; glassy"," NA"," 4=flood",NA,11.1,10.41,3064,7.7,12.5,0.26,0.35,6," 1=absent",2," ",NA," false"," ",2022-11-30,2022,11,"2022-11-30 09:23","Fall","",1,1,43," 1. No twists; snags; or tears",NA,NA,NA,NA,NA,14280,231,201,"","",NA,"",27672,52,NA,"true",0,0,0,0,0,0,NA,"","false","false","","MISSIL","ISS","MSS","Mississippi Silverside","Fish","berryllia","Menidia","Atherinopsidae","Atheriniformes","Actinopterygii","Chordata","Introduced","","","","larvae",FALSE,"Present",NA,"Mississippi Silverside","Fish Larvae","Fish Larvae","fish","fish","Mississippi Silverside",30,"BEASEI01-HORS-30NOV2022","Mississippi Silverside",0,53720.9302325581,53720.9302325581,53720.9302325581,1,"BEASEI01-HORS-30NOV2022","Mississippi Silverside"
"9","BEASEI01-LIBE-08MAR2023","1361",1361,12383,7363,"true","Seine","BEASEI","","1. No twists; snags; or tears"," 2= against flow"," ",1,NA,11,15,"","07:50","",NA,NA,NA,38.242036,121.682167,NA,NA,NA,NA,NA,NA,NA,NA,NA,NA,"Crew Members"," ",NA,NA,NA,NA,NA,NA,NA,NA," false"," "," ","",1,NA," 1-33%"," ",NA,""," gps 5; accuracy 2m. not paired. ",NA,"true","Mudsucker","AC;ED;GU;AM;GP","Liberty Island","03/08/2023","LIBE_UNK","4=rain","1=wind 1-3 mph; scaley ripples"," NA"," 2=ebb",43,9.1,10.76,260,7.8,13.2,0.56,0.84,15," 1=absent",1," Inside",NA," false"," LS= LEIGH SANDERS (GUEST)",2023-03-08,2023,3,"2023-03-08 07:50","Spring","",1,1,82.5," 1. No twists; snags; or tears",NA,NA,NA,NA,NA,14723,2,0,"","",NA,"",28661,39,NA,"true",0,0,0,0,0,0,NA,"","false","false","","CHISAL-F","","","Chinook Salmon (fall)","Fish","tshawytscha","Oncorhynchus","Salmonidae","Salmoniformes","Actinopterygii","Chordata","Native","","","","",FALSE,"Present",NA,"Chinook Salmon (fall)","","","fish","fish","Chinook Salmon (fall)",2,"BEASEI01-LIBE-08MAR2023","Chinook Salmon (fall)",0,242.424242424242,242.424242424242,242.424242424242,1,"BEASEI01-LIBE-08MAR2023","Chinook Salmon (fall)"
"10","BEASEI01-LIBE-25MAY2023","177",400,13487,8084,"true","Seine","BEASEI","","1. No twists; snags; or tears"," 2= against flow"," ",1.1,NA,11,15,"","12:32","",NA,NA,NA,38.241939,121.682273,NA,NA,NA,NA,NA,NA,NA,NA,NA,NA,"Crew Members"," ",NA,NA,NA,NA,NA,NA,NA,NA," false"," "," ","",2,NA," 1-33%"," ",NA,""," secchi hit bottom. sacsuc and fish unid both in same vial. gps 6. not paired. sacsuc and unid identified at splitt - ma 5/26/2023",NA,"true","Mudsucker","DMC;ED;GU;AM","Liberty Island","05/25/2023","LIBE_UNK","1=0-33% clouds","1=wind 1-3 mph; scaley ripples"," W"," 2=ebb",NA,17.9,11.68,113,8.8,4.7,0.11,0.22,5," 1=absent",2," Inside",NA," false"," ",2023-05-25,2023,5,"2023-05-25 12:32","Spring","",1.1,1.1,90.75," 1. No twists; snags; or tears",NA,NA,NA,NA,NA,15424,2,0,"","",NA,"",30247,22,NA,"true",0,0,0,0,0,0,NA,"","false","false","","PRISCU","SCP","PRS","Prickly Sculpin","Fish","aspur","Cottus","Cottidae","Scorpaeniformes","Actinopterygii","Chordata","Native","","","","",FALSE,"Present",NA,"Prickly Sculpin","Fish Larvae","Fish Larvae","fish","fish","Prickly Sculpin",2,"BEASEI01-LIBE-25MAY2023","Prickly Sculpin",0,220.385674931129,220.385674931129,122754.820936639,0.00179533213644524,"BEASEI01-LIBE-25MAY2023","Prickly Sculpin"
"11","BEASEI01-LIBE-26APR2023","136",195,13374,7968,"true","Seine","BEASEI","","1. No twists; snags; or tears"," 2= against flow"," ",0.6,NA,10,10.5,"","14:36","",NA,NA,NA,38.244686,121.686752,NA,NA,NA,NA,NA,NA,NA,NA,NA,NA,"Crew Members"," ",NA,NA,NA,NA,NA,NA,NA,NA," false"," "," ","",2,NA," 1-33%"," ",NA,""," gps 5; accuracy 2m. not paired.",NA,"true","Mudsucker","AC;ED;AM;SS","Liberty Island","04/26/2023","LIBE_UNK","1=0-33% clouds","0=Calm; glassy"," NW"," 2=ebb",NA,19.1,11.61,282,8.5,4,0.32,0.68,8.5," 1=absent",1," Inside",NA," false"," secchi is greater than bottom",2023-04-26,2023,4,"2023-04-26 14:36","Spring","",0.6,0.6,31.5," 1. No twists; snags; or tears",NA,NA,NA,NA,NA,15192,1,1,"","",NA,"",NA,NA,NA,"",NA,NA,NA,NA,NA,NA,NA,"","","","","EXOPAL","EXOPAL","SHR","Siberian Prawn","Invertebrate","modestus","Exopalaemon","Palaemonidae","Decapoda","Malacostraca","Arthropoda","Introduced","","","","adult",TRUE,"Present",NA,"","Decapoda Adult","Decapoda","Decapoda","Decapoda","Exopalaemon",NA,"BEASEI01-LIBE-26APR2023","Siberian Prawn",NA,317.460317460317,0,317.460317460317,0,"BEASEI01-LIBE-26APR2023","Siberian Prawn"
"12","BEASEI01-LOWE-17MAR2023","164",329,12424,7404,"true","Seine","BEASEI","","2. Partial twist; snag; or tear"," 2= against flow"," ",0.7,NA,15,15,"","10:35","",NA,NA,NA,38.329613,121.680934,NA,NA,NA,NA,NA,NA,NA,NA,NA,NA,"Crew Members"," ",NA,NA,NA,NA,NA,NA,NA,NA," false"," "," ","",2,NA," 0%"," ",NA,""," gps 5; accuracy 2m. not paired. lots of dead slugs; no secchi. deepiner in middle of area seined. conducted on floodplain.",NA,"true","Mudsucker","DMC;ED;AM;GP","Lower Yolo Ranch","03/17/2023","LOWE-UNK","1=0-33% clouds","1=wind 1-3 mph; scaley ripples"," NW"," 2=ebb",NA,13.3,8.27,416,7.7,33.8,0.67,1.7,19.5," 1=absent",1," Inside",NA," false"," no secchi taken",2023-03-17,2023,3,"2023-03-17 10:35","Spring","",0.7,0.7,78.75," 2. Partial twist; snag; or tear",NA,NA,NA,NA,NA,14804,2,0,"","",NA,"",28782,22,NA,"true",0,0,0,0,0,0,NA,"","false","false","","MOSQUI","MQF","MQF","Mosquitofish","Fish","affinis","Gambusia","Poeciliidae","Cyprinodontiformes","Actinopterygii","Chordata","Introduced","","","","larvae",FALSE,"Present",NA,"Mosquitofish","Fish Larvae","Fish Larvae","fish","fish","Mosquitofish",2,"BEASEI01-LOWE-17MAR2023","Mosquitofish",0,253.968253968254,253.968253968254,253.968253968254,1,"BEASEI01-LOWE-17MAR2023","Mosquitofish"
"13","BEASEI01-TULE-20MAR2023","164",329,12449,7429,"true","Seine","BEASEI","","1. No twists; snags; or tears"," 2= against flow"," ",0.6,NA,15,15,"","13:25","",NA,NA,NA,38.122837,121.984081,NA,NA,NA,NA,NA,NA,NA,NA,NA,NA,"Crew Members"," ",NA,NA,NA,NA,NA,NA,NA,NA," false"," "," ","",2,NA," 0%"," ",NA,""," gps 5; accuracy 2m. not paired. floodplain; ysi taken from bucket",NA,"true","Mudsucker","CB;ED;GN;GP","Tule Red","03/20/2023","TULE-UNK","1=0-33% clouds","1=wind 1-3 mph; scaley ripples"," W"," 4=flood",NA,14.1,9.91,813,7.7,154.4,1.31,2.61,8.9," 1=absent",1," Inside",NA," false"," ",2023-03-20,2023,3,"2023-03-20 13:25","Spring","",0.6,0.6,67.5," 1. No twists; snags; or tears",NA,NA,NA,NA,NA,14835,1,0,"","",NA,"",28804,25,NA,"true",0,0,0,0,0,0,NA,"","false","false","","MOSQUI","MQF","MQF","Mosquitofish","Fish","affinis","Gambusia","Poeciliidae","Cyprinodontiformes","Actinopterygii","Chordata","Introduced","","","","larvae",FALSE,"Present",NA,"Mosquitofish","Fish Larvae","Fish Larvae","fish","fish","Mosquitofish",1,"BEASEI01-TULE-20MAR2023","Mosquitofish",0,148.148148148148,148.148148148148,1629.62962962963,0.0909090909090909,"BEASEI01-TULE-20MAR2023","Mosquitofish"
"14","BEASEI01-TULE-29NOV2022","197",315,12214,7212,"true","Seine","BEASEI","","1. No twists; snags; or tears"," "," ",0.4,NA,15,13,"","09:10","",NA,NA,NA,38.118129,121.97742,NA,NA,NA,NA,NA,NA,NA,NA,NA,NA,"Crew Members"," ",NA,NA,NA,NA,NA,NA,NA,NA," false"," "," ","",2,NA," 0%"," ",NA,""," gps 5; accuracy 2m. not paired. possible missil too small to id; lots of mud in net; water quality taken from bucket; unid silversides all <25mm",NA,"true","Truck","MA;ED;GP","Tule Red","11/29/2022","TULE-UNK","1=0-33% clouds","1=wind 1-3 mph; scaley ripples"," SW"," 2=ebb",NA,9.5,10.08,20650,7.3,5.1,0.66,4.4,17.8," 1=absent",2," Inside",NA," false"," ",2022-11-29,2022,11,"2022-11-29 09:10","Fall","",0.4,0.4,39," 1. No twists; snags; or tears",NA,NA,NA,NA,NA,14275,120,90,"","",NA,"",27614,52,NA,"true",0,0,0,0,0,0,NA,"","false","false","","MISSIL","ISS","MSS","Mississippi Silverside","Fish","berryllia","Menidia","Atherinopsidae","Atheriniformes","Actinopterygii","Chordata","Introduced","","","","larvae",FALSE,"Present",NA,"Mississippi Silverside","Fish Larvae","Fish Larvae","fish","fish","Mississippi Silverside",30,"BEASEI01-TULE-29NOV2022","Mississippi Silverside",0,30769.2307692308,30769.2307692308,31794.8717948718,0.967741935483871,"BEASEI01-TULE-29NOV2022","Mississippi Silverside"
"15","BEASEI01-TULE-30JAN2023","953",369,12306,7306,"true","Seine","BEASEI","","2. Partial twist; snag; or tear"," 2= against flow"," ",0.5,NA,11.4921875,12.8387096774194,"","10:01","",NA,NA,NA,38.114449,121.97918,NA,NA,NA,NA,NA,NA,NA,NA,NA,NA,"Crew Members"," ",NA,NA,NA,NA,NA,NA,NA,NA," false"," "," ","",1,NA," 1-33%"," ",NA,""," not paired. gps 5; accuracy 2m. mostly detritus/mud in cod end. ysi taken on a bucket. code 2 because there wasnt much of a beach; bad to pull through veg",NA,"true","Truck","ED;GN","Tule Red","01/30/2023","TULE-TP-4","1=0-33% clouds","1=wind 1-3 mph; scaley ripples"," NW"," 1=high slack",NA,6.7,10.59,1787,7.5,60.2,0.68,1.09,21.4," 1=absent",2," Inside",NA," false"," ",2023-01-30,2023,1,"2023-01-30 10:01","Winter","",0.5,0.5,36.8862147177419," 2. Partial twist; snag; or tear",NA,NA,NA,NA,NA,14535,26,0,"","",NA,"",28338,30,NA,"true",0,0,0,0,0,0,NA,"","false","false","","PACSSC","STAG","PSS","Pacific Staghorn Sculpin","Fish","armatus","Leptocottus","Cottidae","Scorpaeniformes","Actinopterygii","Chordata","Native","","","","",FALSE,"Present",NA,"Pacific Staghorn Sculpin","Fish Larvae","Fish Larvae","fish","fish","Pacific Staghorn Sculpin",26,"BEASEI01-TULE-30JAN2023","Pacific Staghorn Sculpin",0,7048.70374988471,7048.70374988471,7048.70374988471,1,"BEASEI01-TULE-30JAN2023","Pacific Staghorn Sculpin"
"16","BEASEI01-WING-04APR2023","953",369,12482,7462,"true","Seine","BEASEI","","1. No twists; snags; or tears"," 2= against flow"," ",0.35,NA,15,2.75,"","11:40","",NA,NA,NA,38.215581,122.035481,NA,NA,NA,NA,NA,NA,NA,NA,NA,NA,"Crew Members"," ",NA,NA,NA,NA,NA,NA,NA,NA," false"," "," ","",1,NA," 0%"," ",NA,""," gps 5; accuracy 3m. not paired.",NA,"true","Mudsucker","CB;AC;ED;GU","Wings Landing","04/04/2023","WING-TP-INT","1=0-33% clouds","1=wind 1-3 mph; scaley ripples"," NW"," 4=flood",20,12.7,8.61,1422,7.7,47.7,0.36,1.58,32.9," 1=absent",2," Inside",1," false"," guest: Danie NC",2023-04-04,2023,4,"2023-04-04 11:40","Spring","",0.35,0.35,7.21875," 1. No twists; snags; or tears",NA,NA,NA,NA,NA,14864,2,0,"","",NA,"",28865,70,0,"true",0,0,0,0,0,0,NA,"","false","false","","PACSSC","STAG","PSS","Pacific Staghorn Sculpin","Fish","armatus","Leptocottus","Cottidae","Scorpaeniformes","Actinopterygii","Chordata","Native","","","","",FALSE,"Present",NA,"Pacific Staghorn Sculpin","Fish Larvae","Fish Larvae","fish","fish","Pacific Staghorn Sculpin",2,"BEASEI01-WING-04APR2023","Pacific Staghorn Sculpin",0,2770.56277056277,2770.56277056277,8311.68831168831,0.333333333333333,"BEASEI01-WING-04APR2023","Pacific Staghorn Sculpin"
"17","BEASEI02-BRAD-09MAY2023","110217",1381,13458,8056,"true","Seine","BEASEI","","1. No twists; snags; or tears"," 2= against flow"," ",0.8,NA,15,15,"","10:05","",NA,NA,NA,38.186072,121.921442,NA,NA,NA,NA,NA,NA,NA,NA,NA,NA,"Crew Members"," ",NA,NA,NA,NA,NA,NA,NA,NA," false"," "," ","",2,NA," 1-33%"," ",NA,""," gps 5; accuracy 2m. not paired. tule perch very gravid; started giving birth as it was released. lots of fil alg",NA,"true","Airboat","AC;ED;SH;AM","Bradmoor Island","05/09/2023","BRAD-W","1=0-33% clouds","1=wind 1-3 mph; scaley ripples"," SW"," 2=ebb",NA,17.6,8.19,1027,7.4,21.7,0.29,1.42,28.1," 1=absent",2," Inside",NA," false"," ",2023-05-09,2023,5,"2023-05-09 10:05","Spring","",0.8,0.8,90," 1. No twists; snags; or tears",NA,NA,NA,NA,NA,15313,26,0,"","",NA,"",29679,41,NA,"true",0,0,0,0,0,0,NA,"","false","false","","KILSPP","","KLF","Killifish spp.","Fish","","Lucania","Cyprinodontidae","Cyprinodontiformes","Osteichthyes","Chordata","Introduced","","","","adult",NA,"",NA,"Killifish spp.","","","","","",26,"BEASEI02-BRAD-09MAY2023","Killifish spp.",0,2888.88888888889,2888.88888888889,24888.8888888889,0.116071428571429,"BEASEI02-BRAD-09MAY2023","Killifish spp."
"18","BEASEI02-FLYW-08MAR2023","110217",1381,12385,7365,"true","Seine","BEASEI","","2. Partial twist; snag; or tear"," 2= against flow"," ",0.8,NA,13,7,"","10:05","",NA,NA,NA,38.365069,121.642923,NA,NA,NA,NA,NA,NA,NA,NA,NA,NA,"Crew Members"," ",NA,NA,NA,NA,NA,NA,NA,NA," false"," "," ","",1,NA," 1-33%"," ",NA,""," gps 5; accuracy 3m. not paired. code 2 = no actual beach; weird deployment method. veg mostly dead tule. length calculated from google earth (distance between 38.65072; -121.642926 and 38.365168; -121.642926 : double check)",NA,"true","Mudsucker","AC;ED;GU;AM;GP","Flyway Farms","03/08/2023","FLYW-CH-N","1=0-33% clouds","1=wind 1-3 mph; scaley ripples"," SW"," 2=ebb",20,9.5,9.43,764,7.8,13.1,0.66,1.36,21.5," 1=absent",1," Inside",NA," false"," LS=LEIGH SANDERS (GUEST)",2023-03-08,2023,3,"2023-03-08 10:05","Spring","",0.8,0.8,36.4," 2. Partial twist; snag; or tear",NA,NA,NA,NA,NA,14738,4,0,"","",NA,"",28717,30,NA,"true",0,0,0,0,0,0,NA,"","false","false","","KILSPP","","KLF","Killifish spp.","Fish","","Lucania","Cyprinodontidae","Cyprinodontiformes","Osteichthyes","Chordata","Introduced","","","","adult",NA,"",NA,"Killifish spp.","","","","","",4,"BEASEI02-FLYW-08MAR2023","Killifish spp.",0,1098.9010989011,1098.9010989011,238736.263736264,0.0046029919447641,"BEASEI02-FLYW-08MAR2023","Killifish spp."
"19","BEASEI02-HORS-01FEB2023","110217",1381,12309,7309,"true","Seine","BEASEI","","1. No twists; snags; or tears"," 2= against flow"," ",0.95,NA,12.5,15,"","08:50","",NA,NA,NA,38.081493,121.719445,NA,NA,NA,NA,NA,NA,NA,NA,NA,NA,"Crew Members"," ",NA,NA,NA,NA,NA,NA,NA,NA," false"," "," ","",2,NA," 0%"," ",NA,""," not paired. gps 5; accuracy 7.7 ft. gps from phone.",NA,"true","Mudsucker","DMC;ED;GU;GP","Horseshoe Bend","02/01/2023","HORS-M","1=0-33% clouds","1=wind 1-3 mph; scaley ripples"," NW"," 4=flood",40,8,10.67,236,7.6,22.1,0.34,0.55,19.1," 1=absent",2," Inside",NA," false"," LS = LEIGH SANDERS",2023-02-01,2023,2,"2023-02-01 08:50","Winter","",0.95,0.95,89.0625," 1. No twists; snags; or tears",NA,NA,NA,NA,NA,14543,3,0,"","",NA,"",28380,26,NA,"true",0,0,0,0,0,0,NA,"","false","false","","KILSPP","","KLF","Killifish spp.","Fish","","Lucania","Cyprinodontidae","Cyprinodontiformes","Osteichthyes","Chordata","Introduced","","","","adult",NA,"",NA,"Killifish spp.","","","","","",3,"BEASEI02-HORS-01FEB2023","Killifish spp.",0,336.842105263158,336.842105263158,1010.52631578947,0.333333333333333,"BEASEI02-HORS-01FEB2023","Killifish spp."
"20","BEASEI02-HORS-02MAR2023","1361",1361,12378,7358,"true","Seine","BEASEI","","1. No twists; snags; or tears"," 2= against flow"," ",0.95,NA,10.5,15,"","11:38","",NA,NA,NA,38.08442,121.734377,NA,NA,NA,NA,NA,NA,NA,NA,NA,NA,"Crew Members"," ",NA,NA,NA,NA,NA,NA,NA,NA," false"," "," ","",1,NA," 1-33%"," ",NA,""," gps 5; accuracy 2m. not paired. redshi being taken back for better id",NA,"true","Mudsucker","AC;DMC;ED;GU;AM","Horseshoe Bend","03/02/2023","HORS-S","1=0-33% clouds","1=wind 1-3 mph; scaley ripples"," NW"," 4=flood",44,8.6,11.38,240,7.8,11.8,0.49,0.49,15," 1=absent",1," Inside",NA," false"," BA=BRIAN ARMSTRONG (GUEST) ",2023-03-02,2023,3,"2023-03-02 11:38","Spring","",0.95,0.95,74.8125," 1. No twists; snags; or tears",NA,NA,NA,NA,NA,14709,5,0,"","",NA,"",28609,38,NA,"true",0,0,0,0,0,0,NA,"","false","false","","CHISAL-F","","","Chinook Salmon (fall)","Fish","tshawytscha","Oncorhynchus","Salmonidae","Salmoniformes","Actinopterygii","Chordata","Native","","","","",FALSE,"Present",NA,"Chinook Salmon (fall)","","","fish","fish","Chinook Salmon (fall)",5,"BEASEI02-HORS-02MAR2023","Chinook Salmon (fall)",0,668.337510442774,668.337510442774,40100.2506265664,0.0166666666666667,"BEASEI02-HORS-02MAR2023","Chinook Salmon (fall)"
"21","BEASEI02-HORS-03JAN2023","1361",1361,12242,7242,"true","Seine","BEASEI","","1. No twists; snags; or tears"," 2= against flow"," ",1,NA,6.5,9,"","09:54","",NA,NA,NA,38.097405,121.709736,NA,NA,NA,NA,NA,NA,NA,NA,NA,NA,"Crew Members"," ",NA,NA,NA,NA,NA,NA,NA,NA," false"," "," ","",2,NA," 1-33%"," ",NA,""," gps 6; accuracy 2m. not paired. dominant vegetation in net: egeden. tide flowing out still because of amount of water there is. gps manually updated based on fixed beach seine locations - ed 21jul2023",NA,"true","Mudsucker","AC;ED;KS","Horseshoe Bend","01/03/2023","HORS-N","3=66-100% clouds","2= wind 4-7 mph; small wavelets"," NA"," 4=flood",18,9.5,9.92,130,7.4,62.3,0.44,0.68,14.9," 1=absent",2," Inside",NA," false"," ",2023-01-03,2023,1,"2023-01-03 09:54","Winter","",1,1,29.25," 1. No twists; snags; or tears",NA,NA,NA,NA,NA,14348,4,0,"","",NA,"",28029,38,NA,"true",0,0,0,0,0,0,NA,"CDFW_23FRP007","false","false","","CHISAL-F","","","Chinook Salmon (fall)","Fish","tshawytscha","Oncorhynchus","Salmonidae","Salmoniformes","Actinopterygii","Chordata","Native","","","","",FALSE,"Present",NA,"Chinook Salmon (fall)","","","fish","fish","Chinook Salmon (fall)",4,"BEASEI02-HORS-03JAN2023","Chinook Salmon (fall)",0,1367.52136752137,1367.52136752137,14700.8547008547,0.0930232558139535,"BEASEI02-HORS-03JAN2023","Chinook Salmon (fall)"
"22","BEASEI02-HORS-10MAY2023","197",315,13401,8001,"true","Seine","BEASEI","","1. No twists; snags; or tears"," 2= against flow"," ",1,NA,9.25,13,"","09:43","",NA,NA,NA,38.097485,121.709692,NA,NA,NA,NA,NA,NA,NA,NA,NA,NA,"Crew Members"," ",NA,NA,NA,NA,NA,NA,NA,NA," false"," "," ","",2,NA," 0%"," ",NA,""," gps 6; accuracy 3m. gps picked from known sample location in google earth - ed 9/11/2023",NA,"true","Mudsucker","CB;AC;ED;AM","Horseshoe Bend","05/10/2023","HORS-N","1=0-33% clouds","1=wind 1-3 mph; scaley ripples"," SW"," 2=ebb",71,14.9,9.74,122,7.7,11.7,0.73,0.38,6.6," 1=absent",2," Inside",NA," false"," ",2023-05-10,2023,5,"2023-05-10 09:43","Spring","",1,1,60.125," 1. No twists; snags; or tears",NA,NA,NA,NA,NA,15204,1,0,"","",NA,"",29355,31,NA,"true",0,0,0,0,0,0,NA,"","false","false","","MISSIL","ISS","MSS","Mississippi Silverside","Fish","berryllia","Menidia","Atherinopsidae","Atheriniformes","Actinopterygii","Chordata","Introduced","","","","larvae",FALSE,"Present",NA,"Mississippi Silverside","Fish Larvae","Fish Larvae","fish","fish","Mississippi Silverside",1,"BEASEI02-HORS-10MAY2023","Mississippi Silverside",0,166.320166320166,166.320166320166,18461.5384615385,0.00900900900900901,"BEASEI02-HORS-10MAY2023","Mississippi Silverside"
"23","BEASEI02-HORS-11APR2023","136",195,12539,7499,"true","Seine","BEASEI","","1. No twists; snags; or tears"," 2= against flow"," ",0.4,NA,9,7.75,"","14:37","",NA,NA,NA,38.097701,121.709563,NA,NA,NA,NA,NA,NA,NA,NA,NA,NA,"Crew Members"," ",NA,NA,NA,NA,NA,NA,NA,NA," false"," "," ","",1,NA," 0%"," ",NA,""," staflo@21 maybe from last sample. gps calculated in 2023 sample inventory- ed 9/11/23.",NA,"true","Mudsucker","CB;AC;ED;GU","Horseshoe Bend","04/11/2023","HORS-N","1=0-33% clouds","2= wind 4-7 mph; small wavelets"," SW"," 2=ebb",58,15.1,9.7,162,7.4,9.4,0.19,0.37,14.1," 1=absent",1," Inside",NA," false"," Guest Alec S",2023-04-11,2023,4,"2023-04-11 14:37","Spring","",0.4,0.4,13.95," 1. No twists; snags; or tears",NA,NA,NA,NA,NA,14957,1,1,"","",NA,"",NA,NA,NA,"",NA,NA,NA,NA,NA,NA,NA,"","","","","EXOPAL","EXOPAL","SHR","Siberian Prawn","Invertebrate","modestus","Exopalaemon","Palaemonidae","Decapoda","Malacostraca","Arthropoda","Introduced","","","","adult",TRUE,"Present",NA,"","Decapoda Adult","Decapoda","Decapoda","Decapoda","Exopalaemon",NA,"BEASEI02-HORS-11APR2023","Siberian Prawn",NA,716.845878136201,0,9318.99641577061,0,"BEASEI02-HORS-11APR2023","Siberian Prawn"
"24","BEASEI02-HORS-15DEC2022","197",315,12126,7128,"true","Seine","BEASEI","","1. No twists; snags; or tears"," 2= against flow"," ",0.8,NA,8.5,10,"","09:57","",NA,NA,NA,38.081473,121.719647,NA,NA,NA,NA,NA,NA,NA,NA,NA,NA,"Crew Members"," ",NA,NA,NA,NA,NA,NA,NA,NA," false"," "," ","",1,NA," 1-33%"," ",NA,""," gps 5 accuracy 2m; not paired; dominant vegetation in net: hyacinth.",NA,"true","Mudsucker","AC;DMC;ED;GP","Horseshoe Bend","12/15/2022","HORS-UNK","1=0-33% clouds","0=Calm; glassy"," NA"," 4=flood",NA,9.4,10.35,300,7.5,8.3,0.24,0.31,13," 1=absent",2," Inside",NA," false"," ",2022-12-15,2022,12,"2022-12-15 09:57","Fall","",0.8,0.8,34," 1. No twists; snags; or tears",NA,NA,NA,NA,NA,14087,926,896,"","",NA,"",26597,78,NA,"true",0,0,0,0,0,0,NA,"","false","false","","MISSIL","ISS","MSS","Mississippi Silverside","Fish","berryllia","Menidia","Atherinopsidae","Atheriniformes","Actinopterygii","Chordata","Introduced","","","","larvae",FALSE,"Present",NA,"Mississippi Silverside","Fish Larvae","Fish Larvae","fish","fish","Mississippi Silverside",30,"BEASEI02-HORS-15DEC2022","Mississippi Silverside",0,272352.941176471,272352.941176471,273235.294117647,0.996770721205598,"BEASEI02-HORS-15DEC2022","Mississippi Silverside"
"25","BEASEI02-LIBE-26APR2023","1364",1364,13375,7969,"true","Seine","BEASEI","","1. No twists; snags; or tears"," 2= against flow"," ",0.5,NA,8,15,"","15:04","",NA,NA,NA,38.24197,121.682398,NA,NA,NA,NA,NA,NA,NA,NA,NA,NA,"Crew Members"," ",NA,NA,NA,NA,NA,NA,NA,NA," false"," "," ","",2,NA," 1-33%"," ",NA,""," gps 5; accuracy 2m. not paired. fish unid tag frp23-013",NA,"true","Mudsucker","AC;ED;AM;SS","Liberty Island","04/26/2023","LIBE_UNK","1=0-33% clouds","1=wind 1-3 mph; scaley ripples"," NW"," 2=ebb",NA,18.9,12.77,340,8.7,4.3,0.45,1.11,9.7," 1=absent",1," Inside",NA," false"," secchi is to bottom. UNID brought back in EtOH",2023-04-26,2023,4,"2023-04-26 15:04","Spring","",0.5,0.5,30," 1. No twists; snags; or tears",NA,NA,NA,NA,NA,15193,1,0,"","",NA,"",29273,48,NA,"true",0,0,0,0,0,0,NA,"","false","false","","CHISAL-L","","","Chinook Salmon (late-fall)","Fish","tshawytscha","Oncorhynchus","Salmonidae","Salmoniformes","Actinopterygii","Chordata","Native","","","","",FALSE,"Present",NA,"Chinook Salmon (late-fall)","","","fish","fish","Chinook Salmon (late-fall)",1,"BEASEI02-LIBE-26APR2023","Chinook Salmon (late-fall)",0,333.333333333333,333.333333333333,1000,0.333333333333333,"BEASEI02-LIBE-26APR2023","Chinook Salmon (late-fall)"
"26","BEASEI02-LIBE-30NOV2022","197",315,12221,7219,"true","Seine","BEASEI","","1. No twists; snags; or tears"," 2= against flow"," ",0.9,NA,9.75,15,"","12:10","",NA,NA,NA,38.2421,121.682223,NA,NA,NA,NA,NA,NA,NA,NA,NA,NA,"Crew Members"," ",NA,NA,NA,NA,NA,NA,NA,NA," false"," "," ","",2,NA," 1-33%"," ",NA,""," gps 5; accuracy 2m. not paired. dominant vegetation in net: cerdem; potcri; egeden",NA,"true","Mudsucker","AC;ED;GP;KS","Liberty Island","11/30/2022","LIBE_UNK","1=0-33% clouds","0=Calm; glassy"," NA"," 2=ebb",NA,10.8,11.74,191,8.3,2.2,0.2,0.15,4.9," 1=absent",2," Inside",NA," false"," SECCHI: NA COULD SEE BOTTOM",2022-11-30,2022,11,"2022-11-30 12:10","Fall","",0.9,0.9,65.8125," 1. No twists; snags; or tears",NA,NA,NA,NA,NA,14298,924,894,"","",NA,"",27818,89,NA,"true",0,0,0,0,0,0,NA,"","false","false","","MISSIL","ISS","MSS","Mississippi Silverside","Fish","berryllia","Menidia","Atherinopsidae","Atheriniformes","Actinopterygii","Chordata","Introduced","","","","larvae",FALSE,"Present",NA,"Mississippi Silverside","Fish Larvae","Fish Larvae","fish","fish","Mississippi Silverside",30,"BEASEI02-LIBE-30NOV2022","Mississippi Silverside",0,140398.86039886,140398.86039886,140398.86039886,1,"BEASEI02-LIBE-30NOV2022","Mississippi Silverside"
"27","BEASEI02-TULE-29NOV2022","197",315,12215,7213,"true","Seine","BEASEI","","1. No twists; snags; or tears"," "," ",0.5,NA,15,15,"","10:08","",NA,NA,NA,38.115697,121.978044,NA,NA,NA,NA,NA,NA,NA,NA,NA,NA,"Crew Members"," ",NA,NA,NA,NA,NA,NA,NA,NA," false"," "," ","",2,NA," 0%"," ",NA,""," gps 5; accuracy 2m. not paired. water quality taken from bucket. thrsti=cdfw 22frp001 and 002. unid silversides all <25mm",NA,"true","Truck","MA;ED;GP","Tule Red","11/29/2022","TULE-UNK","1=0-33% clouds","1=wind 1-3 mph; scaley ripples"," SW"," 2=ebb",NA,10,10.85,20531,7.4,4,0.86,6.19,19.1," 1=absent",2," Inside",NA," false"," ",2022-11-29,2022,11,"2022-11-29 10:08","Fall","",0.5,0.5,56.25," 1. No twists; snags; or tears",NA,NA,NA,NA,NA,14277,85,55,"","",NA,"",27631,42,NA,"true",0,0,0,0,0,0,NA,"","false","false","","MISSIL","ISS","MSS","Mississippi Silverside","Fish","berryllia","Menidia","Atherinopsidae","Atheriniformes","Actinopterygii","Chordata","Introduced","","","","larvae",FALSE,"Present",NA,"Mississippi Silverside","Fish Larvae","Fish Larvae","fish","fish","Mississippi Silverside",30,"BEASEI02-TULE-29NOV2022","Mississippi Silverside",0,15111.1111111111,15111.1111111111,16711.1111111111,0.904255319148936,"BEASEI02-TULE-29NOV2022","Mississippi Silverside"
"28","BEASEI02-TULE-30JAN2023","1361",1361,12307,7307,"true","Seine","BEASEI","","2. Partial twist; snag; or tear"," 2= against flow"," ",1.2,NA,10,12.8387096774194,"","10:45","",NA,NA,NA,38.123869,121.979686,NA,NA,NA,NA,NA,NA,NA,NA,NA,NA,"Crew Members"," ",NA,NA,NA,NA,NA,NA,NA,NA," false"," "," ","",1,NA," 0%"," ",NA,""," not paired. gps 5; accuracy 3m. ysi from bucket. lots of mysids in net. seine code 2 because of modified seine; drop off; and through veg - see photos for details.",NA,"true","Truck","ED;GN","Tule Red","01/30/2023","TULE-UNK","1=0-33% clouds","1=wind 1-3 mph; scaley ripples"," NW"," 2=ebb",NA,7.2,11.46,1025,7.7,99.9,0.64,1.14,16," 1=absent",2," Inside",NA," false"," ",2023-01-30,2023,1,"2023-01-30 10:45","Winter","",1.2,1.2,77.0322580645161," 2. Partial twist; snag; or tear",NA,NA,NA,NA,NA,14538,1,0,"","",NA,"",28364,39,NA,"true",0,0,0,0,0,0,NA,"FRP23-512","false","false","","CHISAL-F","","","Chinook Salmon (fall)","Fish","tshawytscha","Oncorhynchus","Salmonidae","Salmoniformes","Actinopterygii","Chordata","Native","","","","",FALSE,"Present",NA,"Chinook Salmon (fall)","","","fish","fish","Chinook Salmon (fall)",1,"BEASEI02-TULE-30JAN2023","Chinook Salmon (fall)",0,129.815745393635,129.815745393635,1427.97319932998,0.0909090909090909,"BEASEI02-TULE-30JAN2023","Chinook Salmon (fall)"
"29","BEASEI02-WING-04APR2023","136",195,12483,7463,"true","Seine","BEASEI","","1. No twists; snags; or tears"," 2= against flow"," ",0.5,NA,15,15,"","12:30","",NA,NA,NA,38.219662,122.032166,NA,NA,NA,NA,NA,NA,NA,NA,NA,NA,"Crew Members"," ",NA,NA,NA,NA,NA,NA,NA,NA," false"," "," ","",1,NA," 0%"," ",NA,""," gps 5; accuracy 2m. not paired. ",NA,"true","Mudsucker","CB;AC;ED;GU","Wings Landing","04/04/2023","WING-CH-INT-PERIM","1=0-33% clouds","1=wind 1-3 mph; scaley ripples"," NW"," 4=flood",20,12.7,8.6,1416,7.7,48.8,0.41,1.73,33.8," 1=absent",2," Inside",1," false"," DNC = Danie Coye (Guest)",2023-04-04,2023,4,"2023-04-04 12:30","Spring","",0.5,0.5,56.25," 1. No twists; snags; or tears",NA,NA,NA,NA,NA,14865,1,1,"","",NA,"",NA,NA,NA,"",NA,NA,NA,NA,NA,NA,NA,"","","","","EXOPAL","EXOPAL","SHR","Siberian Prawn","Invertebrate","modestus","Exopalaemon","Palaemonidae","Decapoda","Malacostraca","Arthropoda","Introduced","","","","adult",TRUE,"Present",NA,"","Decapoda Adult","Decapoda","Decapoda","Decapoda","Exopalaemon",NA,"BEASEI02-WING-04APR2023","Siberian Prawn",NA,177.777777777778,0,0,NA,"BEASEI02-WING-04APR2023","Siberian Prawn"
"30","BEASEI03-BRAD-09MAY2023","110217",1381,13459,8057,"true","Seine","BEASEI","","1. No twists; snags; or tears"," 2= against flow"," ",0.7,NA,15,15,"","11:21","",NA,NA,NA,38.193325,121.9182,NA,NA,NA,NA,NA,NA,NA,NA,NA,NA,"Crew Members"," ",NA,NA,NA,NA,NA,NA,NA,NA," false"," "," ","",2,NA," 1-33%"," ",NA,""," gps 5; accuracy 2m. not paired",NA,"true","Airboat","AC;ED;SH;AM","Bradmoor Island","05/09/2023","BRAD-N","1=0-33% clouds","1=wind 1-3 mph; scaley ripples"," SW"," 2=ebb",NA,16.9,7.76,1056,7.2,61.4,0.73,2.98,24.5," 1=absent",2," Inside",NA," false"," ",2023-05-09,2023,5,"2023-05-09 11:21","Spring","",0.7,0.7,78.75," 1. No twists; snags; or tears",NA,NA,NA,NA,NA,15321,23,0,"","",NA,"",29807,30,NA,"true",0,0,0,0,0,0,NA,"","false","false","","KILSPP","","KLF","Killifish spp.","Fish","","Lucania","Cyprinodontidae","Cyprinodontiformes","Osteichthyes","Chordata","Introduced","","","","adult",NA,"",NA,"Killifish spp.","","","","","",23,"BEASEI03-BRAD-09MAY2023","Killifish spp.",0,2920.63492063492,2920.63492063492,11809.5238095238,0.247311827956989,"BEASEI03-BRAD-09MAY2023","Killifish spp."
"31","BEASEI03-HORS-30NOV2022","197",315,12222,7220,"true","Seine","BEASEI","","1. No twists; snags; or tears"," 2= against flow"," ",0.9,NA,14,15,"","13:18","",NA,NA,NA,38.099417,121.709205,NA,NA,NA,NA,NA,NA,NA,NA,NA,NA,"Crew Members"," ",NA,NA,NA,NA,NA,NA,NA,NA," false"," "," ","",2,NA," 1-33%"," ",NA,""," gps 5; accuracy 2m. not paired; dominant vegetation in net: egeden; potcri; cerdem",NA,"true","Mudsucker","AC;ED;GP;KS","Horseshoe Bend","11/30/2022","HORS-UNK","1=0-33% clouds","1=wind 1-3 mph; scaley ripples"," SW"," 2=ebb",NA,11.5,10.39,4788,7.7,17.5,0.22,0.21,5.6," 1=absent",2," Inside",NA," false"," ",2022-11-30,2022,11,"2022-11-30 13:18","Fall","",0.9,0.9,94.5," 1. No twists; snags; or tears",NA,NA,NA,NA,NA,14299,418,388,"","",NA,"",27866,47,NA,"true",0,0,0,0,0,0,NA,"","false","false","","MISSIL","ISS","MSS","Mississippi Silverside","Fish","berryllia","Menidia","Atherinopsidae","Atheriniformes","Actinopterygii","Chordata","Introduced","","","","larvae",FALSE,"Present",NA,"Mississippi Silverside","Fish Larvae","Fish Larvae","fish","fish","Mississippi Silverside",30,"BEASEI03-HORS-30NOV2022","Mississippi Silverside",0,44232.8042328042,44232.8042328042,44550.2645502646,0.992874109263658,"BEASEI03-HORS-30NOV2022","Mississippi Silverside"
"32","BEASEI03-LIBE-08MAR2023","110217",1381,12387,7367,"true","Seine","BEASEI","","1. No twists; snags; or tears"," 2= against flow"," ",0.6,NA,13,15,"","13:18","",NA,NA,NA,38.266507,121.691488,NA,NA,NA,NA,NA,NA,NA,NA,NA,NA,"Crew Members"," ",NA,NA,NA,NA,NA,NA,NA,NA," false"," "," ","",1,NA," 0%"," ",NA,""," gps 5; accuracy 2m. not paired. ",NA,"true","Mudsucker","AC;ED;GU;AM;GP","Liberty Island","03/08/2023","LIBE_UNK","1=0-33% clouds","1=wind 1-3 mph; scaley ripples"," SW"," 4=flood",49,10.9,11.28,377,8,15.6,0.48,0.86,17.9," 1=absent",1," Inside",NA," false"," LS = Leigh Sanders (Guest)",2023-03-08,2023,3,"2023-03-08 13:18","Spring","",0.6,0.6,58.5," 1. No twists; snags; or tears",NA,NA,NA,NA,NA,14753,1,0,"","",NA,"",28746,32,NA,"true",0,0,0,0,0,0,NA,"","false","false","","KILSPP","","KLF","Killifish spp.","Fish","","Lucania","Cyprinodontidae","Cyprinodontiformes","Osteichthyes","Chordata","Introduced","","","","adult",NA,"",NA,"Killifish spp.","","","","","",1,"BEASEI03-LIBE-08MAR2023","Killifish spp.",0,170.940170940171,170.940170940171,683.760683760684,0.25,"BEASEI03-LIBE-08MAR2023","Killifish spp."
"33","BEASEI04-ARNO-09MAY2023","110217",1381,13462,8060,"true","Seine","BEASEI","","1. No twists; snags; or tears"," 2= against flow"," ",0.3,NA,15,15,"","12:22","",NA,NA,NA,38.175929,121.903898,NA,NA,NA,NA,NA,NA,NA,NA,NA,NA,"Crew Members"," ",NA,NA,NA,NA,NA,NA,NA,NA," false"," "," ","",2,NA," 0%"," ",NA,""," gps 5; accuracy 2m. not paired.",NA,"true","Airboat","AC;ED;SH;AM","Arnold Slough","05/09/2023","ARNO-UNK","1=0-33% clouds","1=wind 1-3 mph; scaley ripples"," SW"," 2=ebb",NA,23.3,13.2,1093,8.1,251.8,1.03,428.4,27.2," 1=absent",2," Inside",NA," true"," YSI off; taken in shallow turbid water",2023-05-09,2023,5,"2023-05-09 12:22","Spring","",0.3,0.3,33.75," 1. No twists; snags; or tears",NA,NA,NA,NA,NA,15331,39,9,"","",NA,"",29871,35,NA,"true",0,0,0,0,0,0,NA,"","false","false","","KILSPP","","KLF","Killifish spp.","Fish","","Lucania","Cyprinodontidae","Cyprinodontiformes","Osteichthyes","Chordata","Introduced","","","","adult",NA,"",NA,"Killifish spp.","","","","","",30,"BEASEI04-ARNO-09MAY2023","Killifish spp.",0,11555.5555555556,11555.5555555556,27851.8518518519,0.414893617021277,"BEASEI04-ARNO-09MAY2023","Killifish spp."
"34","BIGLAM01-LIBE-14NOV2022","110217",1381,12160,7159,"true","Seine","BIGLAM","","2. Partial twist; snag; or tear"," 2= against flow"," ",0.6,NA,NA,NA,"","08:50","",NA,NA,NA,38.290251,121.685448,NA,NA,NA,NA,NA,NA,NA,NA,NA,NA,"Boat"," ",NA,NA,NA,NA,NA,NA,NA,NA," false"," "," ","",0,NA," 34-66%"," ",NA,""," gps 5; accuracy 2m. code 2. not paired. dominant vegetation in net: coontail; sago; elodia. a lot of veg on wings; but not overflowing cod end. slow deploy and retrieve due to veg.",NA,"true","Mudsucker","DMC;ED;GP","Liberty Island","11/14/2022","LIBE_UNK","1=0-33% clouds","0=Calm; glassy"," NA"," 4=flood",NA,9.5,11.41,193,8.7,1.9,0.2,0.22,8.6," 1=absent",1," Inside",NA," false"," secchi hit bottom; 130+; questionable PC for today",2022-11-14,2022,11,"2022-11-14 08:50","Fall","",0.6,0.9,222.34407182342," 2. Partial twist; snag; or tear",NA,NA,NA,NA,NA,14166,276,246,"","",NA,"",26872,26,NA,"true",0,0,0,0,0,0,NA,"","false","false","","KILSPP","","KLF","Killifish spp.","Fish","","Lucania","Cyprinodontidae","Cyprinodontiformes","Osteichthyes","Chordata","Introduced","","","","adult",NA,"",NA,"Killifish spp.","","","","","",30,"BIGLAM01-LIBE-14NOV2022","Killifish spp.",0,12413.1935579192,12413.1935579192,17225.5548285618,0.720626631853786,"BIGLAM01-LIBE-14NOV2022","Killifish spp."
"35","BIGLAM01-STAI-15NOV2022","197",315,12165,7164,"true","Seine","BIGLAM","","1. No twists; snags; or tears"," 2= against flow"," ",NA,NA,NA,NA,"","08:26","",NA,NA,NA,38.33511,121.667489,NA,NA,NA,NA,NA,NA,NA,NA,NA,NA,"Boat"," ",NA,NA,NA,NA,NA,NA,NA,NA," false"," "," ","",0,NA," 1-33%"," ",NA,""," gps 5; accuracy 3m. not paired. dominant vegetation in net: curly",NA,"true","Mudsucker","MA;ED;SH;GP","Stairsteps-Liberty Cut","11/15/2022","STAI-LIBE","1=0-33% clouds","1=wind 1-3 mph; scaley ripples"," N"," 4=flood",192,10.6,10.78,239,7.6,2.6,0.12,0.36,8.9," 1=absent",2," Inside",NA," false"," ",2022-11-15,2022,11,"2022-11-15 08:26","Fall","",NA,1.7,419.98324677757," 1. No twists; snags; or tears",NA,NA,NA,NA,NA,14190,2,0,"","",NA,"",27004,87,NA,"true",0,0,0,0,0,0,NA,"","false","false","","MISSIL","ISS","MSS","Mississippi Silverside","Fish","berryllia","Menidia","Atherinopsidae","Atheriniformes","Actinopterygii","Chordata","Introduced","","","","larvae",FALSE,"Present",NA,"Mississippi Silverside","Fish Larvae","Fish Larvae","fish","fish","Mississippi Silverside",2,"BIGLAM01-STAI-15NOV2022","Mississippi Silverside",0,47.6209471531428,47.6209471531428,47.6209471531428,1,"BIGLAM01-STAI-15NOV2022","Mississippi Silverside"
"36","BIGLAM02-LIBE-14NOV2022","110217",1381,12161,7160,"true","Seine","BIGLAM","","2. Partial twist; snag; or tear"," 2= against flow"," ",1.6,NA,NA,NA,"","10:45","",NA,NA,NA,38.272513,121.67092,NA,NA,NA,NA,NA,NA,NA,NA,NA,NA,"Boat"," ",NA,NA,NA,NA,NA,NA,NA,NA," false"," "," ","",0,NA," 1-33%"," ",NA,""," gps 5; accuracy 4m. not paired. dominant vegetation in net: curly pond; millfoil; coontail. retrieval a little funky. heavy veg loads affected pulling of net with boat. curly pondweed; eurasian milfoil; and coontail. shrimp unid = rostrum broken. 2 killifish accidentally released before measuring.",NA,"true","Mudsucker","DMC;ED;GP","Liberty Island","11/14/2022","LIBE_UNK","1=0-33% clouds","0=Calm; glassy"," NA"," 4=flood",98,11.4,10.58,179,7.9,6.6,0.23,0.27,6.7," 1=absent",1," Inside",NA," false"," ",2022-11-14,2022,11,"2022-11-14 10:45","Fall","",1.6,1.9,469.393040516108," 2. Partial twist; snag; or tear",NA,NA,NA,NA,NA,14172,5,2,"","",NA,"",26929,20,NA,"true",0,0,0,0,0,0,NA,"","false","false","","KILSPP","","KLF","Killifish spp.","Fish","","Lucania","Cyprinodontidae","Cyprinodontiformes","Osteichthyes","Chordata","Introduced","","","","adult",NA,"",NA,"Killifish spp.","","","","","",3,"BIGLAM02-LIBE-14NOV2022","Killifish spp.",0,106.520539684661,106.520539684661,2236.93133337789,0.0476190476190476,"BIGLAM02-LIBE-14NOV2022","Killifish spp."
"37","BIGLAM03-LIBE-14NOV2022","110217",1381,12162,7161,"true","Seine","BIGLAM","","2. Partial twist; snag; or tear"," 2= against flow"," ",2.1,NA,NA,NA,"","12:00","",NA,NA,NA,38.303124,121.67589,NA,NA,NA,NA,NA,NA,NA,NA,NA,NA,"Boat"," ",NA,NA,NA,NA,NA,NA,NA,NA," false"," "," ","",0,NA," 1-33%"," ",NA,""," gps 5; accuracy 5m. not paired. chunk of road caught in net (cement); pulled in funky again due to veg",NA,"true","Mudsucker","DMC;ED;GP","Liberty Island","11/14/2022","LIBE_UNK","1=0-33% clouds","0=Calm; glassy"," NA"," 2=ebb",NA,12.3,12.33,181,8.6,1.3,0.11,0.21,6.9," 1=absent",1," Inside",2," false"," SECCHI HIT BOTTOM; 130+.",2022-11-14,2022,11,"2022-11-14 12:00","Fall","",2.1,2.4,592.917524862452," 2. Partial twist; snag; or tear",NA,NA,NA,NA,NA,14179,1,0,"","",NA,"",26933,27,0,"true",0,0,0,0,0,0,NA,"","false","false","","KILSPP","","KLF","Killifish spp.","Fish","","Lucania","Cyprinodontidae","Cyprinodontiformes","Osteichthyes","Chordata","Introduced","","","","adult",NA,"",NA,"Killifish spp.","","","","","",1,"BIGLAM03-LIBE-14NOV2022","Killifish spp.",0,16.8657521167381,16.8657521167381,16.8657521167381,1,"BIGLAM03-LIBE-14NOV2022","Killifish spp."
"38","CAST01-BROW-05APR2023","9999",345,12534,7494,"true","Cast","CAST","",""," "," ",2.8,NA,NA,NA,"","14:56","",NA,NA,NA,38.038632,121.86813,NA,NA,NA,NA,NA,NA,NA,NA,NA,NA,""," ",NA,NA,NA,NA,NA,NA,NA,NA," false"," "," ","",NA,NA," "," ",NA,""," 6 good casts/ casts done right next to salmon cages",NA,"true","Mudsucker","AC;ED;AM;GN","Browns Island","04/05/2023","BROW-CH-MAIN","1=0-33% clouds","1=wind 1-3 mph; scaley ripples"," W"," 4=flood",50,13.2,10.04,222,7.4,13.7,0.13,0.5,14.3," 1=absent",2," Inside",NA," false"," ",2023-04-05,2023,4,"2023-04-05 14:56","Spring","",2.8,2.8,6," ",6,NA,NA,NA,NA,14942,0,0,"","",NA,"",NA,NA,NA,"",NA,NA,NA,NA,NA,NA,NA,"","","","","NOFISH","NOFISHCTCH","NONE","No Catch","Fish","","","","","","","","","","","",FALSE,"Present",NA,"No Catch","","","","","No Catch",NA,"CAST01-BROW-05APR2023","No Catch",NA,0,0,0,NA,"CAST01-BROW-05APR2023","No Catch"
"39","CAST01-DECK-10MAY2023","9999",345,13426,7982,"true","Cast","CAST","",""," "," ",NA,NA,NA,NA,"AM","07:40","",NA,71,NA,38.084942,121.723334,NA,NA,NA,NA,NA,NA,NA,NA,NA,NA,""," ",NA,NA,NA,NA,NA,NA,NA,NA," false"," "," ","",NA,NA," "," ",NA,""," gps 6 accuracy 3m. gps from geo-tagged photos - ed 9/11/2023",NA,"true","Mudsucker","CB;AC;ED;AM","Decker Island","05/10/2023","DECK-CH-INT","1=0-33% clouds","1=wind 1-3 mph; scaley ripples"," SW"," 4=flood",NA,14.6,9.19,124,7.5,7.5,0.11,0.35,6.9," 1=absent",2," Inside",NA," false"," ",2023-05-10,2023,5,"2023-05-10 07:40","Spring","",NA,NA,8," ",8,NA,NA,NA,NA,15237,0,0,"","",NA,"",NA,NA,NA,"",NA,NA,NA,NA,NA,NA,NA,"","","","","NOFISH","NOFISHCTCH","NONE","No Catch","Fish","","","","","","","","","","","",FALSE,"Present",NA,"No Catch","","","","","No Catch",NA,"CAST01-DECK-10MAY2023","No Catch",NA,0,0,0,NA,"CAST01-DECK-10MAY2023","No Catch"
"40","CAST01-FLYW-27APR2023","197",315,13446,8045,"true","Cast","CAST","",""," "," ",NA,NA,NA,NA,"ED","14:05","",NA,38,NA,38.361107,121.643018,NA,NA,NA,NA,NA,NA,NA,NA,NA,NA,""," ",NA,NA,NA,NA,NA,NA,NA,NA," false"," "," ","",NA,NA," "," ",NA,""," gps 5 accuracy 2m. percent open: avg of all. actual: 80%; 30%; 40%; 10%; 30%. paired? y",NA,"true","Mudsucker","AC;DC;ED;GU","Flyway Farms","04/27/2023","FLYW-CH-ENTRANCE","1=0-33% clouds","0=Calm; glassy"," NW"," 2=ebb",64,23,8.11,759,8.6,7.5,0.25,1.78,1703," 1=absent",2," Inside",NA," true"," Guests: Brian Armstrong and Anthony Elias-Linarez. PH sensor acting up this whole day. FDOM wrong",2023-04-27,2023,4,"2023-04-27 14:05","Spring","",NA,NA,5," ",5,NA,NA,NA,NA,15286,1,0,"","",NA,"",29564,69,NA,"true",0,0,0,0,0,0,NA,"","false","false","","MISSIL","ISS","MSS","Mississippi Silverside","Fish","berryllia","Menidia","Atherinopsidae","Atheriniformes","Actinopterygii","Chordata","Introduced","","","","larvae",FALSE,"Present",NA,"Mississippi Silverside","Fish Larvae","Fish Larvae","fish","fish","Mississippi Silverside",1,"CAST01-FLYW-27APR2023","Mississippi Silverside",0,2000,2000,4000,0.5,"CAST01-FLYW-27APR2023","Mississippi Silverside"
"41","CAST01-LOWE-26MAY2023","136",195,13432,8028,"true","Cast","CAST","",""," "," ",0.9,NA,NA,NA,"AM","08:16","",NA,72,NA,38.34965,121.676211,NA,NA,NA,NA,NA,NA,NA,NA,NA,NA,""," ",NA,NA,NA,NA,NA,NA,NA,NA," false"," "," ","",NA,NA," "," ",NA,""," gps 6 accuracy 3m. depth from handheld.",NA,"true","Mudsucker","AC;ED;AM","Lower Yolo Ranch","05/26/2023","LOWE-CH-W","1=0-33% clouds","1=wind 1-3 mph; scaley ripples"," W"," 4=flood",20,16.9,7.32,676,8,48.1,0.68,2.04,24.8," 1=absent",2," Inside",NA," false"," ",2023-05-26,2023,5,"2023-05-26 08:16","Spring","Handheld depth finder",0.9,0.9,10," ",10,NA,NA,NA,NA,15247,4,4,"","",NA,"",NA,NA,NA,"",NA,NA,NA,NA,NA,NA,NA,"","","","","EXOPAL","EXOPAL","SHR","Siberian Prawn","Invertebrate","modestus","Exopalaemon","Palaemonidae","Decapoda","Malacostraca","Arthropoda","Introduced","","","","adult",TRUE,"Present",NA,"","Decapoda Adult","Decapoda","Decapoda","Decapoda","Exopalaemon",NA,"CAST01-LOWE-26MAY2023","Siberian Prawn",NA,4000,0,4000,0,"CAST01-LOWE-26MAY2023","Siberian Prawn"
"42","CAST01-PEYT-04APR2023","9999",345,12485,7464,"true","Cast","CAST","",""," "," ",NA,NA,NA,NA,"","00:00","",NA,NA,NA,38.226724,122.040664,NA,NA,NA,NA,NA,NA,NA,NA,NA,NA,""," ",NA,NA,NA,NA,NA,NA,NA,NA," false"," "," ","",NA,NA," "," ",NA,""," 4 casts",NA,"true","Mudsucker","CB;AC;ED;GU","Peytonia-Suisun","04/04/2023","PEYT-PEYT","1=0-33% clouds","1=wind 1-3 mph; scaley ripples"," NW"," 4=flood",19,12.7,8.51,1414,7.7,38.8,0.37,1.52,34.8," 1=absent",2," Inside",NA," false"," guest Danie",2023-04-04,2023,4,"2023-04-04 00:00","Spring","",NA,NA,4," ",4,NA,NA,NA,NA,14867,0,0,"","",NA,"",NA,NA,NA,"",NA,NA,NA,NA,NA,NA,NA,"","","","","NOFISH","NOFISHCTCH","NONE","No Catch","Fish","","","","","","","","","","","",FALSE,"Present",NA,"No Catch","","","","","No Catch",NA,"CAST01-PEYT-04APR2023","No Catch",NA,0,0,0,NA,"CAST01-PEYT-04APR2023","No Catch"
"43","CAST01-TULE-15JUN2023","177",400,13485,8078,"true","Cast","CAST","",""," "," ",1.4,NA,NA,NA,"AM","10:32","",NA,54,NA,38.126071,121.986332,NA,NA,NA,NA,NA,NA,NA,NA,NA,NA,""," ",NA,NA,NA,NA,NA,NA,NA,NA," false"," "," ","",NA,NA," "," ",NA,""," gps 5 accuracy 2m",NA,"true","Kvichak","AC;ED;SH;AM","Tule Red","06/15/2023","TULE-CH-LG-SE","1=0-33% clouds","1=wind 1-3 mph; scaley ripples"," W"," 4=flood",24,19,6.46,631,7.3,50.8,0.39,1.09,19.5," 1=absent",2," Inside",NA," false"," ",2023-06-15,2023,6,"2023-06-15 10:32","Summer","",1.4,1.4,7," ",7,NA,NA,NA,NA,15406,1,0,"","",NA,"",30135,54,NA,"true",0,0,0,0,0,0,NA,"","false","false","","PRISCU","SCP","PRS","Prickly Sculpin","Fish","aspur","Cottus","Cottidae","Scorpaeniformes","Actinopterygii","Chordata","Native","","","","",FALSE,"Present",NA,"Prickly Sculpin","Fish Larvae","Fish Larvae","fish","fish","Prickly Sculpin",1,"CAST01-TULE-15JUN2023","Prickly Sculpin",0,1428.57142857143,1428.57142857143,5714.28571428571,0.25,"CAST01-TULE-15JUN2023","Prickly Sculpin"
"44","CAST01-TULE-16MAY2023","197",315,13428,8004,"true","Cast","CAST","",""," "," ",1.6,NA,NA,NA,"AM","10:20","",NA,63,NA,38.131348,121.99132,NA,NA,NA,NA,NA,NA,NA,NA,NA,NA,""," ",NA,NA,NA,NA,NA,NA,NA,NA," false"," "," ","",NA,NA," "," ",NA,""," gps 6 accuracy 3m. depth from handheld.",NA,"true","Mudsucker","AC;ED;GU;AM","Tule Red","05/16/2023","TULE-CH-LG-M","1=0-33% clouds","1=wind 1-3 mph; scaley ripples"," SW"," 4=flood",16,17.6,9.45,353,7.8,57.7,1.23,5.01,9.9," 1=absent",1," Inside",NA," false"," Guest - Anthony Elias-Linarez",2023-05-16,2023,5,"2023-05-16 10:20","Spring","Handheld depth finder",1.6,1.6,10," ",10,NA,NA,NA,NA,15239,2,0,"","",NA,"",29390,75,NA,"true",0,0,0,0,0,0,NA,"","false","false","","MISSIL","ISS","MSS","Mississippi Silverside","Fish","berryllia","Menidia","Atherinopsidae","Atheriniformes","Actinopterygii","Chordata","Introduced","","","","larvae",FALSE,"Present",NA,"Mississippi Silverside","Fish Larvae","Fish Larvae","fish","fish","Mississippi Silverside",2,"CAST01-TULE-16MAY2023","Mississippi Silverside",0,2000,2000,2000,1,"CAST01-TULE-16MAY2023","Mississippi Silverside"
"45","CAST01-TULE-17APR2023","136",195,12759,7699,"true","Cast","CAST","",""," "," ",2.2,NA,NA,NA,"","13:35","",NA,NA,NA,38.126224,121.987003,NA,NA,NA,NA,NA,NA,NA,NA,NA,NA,""," ",NA,NA,NA,NA,NA,NA,NA,NA," false"," "," ","",NA,NA," "," ",NA,""," depth from invert trawl. gps 5; accuracy 3m. paired",NA,"false","Mudsucker","SH;AM;GN;KMP","Tule Red","04/17/2023","TULE-CH-LG-SE","3=66-100% clouds","1=wind 1-3 mph; scaley ripples"," SW"," 2=ebb",12,14.3,10.07,345,7.9,87.7,0.48,1.84,6.9," 1=absent",2," Inside",NA," false"," get WQ from invert trawl",2023-04-17,2023,4,"2023-04-17 13:35","Spring","Handheld depth finder",2.2,2.2,6," ",6,NA,NA,NA,NA,15068,2,2,"","",NA,"",NA,NA,NA,"",NA,NA,NA,NA,NA,NA,NA,"","","","","EXOPAL","EXOPAL","SHR","Siberian Prawn","Invertebrate","modestus","Exopalaemon","Palaemonidae","Decapoda","Malacostraca","Arthropoda","Introduced","","","","adult",TRUE,"Present",NA,"","Decapoda Adult","Decapoda","Decapoda","Decapoda","Exopalaemon",NA,"CAST01-TULE-17APR2023","Siberian Prawn",NA,3333.33333333333,0,1666.66666666667,0,"CAST01-TULE-17APR2023","Siberian Prawn"
"46","CAST01-TULE-18APR2023","953",369,12844,7784,"true","Cast","CAST","",""," "," ",NA,NA,NA,NA,"AM","10:21","",NA,NA,NA,38.126572,121.987524,NA,NA,NA,NA,NA,NA,NA,NA,NA,NA,""," ",NA,NA,NA,NA,NA,NA,NA,NA," false"," "," ","",NA,NA," "," ",NA,""," 5 good casts; gps 6 accuracy 2. gps from geo-tagged photos - ed 9/7/2023",NA,"true","Mudsucker","AC;ED;GU;AM","Tule Red","04/18/2023","TULE-CH-LG-M","1=0-33% clouds","0=Calm; glassy"," SW"," 4=flood",NA,14.5,10.69,3109,7.1,112.6,0.73,4.09,67," 1=absent",2," Inside",NA," true"," water quality taken in a bucket taken from a small pool with water pouring off the land. Water disturbed but tried to get the cleanest possible. ",2023-04-18,2023,4,"2023-04-18 10:21","Spring","",NA,NA,5," ",5,NA,NA,NA,NA,15085,5,0,"","",NA,"",29146,37,NA,"true",0,0,0,0,0,0,NA,"","false","false","","PACSSC","STAG","PSS","Pacific Staghorn Sculpin","Fish","armatus","Leptocottus","Cottidae","Scorpaeniformes","Actinopterygii","Chordata","Native","","","","",FALSE,"Present",NA,"Pacific Staghorn Sculpin","Fish Larvae","Fish Larvae","fish","fish","Pacific Staghorn Sculpin",5,"CAST01-TULE-18APR2023","Pacific Staghorn Sculpin",0,10000,10000,10000,1,"CAST01-TULE-18APR2023","Pacific Staghorn Sculpin"
"47","CAST01-TULE-20MAR2023","9999",345,12448,7428,"true","Cast","CAST","",""," "," ",1.8,NA,NA,NA,"CB;ED;GN;GP","13:02","",NA,NA,NA,38.116551,121.981678,NA,NA,NA,NA,NA,NA,NA,NA,NA,NA,""," ",NA,NA,NA,NA,NA,NA,NA,NA," false"," "," ","",NA,NA," "," ",NA,""," gps 5; accuracy 2m. not paired. inside. end time 13:10. 3 throws of cast net. depth is 1.8 m.",NA,"true","Mudsucker","CB;ED;GN;GP","Tule Red","03/20/2023","TULE-CH-SM-12","1=0-33% clouds","1=wind 1-3 mph; scaley ripples"," W"," 4=flood",9,13.3,9.59,832,7.5,116.9,0.98,1.36,12.1," 1=absent",1," Inside",NA," false"," ",2023-03-20,2023,3,"2023-03-20 13:02","Spring","",1.8,1.8,3," ",3,NA,NA,NA,NA,14834,0,0,"","",NA,"",NA,NA,NA,"",NA,NA,NA,NA,NA,NA,NA,"","","","","NOFISH","NOFISHCTCH","NONE","No Catch","Fish","","","","","","","","","","","",FALSE,"Present",NA,"No Catch","","","","","No Catch",NA,"CAST01-TULE-20MAR2023","No Catch",NA,0,0,0,NA,"CAST01-TULE-20MAR2023","No Catch"
"48","CAST01-WING-03MAY2023","9999",345,13468,8067,"true","Cast","CAST","",""," "," ",0.8,NA,NA,NA,"ED","12:00","",NA,73,NA,38.224422,122.037579,NA,NA,NA,NA,NA,NA,NA,NA,NA,NA,""," ",NA,NA,NA,NA,NA,NA,NA,NA," false"," "," ","",NA,NA," "," ",NA,""," gps 5; accuracy 2m. not paired. percent open avg. actual: 80%; 80%; 70%; 80%; 60%; 70% depth from handheld",NA,"true","Mudsucker","DMC;ED;AM","Wings Landing","05/03/2023","WING-BROOD","3=66-100% clouds","0=Calm; glassy"," NE"," 4=flood",20,16.1,6.7,2198,7.7,52.2,1.13,2.09,48," 1=absent",1," Inside",NA," false"," cast net only",2023-05-03,2023,5,"2023-05-03 12:00","Spring","Handheld depth finder",0.8,0.8,6," ",6,NA,NA,NA,NA,15350,0,0,"","",NA,"",NA,NA,NA,"",NA,NA,NA,NA,NA,NA,NA,"","","","","NOFISH","NOFISHCTCH","NONE","No Catch","Fish","","","","","","","","","","","",FALSE,"Present",NA,"No Catch","","","","","No Catch",NA,"CAST01-WING-03MAY2023","No Catch",NA,0,0,0,NA,"CAST01-WING-03MAY2023","No Catch"
"49","CAST01-WTIB-12APR2023","9999",345,12755,7695,"true","Cast","CAST","",""," "," ",2.3,NA,NA,NA,"","08:48","",NA,NA,NA,38.095334,121.589949,NA,NA,NA,NA,NA,NA,NA,NA,NA,NA,""," ",NA,NA,NA,NA,NA,NA,NA,NA," false"," "," ","",NA,NA," "," ",NA,""," gps 6; accuracy 3m. paired. 4 attempts. time copied from invert data sheet. estimated time casting ~20 minutes. gps calculated 2023 sample inventory ed 9/11/23",NA,"true","Mudsucker","MA;ED;GU;AM","Webb Tract Island and Berms","04/12/2023","WTIB-CH-INT","1=0-33% clouds","1=wind 1-3 mph; scaley ripples"," SW"," 1=high slack",69,14.6,9.34,156,7.4,7.5,0.34,0.47,14.4," 1=absent",1," Inside",NA," false"," Guest=Alec Strachan. ",2023-04-12,2023,4,"2023-04-12 08:48","Spring","",2.3,2.3,4," ",4,NA,NA,NA,NA,15061,0,0,"","",NA,"",NA,NA,NA,"",NA,NA,NA,NA,NA,NA,NA,"","","","","NOFISH","NOFISHCTCH","NONE","No Catch","Fish","","","","","","","","","","","",FALSE,"Present",NA,"No Catch","","","","","No Catch",NA,"CAST01-WTIB-12APR2023","No Catch",NA,0,0,0,NA,"CAST01-WTIB-12APR2023","No Catch"
"50","CAST02-DECK-10MAY2023","9999",345,13427,7983,"true","Cast","CAST","",""," "," ",1.9,NA,NA,NA,"ED;AM","08:33","",NA,70,NA,38.084277,121.723929,NA,NA,NA,NA,NA,NA,NA,NA,NA,NA,""," ",NA,NA,NA,NA,NA,NA,NA,NA," false"," "," ","",NA,NA," "," ",NA,""," depth from handheld. gps from geo-tagged photo - ed 9/11/2023",NA,"true","Mudsucker","CB;AC;ED;AM","Decker Island","05/10/2023","DECK-TP","1=0-33% clouds","1=wind 1-3 mph; scaley ripples"," SW"," 1=high slack",71,14.6,9.51,124,7.6,7.7,0.09,0.38,6.7," 1=absent",2," Inside",NA," false"," ",2023-05-10,2023,5,"2023-05-10 08:33","Spring","Handheld depth finder",1.9,1.9,5," ",5,NA,NA,NA,NA,15238,0,0,"","",NA,"",NA,NA,NA,"",NA,NA,NA,NA,NA,NA,NA,"","","","","NOFISH","NOFISHCTCH","NONE","No Catch","Fish","","","","","","","","","","","",FALSE,"Present",NA,"No Catch","","","","","No Catch",NA,"CAST02-DECK-10MAY2023","No Catch",NA,0,0,0,NA,"CAST02-DECK-10MAY2023","No Catch"
"51","CAST02-LOWE-26MAY2023","916",55,13435,8031,"true","Cast","CAST","",""," "," ",1,NA,NA,NA,"AM","11:07","",NA,67,NA,38.35362,121.660628,NA,NA,NA,NA,NA,NA,NA,NA,NA,NA,""," ",NA,NA,NA,NA,NA,NA,NA,NA," false"," "," ","",NA,NA," "," ",NA,""," gps 6 accuracy 3m. lavaged larbas @374: nothing. depth from handheld.",NA,"true","Mudsucker","AC;ED;AM","Lower Yolo Ranch","05/26/2023","LOWE-CH-ENTRANCE-N","1=0-33% clouds","1=wind 1-3 mph; scaley ripples"," W"," 2=ebb",NA,19.5,8.28,562,8,13.6,0.17,0.67,23.5," 1=absent",2," Inside",NA," false"," ",2023-05-26,2023,5,"2023-05-26 11:07","Spring","Handheld depth finder",1,1,10," ",10,NA,NA,NA,NA,15260,3,0,"","",NA,"",29471,79,NA,"true",0,0,0,0,0,0,NA,"","false","false","","BLUEGI","BG","BGS","Bluegill","Fish","macrochirus","Lepomis","Centrarchidae","Perciformes","Actinopterygii","Chordata","Introduced","","","","",FALSE,"Present",NA,"Bluegill","Fish Larvae","Fish Larvae","fish","fish","Bluegill",3,"CAST02-LOWE-26MAY2023","Bluegill",0,3000,3000,8000,0.375,"CAST02-LOWE-26MAY2023","Bluegill"
"52","CAST02-TULE-16MAY2023","9999",345,13429,8005,"true","Cast","CAST","",""," "," ",2.3,NA,NA,NA,"AM","11:05","",NA,72,NA,38.121323,121.982431,NA,NA,NA,NA,NA,NA,NA,NA,NA,NA,""," ",NA,NA,NA,NA,NA,NA,NA,NA," false"," "," ","",NA,NA," "," ",NA,""," gps 6 accuracy 3m. depth from handheld.",NA,"true","Mudsucker","AC;ED;GU;AM","Tule Red","05/16/2023","TULE-CH-LG-SE","1=0-33% clouds","1=wind 1-3 mph; scaley ripples"," SW"," 4=flood",20,19.5,6.63,1104,7.2,42.2,0.66,2.18,26.7," 1=absent",1," Inside",NA," false"," Guest - Anthony Elias-Linarez",2023-05-16,2023,5,"2023-05-16 11:05","Spring","Handheld depth finder",2.3,2.3,9," ",9,NA,NA,NA,NA,15240,0,0,"","",NA,"",NA,NA,NA,"",NA,NA,NA,NA,NA,NA,NA,"","","","","NOFISH","NOFISHCTCH","NONE","No Catch","Fish","","","","","","","","","","","",FALSE,"Present",NA,"No Catch","","","","","No Catch",NA,"CAST02-TULE-16MAY2023","No Catch",NA,0,0,0,NA,"CAST02-TULE-16MAY2023","No Catch"
"53","CAST02-TULE-18APR2023","9999",345,12848,7787,"true","Cast","CAST","",""," "," Pond",NA,NA,NA,NA,"AC;ED;GU;AM","11:52","",NA,NA,NA,38.1236,121.9807,NA,NA,NA,NA,NA,NA,NA,NA,NA,NA,""," ",NA,NA,NA,NA,NA,NA,NA,NA," false"," "," ","",NA,NA," "," ",NA,""," same wq as lamope06-tule-18apr2023; 4 casts. gps 6 accuracy 3m. gps from geo-tagged photos - ed 9/7/2023",NA,"true","Mudsucker","AC;ED;GU;AM","Tule Red","04/18/2023","TULE-TP-1","1=0-33% clouds","1=wind 1-3 mph; scaley ripples"," SW"," 4=flood",17,13.6,9.09,1380,7.5,50.8,0.46,1.61,20.8," 1=absent",2," Inside",NA," false"," Guest : Anthony Elias-Linarez",2023-04-18,2023,4,"2023-04-18 11:52","Spring","",NA,NA,4," ",4,NA,NA,NA,NA,15092,0,0,"","",NA,"",NA,NA,NA,"",NA,NA,NA,NA,NA,NA,NA,"","","","","NOFISH","NOFISHCTCH","NONE","No Catch","Fish","","","","","","","","","","","",FALSE,"Present",NA,"No Catch","","","","","No Catch",NA,"CAST02-TULE-18APR2023","No Catch",NA,0,0,0,NA,"CAST02-TULE-18APR2023","No Catch"
"54","CAST02-TULE-20MAR2023","9999",345,12450,7430,"true","Cast","CAST","",""," "," ",0.9,NA,NA,NA,"","14:00","",NA,NA,NA,38.12765,121.986978,NA,NA,NA,NA,NA,NA,NA,NA,NA,NA,""," ",NA,NA,NA,NA,NA,NA,NA,NA," false"," "," ","",NA,NA," "," ",NA,""," gps 5; accuracy 2m. not paired. depth 0.9 m. 6 casts.",NA,"true","Mudsucker","CB;ED;GN;GP","Tule Red","03/20/2023","TULE-UNK","1=0-33% clouds","1=wind 1-3 mph; scaley ripples"," W"," 4=flood",9,14.2,9.92,842,7.8,115.8,1.05,1.53,9.8," 1=absent",1," Inside",NA," false"," ",2023-03-20,2023,3,"2023-03-20 14:00","Spring","",0.9,0.9,6," ",6,NA,NA,NA,NA,14838,0,0,"","",NA,"",NA,NA,NA,"",NA,NA,NA,NA,NA,NA,NA,"","","","","NOFISH","NOFISHCTCH","NONE","No Catch","Fish","","","","","","","","","","","",FALSE,"Present",NA,"No Catch","","","","","No Catch",NA,"CAST02-TULE-20MAR2023","No Catch",NA,0,0,0,NA,"CAST02-TULE-20MAR2023","No Catch"
"55","CASTNET01-LOWE-17MAR2023","9999",345,12425,7405,"true","Cast","CAST","",""," "," ",NA,NA,NA,NA,"AM","11:14","",NA,NA,NA,38.352385,121.661029,NA,NA,NA,NA,NA,NA,NA,NA,NA,NA,""," ",NA,NA,NA,NA,NA,NA,NA,NA," false"," "," ","",NA,NA," "," ",NA,""," gps 5; accuracy 2m. not paired. inside. 9 casts",NA,"true","Mudsucker","DMC;ED;AM;GP","Lower Yolo Ranch","03/17/2023","LOWE-CH-ENTRANCE-N","1=0-33% clouds","1=wind 1-3 mph; scaley ripples"," NW"," 2=ebb",NA,12.6,8.78,221,7.5,88.7,0.71,1.33,12.6," 1=absent",1," Inside",NA," false"," ",2023-03-17,2023,3,"2023-03-17 11:14","Spring","",NA,NA,9," ",9,NA,NA,NA,NA,14805,0,0,"","",NA,"",NA,NA,NA,"",NA,NA,NA,NA,NA,NA,NA,"","","","","NOFISH","NOFISHCTCH","NONE","No Catch","Fish","","","","","","","","","","","",FALSE,"Present",NA,"No Catch","","","","","No Catch",NA,"CASTNET01-LOWE-17MAR2023","No Catch",NA,0,0,0,NA,"CASTNET01-LOWE-17MAR2023","No Catch"
"56","CASTNET02-FLYW-17MAR2023","9999",345,12426,7406,"true","Cast","CAST","",""," "," ",1.9,NA,NA,NA,"AM","12:25","",NA,NA,NA,38.360451,121.642178,NA,NA,NA,NA,NA,NA,NA,NA,NA,NA,""," ",NA,NA,NA,NA,NA,NA,NA,NA," false"," "," ","",NA,NA," "," ",NA,""," gps 5; accuracy 2m. not paired.casts done ""on land"" since site covered with water. very high flow. 3 casts",NA,"true","Mudsucker","DMC;ED;AM;GP","Flyway Farms","03/17/2023","FLYW-UNK","1=0-33% clouds","0=Calm; glassy"," N"," 2=ebb",16,12.5,9.03,156,7.4,71.8,0.58,1.06,12.1," 1=absent",1," Inside",NA," false"," ",2023-03-17,2023,3,"2023-03-17 12:25","Spring","",1.9,1.9,3," ",3,NA,NA,NA,NA,14806,0,0,"","",NA,"",NA,NA,NA,"",NA,NA,NA,NA,NA,NA,NA,"","","","","NOFISH","NOFISHCTCH","NONE","No Catch","Fish","","","","","","","","","","","",FALSE,"Present",NA,"No Catch","","","","","No Catch",NA,"CASTNET02-FLYW-17MAR2023","No Catch",NA,0,0,0,NA,"CASTNET02-FLYW-17MAR2023","No Catch"
"57","LAMOPE01-BROA-02FEB2023","197",315,12312,7312,"true","Seine","LAMOPE","","2. Partial twist; snag; or tear"," 2= against flow"," ",5.7,NA,NA,NA,"","08:27","",NA,NA,NA,38.031763,121.838429,NA,NA,NA,NA,NA,NA,NA,NA,NA,NA,"Boat"," ",NA,NA,NA,NA,NA,NA,NA,NA," false"," "," ","",3,NA," 0%"," ",NA,""," not paired. gps 5; accuracy 3m. code 2: depth. all holes in lam03 repaired yesterday",NA,"true","Mudsucker","AC;ED;GU;GP;KS","Broad Slough","02/02/2023","BROA-INT","1=0-33% clouds","1=wind 1-3 mph; scaley ripples"," NE"," 4=flood",26,8.4,10.42,250,7.6,27,0.32,0.61,21.1," 1=absent",2," Inside",NA," false"," ",2023-02-02,2023,2,"2023-02-02 08:27","Winter","",6,6,332.7," 2. Partial twist; snag; or tear",NA,NA,NA,NA,NA,14547,1,0,"","",NA,"",28383,72,NA,"true",0,0,0,0,0,0,NA,"","false","false","","MISSIL","ISS","MSS","Mississippi Silverside","Fish","berryllia","Menidia","Atherinopsidae","Atheriniformes","Actinopterygii","Chordata","Introduced","","","","larvae",FALSE,"Present",NA,"Mississippi Silverside","Fish Larvae","Fish Larvae","fish","fish","Mississippi Silverside",1,"LAMOPE01-BROA-02FEB2023","Mississippi Silverside",0,30.0571085061617,30.0571085061617,30.0571085061617,1,"LAMOPE01-BROA-02FEB2023","Mississippi Silverside"
"58","LAMOPE01-BROA-05APR2023","9999",345,12521,7481,"true","Seine","LAMOPE","","2. Partial twist; snag; or tear"," 2= against flow"," ",9.2,NA,NA,NA,"","09:37","",NA,NA,NA,38.039595,121.838661,NA,NA,NA,NA,NA,NA,NA,NA,NA,NA,"Boat"," ",NA,NA,NA,NA,NA,NA,NA,NA," false"," "," ","",3,NA," 0%"," ",NA,""," gps 5; accuracy 3m. not paired. code 2: depth and twist in wing",NA,"true","Mudsucker","AC;ED;AM;GN","Broad Slough","04/05/2023","BROA-EXT","1=0-33% clouds","2= wind 4-7 mph; small wavelets"," NW"," 2=ebb",46,12.2,10.04,173,7.4,17.9,0.22,0.55,14.4," 1=absent",2," Inside",NA," false"," ",2023-04-05,2023,4,"2023-04-05 09:37","Spring","",9.5,9.5,332.7," 2. Partial twist; snag; or tear",NA,NA,NA,NA,NA,14921,0,0,"","",NA,"",NA,NA,NA,"",NA,NA,NA,NA,NA,NA,NA,"","","","","NOFISH","NOFISHCTCH","NONE","No Catch","Fish","","","","","","","","","","","",FALSE,"Present",NA,"No Catch","","","","","No Catch",NA,"LAMOPE01-BROA-05APR2023","No Catch",NA,0,0,0,NA,"LAMOPE01-BROA-05APR2023","No Catch"
"59","LAMOPE01-BROA-05DEC2022","9999",345,12101,7101,"true","Seine","LAMOPE","","1. No twists; snags; or tears"," 2= against flow"," ",2.2,NA,NA,NA,"","08:56","",NA,NA,NA,38.035172,121.841979,NA,NA,NA,NA,NA,NA,NA,NA,NA,NA,"Boat"," ",NA,NA,NA,NA,NA,NA,NA,NA," false"," "," ","",1,NA," 0%"," ",NA,""," ",NA,"true","Mudsucker","AC;ED;GP;KS","Broad Slough","12/05/2022","BROA-UNK","1=0-33% clouds","1=wind 1-3 mph; scaley ripples"," S"," 4=flood",77,10.8,10.11,7581,7.6,6.9,0.19,0.27,6.9," 1=absent",2," Inside",NA," false"," ",2022-12-05,2022,12,"2022-12-05 08:56","Fall","",2.5,2.5,249.455517634," 1. No twists; snags; or tears",NA,NA,NA,NA,NA,14042,0,0,"","",NA,"",NA,NA,NA,"",NA,NA,NA,NA,NA,NA,NA,"","","","","NOFISH","NOFISHCTCH","NONE","No Catch","Fish","","","","","","","","","","","",FALSE,"Present",NA,"No Catch","","","","","No Catch",NA,"LAMOPE01-BROA-05DEC2022","No Catch",NA,0,0,0,NA,"LAMOPE01-BROA-05DEC2022","No Catch"
"60","LAMOPE01-BROA-17NOV2022","197",315,12172,7171,"true","Seine","LAMOPE","","1. No twists; snags; or tears"," 2= against flow"," ",1.2,NA,NA,NA,"","07:17","",NA,NA,NA,38.05314,121.849375,NA,NA,NA,NA,NA,NA,NA,NA,NA,NA,"Boat"," ",NA,NA,NA,NA,NA,NA,NA,NA," false"," "," ","",1,NA," 0%"," ",NA,""," approx. 1/4 of cod end filled with detritus",NA,"true","Mudsucker","AC;ED;GP;KS","Broad Slough","11/17/2022","BROA-UNK","2=33-66% clouds","0=Calm; glassy"," "," 4=flood",58,13,9.4,8664,7.6,12.2,0.14,0.37,6.8," 1=absent",2," Inside",NA," false"," ",2022-11-17,2022,11,"2022-11-17 07:17","Fall","",1.5,1.5,159.12201242824," 1. No twists; snags; or tears",NA,NA,NA,NA,NA,14204,41,11,"","",NA,"",27174,66,NA,"true",0,0,0,0,0,0,NA,"","false","false","","MISSIL","ISS","MSS","Mississippi Silverside","Fish","berryllia","Menidia","Atherinopsidae","Atheriniformes","Actinopterygii","Chordata","Introduced","","","","larvae",FALSE,"Present",NA,"Mississippi Silverside","Fish Larvae","Fish Larvae","fish","fish","Mississippi Silverside",30,"LAMOPE01-BROA-17NOV2022","Mississippi Silverside",0,2576.63910695511,2576.63910695511,2828.0185320239,0.911111111111111,"LAMOPE01-BROA-17NOV2022","Mississippi Silverside"
"61","LAMOPE01-BROA-18MAY2023","9999",345,13411,8011,"true","Seine","LAMOPE","","2. Partial twist; snag; or tear"," 2= against flow"," ",6,NA,NA,NA,"","08:53","",NA,NA,NA,38.043055,121.841883,NA,NA,NA,NA,NA,NA,NA,NA,NA,NA,"Boat"," ",NA,NA,NA,NA,NA,NA,NA,NA," false"," "," ","",3,NA," 0%"," ",NA,""," gps 6 accuracy 2m. code 2: depth and waves. depth from handheld",NA,"true","Mudsucker","MA;ED;SH;KMP","Broad Slough","05/18/2023","BROA-EXT","1=0-33% clouds","3= wind 8-12 mph; large wavelets"," W"," 2=ebb",68,19,8.92,126,7.6,10.4,0.11,0.46,8.2," 1=absent",2," Inside",NA," false"," ",2023-05-18,2023,5,"2023-05-18 08:53","Spring","Handheld depth finder",6,6,332.7," 2. Partial twist; snag; or tear",NA,NA,NA,NA,NA,15218,0,0,"","",NA,"",NA,NA,NA,"",NA,NA,NA,NA,NA,NA,NA,"","","","","NOFISH","NOFISHCTCH","NONE","No Catch","Fish","","","","","","","","","","","",FALSE,"Present",NA,"No Catch","","","","","No Catch",NA,"LAMOPE01-BROA-18MAY2023","No Catch",NA,0,0,0,NA,"LAMOPE01-BROA-18MAY2023","No Catch"
"62","LAMOPE01-DECK-08FEB2023","1361",1361,12318,7318,"true","Seine","LAMOPE","","2. Partial twist; snag; or tear"," 2= against flow"," ",1.2,NA,NA,NA,"","07:44","",NA,NA,NA,38.084277,121.723997,NA,NA,NA,NA,NA,NA,NA,NA,NA,NA,"Boat"," ",NA,NA,NA,NA,NA,NA,NA,NA," false"," "," ","",3,NA," 0%"," ",NA,""," not paired. gps 5; accuracy 2m. cod end ~25% full of mud/detritus",NA,"true","Mudsucker","CB;ED;GU;GN;GP","Decker Island","02/08/2023","DECK-TP","1=0-33% clouds","0=Calm; glassy"," NA"," 2=ebb",50,8,10.61,247,7.5,16.3,0.27,0.46,17.5," 1=absent",2," Inside",NA," false"," LS = LEIGH SANDERS GUEST; EDNA",2023-02-08,2023,2,"2023-02-08 07:44","Winter","",1.5,1.5,159.12201242824," 2. Partial twist; snag; or tear",NA,NA,NA,NA,NA,14553,2,0,"","",NA,"",28385,45,NA,"true",0,0,0,0,0,0,NA,"","false","false","","CHISAL-F","","","Chinook Salmon (fall)","Fish","tshawytscha","Oncorhynchus","Salmonidae","Salmoniformes","Actinopterygii","Chordata","Native","","","","",FALSE,"Present",NA,"Chinook Salmon (fall)","","","fish","fish","Chinook Salmon (fall)",2,"LAMOPE01-DECK-08FEB2023","Chinook Salmon (fall)",0,125.689712534396,125.689712534396,251.379425068791,0.5,"LAMOPE01-DECK-08FEB2023","Chinook Salmon (fall)"
"63","LAMOPE01-DECK-11APR2023","9999",345,12533,7492,"true","Seine","LAMOPE","","2. Partial twist; snag; or tear"," 2= against flow"," ",1.5,NA,NA,NA,"","07:55","",NA,NA,NA,38.083982,121.724069,NA,NA,NA,NA,NA,NA,NA,NA,NA,NA,"Boat"," ",NA,NA,NA,NA,NA,NA,NA,NA," false"," "," ","",3,NA," 1-33%"," ",NA,""," depth from seaark. forgot gps. in decker pond; same as previous samples. seine code 2=funky decker deployment",NA,"true","Mudsucker","CB;AC;ED;GU","Decker Island","04/11/2023","DECK-TP","3=66-100% clouds","0=Calm; glassy"," SW"," 4=flood",82,14.1,9.7,170,7.5,7.9,0.22,0.49,11.5," 1=absent",1," Inside",NA," false"," Guest Alec Strachan.",2023-04-11,2023,4,"2023-04-11 07:55","Spring","Handheld depth finder",1.5,1.5,159.12201242824," 2. Partial twist; snag; or tear",NA,NA,NA,NA,NA,14941,1,0,"","",NA,"",NA,NA,NA,"",NA,NA,NA,NA,NA,NA,NA,"","","","","NOFISH","NOFISHCTCH","NONE","No Catch","Fish","","","","","","","","","","","",FALSE,"Present",NA,"No Catch","","","","","No Catch",NA,"LAMOPE01-DECK-11APR2023","No Catch",NA,62.8448562671978,0,0,NA,"LAMOPE01-DECK-11APR2023","No Catch"
"64","LAMOPE01-DECK-15DEC2022","136",195,12128,7130,"true","Seine","LAMOPE","","2. Partial twist; snag; or tear"," 2= against flow"," ",1.2,NA,NA,NA,"","10:33","",NA,NA,NA,38.084028,121.724121,NA,NA,NA,NA,NA,NA,NA,NA,NA,NA,"Boat"," ",NA,NA,NA,NA,NA,NA,NA,NA," false"," "," ","",1,NA," 1-33%"," ",NA,""," gps 5 accuracy 2m; paired n; code 2 - difficult deployment. dominant vegetation in net: egeden; hyacinth",NA,"false","Mudsucker","AC;DMC;ED;GP","Decker Island","12/15/2022","DECK-UNK","1=0-33% clouds","0=Calm; glassy"," NA"," 4=flood",71,9.3,10.2,410,7.5,7.5,0.23,0.33,12.6," 1=absent",2," Inside",NA," false"," ",2022-12-15,2022,12,"2022-12-15 10:33","Fall","",1.5,1.5,159.12201242824," 2. Partial twist; snag; or tear",NA,NA,NA,NA,NA,14094,2,2,"","",NA,"",NA,NA,NA,"",NA,NA,NA,NA,NA,NA,NA,"","","","","EXOPAL","EXOPAL","SHR","Siberian Prawn","Invertebrate","modestus","Exopalaemon","Palaemonidae","Decapoda","Malacostraca","Arthropoda","Introduced","","","","adult",TRUE,"Present",NA,"","Decapoda Adult","Decapoda","Decapoda","Decapoda","Exopalaemon",NA,"LAMOPE01-DECK-15DEC2022","Siberian Prawn",NA,125.689712534396,0,251.379425068791,0,"LAMOPE01-DECK-15DEC2022","Siberian Prawn"
"65","LAMOPE01-FLYW-14NOV2022","110217",1381,12163,7162,"true","Seine","LAMOPE","","1. No twists; snags; or tears"," 2= against flow"," ",0.8,NA,NA,NA,"","13:16","",NA,NA,NA,38.361836,121.642833,NA,NA,NA,NA,NA,NA,NA,NA,NA,NA,"Crew Members and Boat"," ",NA,NA,NA,NA,NA,NA,NA,NA," false"," "," ","",NA,NA," 34-66%"," ",NA,""," gps 5; accuracy 2m. not paired. no net # listed",NA,"true","Mudsucker","DMC;ED;GP","Flyway Farms","11/14/2022","FLYW-UNK","1=0-33% clouds","0=Calm; glassy"," NA"," 2=ebb",NA,12.5,11.81,202,8.2,2.4,0.1,0.27,7.7," 1=absent",1," Inside",NA," false"," SECCHI HIT BOTTOM; 130+",2022-11-14,2022,11,"2022-11-14 13:16","Fall","",1.1,1.1,118.217730722742," 1. No twists; snags; or tears",NA,NA,NA,NA,NA,14183,5,0,"","",NA,"",26966,38,NA,"true",0,0,0,0,0,0,NA,"","false","false","","KILSPP","","KLF","Killifish spp.","Fish","","Lucania","Cyprinodontidae","Cyprinodontiformes","Osteichthyes","Chordata","Introduced","","","","adult",NA,"",NA,"Killifish spp.","","","","","",5,"LAMOPE01-FLYW-14NOV2022","Killifish spp.",0,422.94839948557,422.94839948557,15310.7320613776,0.0276243093922652,"LAMOPE01-FLYW-14NOV2022","Killifish spp."
"66","LAMOPE01-GRIZ-16MAY2023","9999",345,13402,8002,"true","Seine","LAMOPE","","1. No twists; snags; or tears"," 2= against flow"," ",1.3,NA,NA,NA,"","09:30","",NA,NA,NA,38.132095,122.00263,NA,NA,NA,NA,NA,NA,NA,NA,NA,NA,"Boat"," ",NA,NA,NA,NA,NA,NA,NA,NA," false"," "," ","",3,NA," 0%"," ",NA,""," gps 6 accuracy 3m. depth from handheld. gps 6 worked this day.",NA,"true","Mudsucker","AC;ED;GU;AM","Grizzly Bay","05/16/2023","GRIZ-UNK","1=0-33% clouds","3= wind 8-12 mph; large wavelets"," SW"," 4=flood",20,17.2,9.45,148,7.8,67.4,0.62,1.17,6," 1=absent",1," Inside",NA," false"," Guest: Anthony Elias-Linarez; Depth from handheld",2023-05-16,2023,5,"2023-05-16 09:30","Spring","Handheld depth finder",1.3,1.3,139.010648691434," 1. No twists; snags; or tears",NA,NA,NA,NA,NA,15205,0,0,"","",NA,"",NA,NA,NA,"",NA,NA,NA,NA,NA,NA,NA,"","","","","NOFISH","NOFISHCTCH","NONE","No Catch","Fish","","","","","","","","","","","",FALSE,"Present",NA,"No Catch","","","","","No Catch",NA,"LAMOPE01-GRIZ-16MAY2023","No Catch",NA,0,0,0,NA,"LAMOPE01-GRIZ-16MAY2023","No Catch"
"67","LAMOPE01-GRIZ-18APR2023","136",195,12841,7781,"true","Seine","LAMOPE","","1. No twists; snags; or tears"," 2= against flow"," ",1.3,NA,NA,NA,"","08:32","",NA,NA,NA,38.129882,122.01294,NA,NA,NA,NA,NA,NA,NA,NA,NA,NA,"Boat"," ",NA,NA,NA,NA,NA,NA,NA,NA," false"," "," ","",3,NA," 1-33%"," ",NA,""," depth from handheld. paired y . gps 6 accuracy 4m. gps calculated in 2023 sample inventory - ed 9/7/2023",NA,"true","Mudsucker","AC;ED;GU;AM","Grizzly Bay","04/18/2023","GRIZ-UNK","1=0-33% clouds","2= wind 4-7 mph; small wavelets"," SW"," 2=ebb",13,13.2,10.07,305,7.7,132,0.61,1.23,5.3," 1=absent",2," Inside",NA," false"," Guest- Anthony Elias-Linarez",2023-04-18,2023,4,"2023-04-18 08:32","Spring","Handheld depth finder",1.3,1.3,139.010648691434," 1. No twists; snags; or tears",NA,NA,NA,NA,NA,15081,3,3,"","",NA,"",NA,NA,NA,"",NA,NA,NA,NA,NA,NA,NA,"","","","","EXOPAL","EXOPAL","SHR","Siberian Prawn","Invertebrate","modestus","Exopalaemon","Palaemonidae","Decapoda","Malacostraca","Arthropoda","Introduced","","","","adult",TRUE,"Present",NA,"","Decapoda Adult","Decapoda","Decapoda","Decapoda","Exopalaemon",NA,"LAMOPE01-GRIZ-18APR2023","Siberian Prawn",NA,215.810805016758,0,0,NA,"LAMOPE01-GRIZ-18APR2023","Siberian Prawn"
"68","LAMOPE01-GRIZ-20MAR2023","136",195,12441,7421,"true","Seine","LAMOPE","","1. No twists; snags; or tears"," 2= against flow"," ",2,NA,NA,NA,"","09:54","",NA,NA,NA,38.136713,122.00625,NA,NA,NA,NA,NA,NA,NA,NA,NA,NA,"Boat"," ",NA,NA,NA,NA,NA,NA,NA,NA," false"," "," ","",3,NA," 0%"," ",NA,""," gps 5; accuracy 2m.not paired. water moving downstream because of flow",NA,"true","Mudsucker","CB;ED;GN;GP","Grizzly Bay","03/20/2023","GRIZ-UNK","2=33-66% clouds","3= wind 8-12 mph; large wavelets"," W"," 4=flood",12,13,10.13,625,7.8,113.8,0.95,1.25,9.1," 1=absent",1," Inside",NA," false"," ",2023-03-20,2023,3,"2023-03-20 09:54","Spring","",2.3,2.3,232.751925056618," 1. No twists; snags; or tears",NA,NA,NA,NA,NA,14823,3,3,"","",NA,"",NA,NA,NA,"",NA,NA,NA,NA,NA,NA,NA,"","","","","EXOPAL","EXOPAL","SHR","Siberian Prawn","Invertebrate","modestus","Exopalaemon","Palaemonidae","Decapoda","Malacostraca","Arthropoda","Introduced","","","","adult",TRUE,"Present",NA,"","Decapoda Adult","Decapoda","Decapoda","Decapoda","Exopalaemon",NA,"LAMOPE01-GRIZ-20MAR2023","Siberian Prawn",NA,128.8925966679,0,85.9283977786003,0,"LAMOPE01-GRIZ-20MAR2023","Siberian Prawn"
"69","LAMOPE01-GRIZ-21NOV2022","9999",345,12190,7190,"true","Seine","LAMOPE","","1. No twists; snags; or tears"," 2= against flow"," ",1.6,NA,NA,NA,"","09:06","",NA,NA,NA,38.136635,122.01164,NA,NA,NA,NA,NA,NA,NA,NA,NA,NA,"Boat"," ",NA,NA,NA,NA,NA,NA,NA,NA," false"," "," ","",3,NA," 0%"," ",NA,""," gps 5; accuracy 3m. not paired. ",NA,"true","Mudsucker","ED;SH;GP;KS","Grizzly Bay","11/21/2022","GRIZ-UNK","1=0-33% clouds","0=Calm; glassy"," SW"," 4=flood",50,9.8,10.29,18073,7.8,9.9,0.22,0.86,8.2," 1=absent",2," Inside",NA," false"," 25; 117;79 - random polygons",2022-11-21,2022,11,"2022-11-21 09:06","Fall","",1.9,1.9,197.300077206198," 1. No twists; snags; or tears",NA,NA,NA,NA,NA,14236,0,0,"","",NA,"",NA,NA,NA,"",NA,NA,NA,NA,NA,NA,NA,"","","","","NOFISH","NOFISHCTCH","NONE","No Catch","Fish","","","","","","","","","","","",FALSE,"Present",NA,"No Catch","","","","","No Catch",NA,"LAMOPE01-GRIZ-21NOV2022","No Catch",NA,0,0,0,NA,"LAMOPE01-GRIZ-21NOV2022","No Catch"
"70","LAMOPE01-HONK-07DEC2022","9999",345,12110,7111,"true","Seine","LAMOPE","","1. No twists; snags; or tears"," 2= against flow"," ",2.3,NA,NA,NA,"","08:50","",NA,NA,NA,38.061181,121.925821,NA,NA,NA,NA,NA,NA,NA,NA,NA,NA,"Boat"," ",NA,NA,NA,NA,NA,NA,NA,NA," false"," "," ","",1,NA," 0%"," ",NA,""," gps 5 accuracy 5m; paired n",NA,"true","Mudsucker","AC;ED;GN;GP","Honker-Spoonbill","12/07/2022","HONK-HONK","1=0-33% clouds","1=wind 1-3 mph; scaley ripples"," NW"," 3=low slack",66,10.3,10.06,14255,7.6,8.4,0.21,0.33,7.3," 1=absent",2," Inside",NA," false"," ",2022-12-07,2022,12,"2022-12-07 08:50","Fall","",2.6,2.6,257.551731085734," 1. No twists; snags; or tears",NA,NA,NA,NA,NA,14054,0,0,"","",NA,"",NA,NA,NA,"",NA,NA,NA,NA,NA,NA,NA,"","","","","NOFISH","NOFISHCTCH","NONE","No Catch","Fish","","","","","","","","","","","",FALSE,"Present",NA,"No Catch","","","","","No Catch",NA,"LAMOPE01-HONK-07DEC2022","No Catch",NA,0,0,0,NA,"LAMOPE01-HONK-07DEC2022","No Catch"
"71","LAMOPE01-HORS-01FEB2023","197",315,12310,7310,"true","Seine","LAMOPE","","2. Partial twist; snag; or tear"," 2= against flow"," ",3.8,NA,NA,NA,"","09:21","",NA,NA,NA,38.084428,121.734674,NA,NA,NA,NA,NA,NA,NA,NA,NA,NA,"Boat"," ",NA,NA,NA,NA,NA,NA,NA,NA," false"," "," ","",3,NA," "," ",NA,""," not paired. gps from phone -; accuracy 7.7 ft. code 2 - depth",NA,"true","Mudsucker","DMC;ED;GU;GP","Horseshoe Bend","02/01/2023","HORS-S","1=0-33% clouds","1=wind 1-3 mph; scaley ripples"," NW"," 4=flood",32,8.2,10.69,234,7.6,25.5,0.31,0.52,17.3," 1=absent",2," Inside",NA," false"," LS = LEIGH SANDERS  ",2023-02-01,2023,2,"2023-02-01 09:21","Winter","",4.1,4.1,332.7," 2. Partial twist; snag; or tear",NA,NA,NA,NA,NA,14546,1,0,"","",NA,"",28382,31,NA,"true",0,0,0,10,0,0,NA,"","false","false","","MISSIL","ISS","MSS","Mississippi Silverside","Fish","berryllia","Menidia","Atherinopsidae","Atheriniformes","Actinopterygii","Chordata","Introduced","","","","larvae",FALSE,"Present",NA,"Mississippi Silverside","Fish Larvae","Fish Larvae","fish","fish","Mississippi Silverside",1,"LAMOPE01-HORS-01FEB2023","Mississippi Silverside",0,30.0571085061617,30.0571085061617,60.1142170123234,0.5,"LAMOPE01-HORS-01FEB2023","Mississippi Silverside"
"72","LAMOPE01-HORS-03JAN2023","136",195,12243,7243,"true","Seine","LAMOPE","","1. No twists; snags; or tears"," 2= against flow"," ",2.9,NA,NA,NA,"","10:31","",NA,NA,NA,38.083104,121.712136,NA,NA,NA,NA,NA,NA,NA,NA,NA,NA,"Boat"," ",NA,NA,NA,NA,NA,NA,NA,NA," false"," "," ","",1,NA," 0%"," ",NA,""," gps 6; accuracy 3m. not paired.gps calculated and corrected in 2023 sample inventory - ed 21jul2023",NA,"true","Mudsucker","AC;ED;KS","Horseshoe Bend","01/03/2023","HORS-M","3=66-100% clouds","2= wind 4-7 mph; small wavelets"," NW"," 4=flood",15,9.5,9.88,143,7.3,55.6,0.44,0.67,15.5," 1=absent",2," Inside",NA," false"," ",2023-01-03,2023,1,"2023-01-03 10:31","Winter","",3.2,3.2,302.550852078746," 1. No twists; snags; or tears",NA,NA,NA,NA,NA,14355,16,16,"","",NA,"",NA,NA,NA,"",NA,NA,NA,NA,NA,NA,NA,"","","","","EXOPAL","EXOPAL","SHR","Siberian Prawn","Invertebrate","modestus","Exopalaemon","Palaemonidae","Decapoda","Malacostraca","Arthropoda","Introduced","","","","adult",TRUE,"Present",NA,"","Decapoda Adult","Decapoda","Decapoda","Decapoda","Exopalaemon",NA,"LAMOPE01-HORS-03JAN2023","Siberian Prawn",NA,528.836719185165,0,165.261474745364,0,"LAMOPE01-HORS-03JAN2023","Siberian Prawn"
"73","LAMOPE01-HORS-30NOV2022","136",195,12217,7215,"true","Seine","LAMOPE","","1. No twists; snags; or tears"," 2= against flow"," ",2.7,NA,NA,NA,"","09:53","",NA,NA,NA,38.084095,121.710466,NA,NA,NA,NA,NA,NA,NA,NA,NA,NA,"Boat"," ",NA,NA,NA,NA,NA,NA,NA,NA," false"," "," ","",1,NA," 1-33%"," ",NA,""," gps5; accuracy 2m. not paired. dominant vegetation in net: hyacinth; egeden; stupec",NA,"true","Mudsucker","AC;ED;GP;KS","Horseshoe Bend","11/30/2022","HORS-UNK","1=0-33% clouds","0=Calm; glassy"," NA"," 4=flood",50,11.2,10.36,4377,7.7,13.3,0.22,0.33,5.7," 1=absent",2," Inside",NA," false"," ",2022-11-30,2022,11,"2022-11-30 09:53","Fall","",3,3,288.23269931296," 1. No twists; snags; or tears",NA,NA,NA,NA,NA,14284,2,2,"","",NA,"",NA,NA,NA,"",NA,NA,NA,NA,NA,NA,NA,"","","","","EXOPAL","EXOPAL","SHR","Siberian Prawn","Invertebrate","modestus","Exopalaemon","Palaemonidae","Decapoda","Malacostraca","Arthropoda","Introduced","","","","adult",TRUE,"Present",NA,"","Decapoda Adult","Decapoda","Decapoda","Decapoda","Exopalaemon",NA,"LAMOPE01-HORS-30NOV2022","Siberian Prawn",NA,69.3883797628534,0,589.801227984254,0,"LAMOPE01-HORS-30NOV2022","Siberian Prawn"
"74","LAMOPE01-LIBE-08MAR2023","136",195,12384,7364,"true","Seine","LAMOPE","","1. No twists; snags; or tears"," 2= against flow"," ",1.3,NA,NA,NA,"","08:40","",NA,NA,NA,38.271996,121.669031,NA,NA,NA,NA,NA,NA,NA,NA,NA,NA,"Boat"," ",NA,NA,NA,NA,NA,NA,NA,NA," false"," "," ","",3,NA," 34-66%"," ",NA,""," gps 5; accuracy 2m. not paired.shrimp unid b/c broken rostrums",NA,"true","Mudsucker","AC;ED;GU;AM;GP","Liberty Island","03/08/2023","LIBE_UNK","3=66-100% clouds","2= wind 4-7 mph; small wavelets"," SW"," 2=ebb",61,9.5,10.49,538,8,13.2,0.77,1.87,19.8," 1=absent",1," Inside",NA," false"," Leigh Sanders= Guest",2023-03-08,2023,3,"2023-03-08 08:40","Spring","",1.6,1.6,168.922111459686," 1. No twists; snags; or tears",NA,NA,NA,NA,NA,14726,29,29,"","",NA,"",NA,NA,NA,"",NA,NA,NA,NA,NA,NA,NA,"","","","","EXOPAL","EXOPAL","SHR","Siberian Prawn","Invertebrate","modestus","Exopalaemon","Palaemonidae","Decapoda","Malacostraca","Arthropoda","Introduced","","","","adult",TRUE,"Present",NA,"","Decapoda Adult","Decapoda","Decapoda","Decapoda","Exopalaemon",NA,"LAMOPE01-LIBE-08MAR2023","Siberian Prawn",NA,1716.76755336562,0,236.795524602154,0,"LAMOPE01-LIBE-08MAR2023","Siberian Prawn"
"75","LAMOPE01-LIBE-25JAN2023","110217",1381,12281,7281,"true","Seine","LAMOPE","","1. No twists; snags; or tears"," 2= against flow"," ",1.1,NA,NA,NA,"","08:42","",NA,NA,NA,38.298788,121.680292,NA,NA,NA,NA,NA,NA,NA,NA,NA,NA,"Boat"," ",NA,NA,NA,NA,NA,NA,NA,NA," false"," "," ","",1,NA," 1-33%"," ",NA,""," not paired. gps 5; accuracy 2m. leigh sanders is a guest. unid shrimps had broken rostrums.",NA,"true","Mudsucker","ED;GU;GN;GP","Liberty Island","01/25/2023","LIBE_UNK","1=0-33% clouds","1=wind 1-3 mph; scaley ripples"," N"," 1=high slack",12,7.7,9.14,250,7.5,98.5,1.06,0.65,16.6," 1=absent",1," Inside",NA," false"," Guest: Leigh Sanders",2023-01-25,2023,1,"2023-01-25 08:42","Winter","",1.4,1.4,149.151524838822," 1. No twists; snags; or tears",NA,NA,NA,NA,NA,14463,3,0,"","",NA,"",28242,32,NA,"true",0,0,0,0,0,0,NA,"","false","false","","KILSPP","","KLF","Killifish spp.","Fish","","Lucania","Cyprinodontidae","Cyprinodontiformes","Osteichthyes","Chordata","Introduced","","","","adult",NA,"",NA,"Killifish spp.","","","","","",3,"LAMOPE01-LIBE-25JAN2023","Killifish spp.",0,201.137735818785,201.137735818785,201.137735818785,1,"LAMOPE01-LIBE-25JAN2023","Killifish spp."
"76","LAMOPE01-LIBE-25MAY2023","136",195,13480,8079,"true","Seine","LAMOPE","","1. No twists; snags; or tears"," 2= against flow"," ",0.9,NA,NA,NA,"","08:00","",NA,NA,NA,38.298758,121.681691,NA,NA,NA,NA,NA,NA,NA,NA,NA,NA,"Boat"," ",NA,NA,NA,NA,NA,NA,NA,NA," false"," "," ","",3,NA," 1-33%"," ",NA,""," depth from handheld for all samples. gps 6; accuracy 3m. not paired. ",NA,"true","Mudsucker","DMC;ED;GU;AM","Liberty Island","05/25/2023","LIBE_UNK","1=0-33% clouds","3= wind 8-12 mph; large wavelets"," SW"," 1=high slack",130,17.7,9.28,278,9.3,2.3,0.15,0.35,10.8," 1=absent",2," Inside",NA," false"," Guest - Anthony Elias-Linarez",2023-05-25,2023,5,"2023-05-25 08:00","Spring","Handheld depth finder",0.9,0.9,96.7432585221664," 1. No twists; snags; or tears",NA,NA,NA,NA,NA,15387,2,2,"","",NA,"",NA,NA,NA,"",NA,NA,NA,NA,NA,NA,NA,"","","","","EXOPAL","EXOPAL","SHR","Siberian Prawn","Invertebrate","modestus","Exopalaemon","Palaemonidae","Decapoda","Malacostraca","Arthropoda","Introduced","","","","adult",TRUE,"Present",NA,"","Decapoda Adult","Decapoda","Decapoda","Decapoda","Exopalaemon",NA,"LAMOPE01-LIBE-25MAY2023","Siberian Prawn",NA,206.732751258502,0,413.465502517004,0,"LAMOPE01-LIBE-25MAY2023","Siberian Prawn"
"77","LAMOPE01-LIBE-26APR2023","110217",1381,13366,7960,"true","Seine","LAMOPE","","1. No twists; snags; or tears"," 2= against flow"," ",0.8,NA,NA,NA,"","08:51","",NA,NA,NA,38.301366,121.68179,NA,NA,NA,NA,NA,NA,NA,NA,NA,NA,"Boat"," ",NA,NA,NA,NA,NA,NA,NA,NA," false"," "," ","",3,NA," 1-33%"," ",NA,""," gps 5; accuracy 3m. not paired. depth from handheld",NA,"true","Mudsucker","AC;ED;AM;SS","Liberty Island","04/26/2023","LIBE_UNK","1=0-33% clouds","1=wind 1-3 mph; scaley ripples"," NW"," 1=high slack",74,18.3,9.25,487,8.6,2.6,0.57,1.1,15.2," 1=absent",1," Inside",NA," false"," secchi hit bottom; depth from handheld",2023-04-26,2023,4,"2023-04-26 08:51","Spring","Handheld depth finder",0.8,0.8,85.7504395849216," 1. No twists; snags; or tears",NA,NA,NA,NA,NA,15162,1,0,"","",NA,"",29203,29,NA,"true",0,0,0,0,0,0,NA,"","false","false","","KILSPP","","KLF","Killifish spp.","Fish","","Lucania","Cyprinodontidae","Cyprinodontiformes","Osteichthyes","Chordata","Introduced","","","","adult",NA,"",NA,"Killifish spp.","","","","","",1,"LAMOPE01-LIBE-26APR2023","Killifish spp.",0,116.617477979185,116.617477979185,349.852433937554,0.333333333333333,"LAMOPE01-LIBE-26APR2023","Killifish spp."
"78","LAMOPE01-LIBE-28DEC2022","136",195,12143,7142,"true","Seine","LAMOPE","","1. No twists; snags; or tears"," 2= against flow"," ",2,NA,NA,NA,"","08:28","",NA,NA,NA,38.269828,121.690814,NA,NA,NA,NA,NA,NA,NA,NA,NA,NA,"Boat"," ",NA,NA,NA,NA,NA,NA,NA,NA," false"," "," ","",3,NA," 1-33%"," ",NA,""," gps #5; accuracy 2m; not paired; gearid lam03; dominant veg in net cerdem elodea",NA,"true","Mudsucker","MA;ED;SH;KS","Liberty Island","12/28/2022","LIBE_UNK","1=0-33% clouds","1=wind 1-3 mph; scaley ripples"," W"," 4=flood",49,8.4,10.53,226,7.6,14.2,0.3,0.45,11.5," 1=absent",2," Inside",NA," false"," depth from secchi - don't adjust",2022-12-28,2022,12,"2022-12-28 08:28","Fall","",2.3,2.3,232.751925056618," 1. No twists; snags; or tears",NA,NA,NA,NA,NA,14129,5,5,"","",NA,"",NA,NA,NA,"",NA,NA,NA,NA,NA,NA,NA,"","","","","EXOPAL","EXOPAL","SHR","Siberian Prawn","Invertebrate","modestus","Exopalaemon","Palaemonidae","Decapoda","Malacostraca","Arthropoda","Introduced","","","","adult",TRUE,"Present",NA,"","Decapoda Adult","Decapoda","Decapoda","Decapoda","Exopalaemon",NA,"LAMOPE01-LIBE-28DEC2022","Siberian Prawn",NA,214.820994446501,0,1976.35314890781,0,"LAMOPE01-LIBE-28DEC2022","Siberian Prawn"
"79","LAMOPE01-LOWE-14DEC2022","197",315,12117,7118,"true","Seine","LAMOPE","","2. Partial twist; snag; or tear"," 2= against flow"," ",1.4,NA,NA,NA,"","09:13","",NA,NA,NA,38.345674,121.668772,NA,NA,NA,NA,NA,NA,NA,NA,NA,NA,"Boat"," ",NA,NA,NA,NA,NA,NA,NA,NA," false"," "," ","",1,NA," 1-33%"," ",NA,""," gps 5 accuracy 2m; paired n; code 2 - deployed funky; dominant vegetation in sample: filalg; potcri",NA,"true","Mudsucker","CB;ED;GP;KS","Lower Yolo Ranch","12/14/2022","LOWE-UNK","1=0-33% clouds","0=Calm; glassy"," NA"," 4=flood",120,7.9,10.1,313,7.5,4,0.28,0.53,15.6," 1=absent",2," Inside",NA," false"," ",2022-12-14,2022,12,"2022-12-14 09:13","Fall","",1.7,1.7,178.551821933162," 2. Partial twist; snag; or tear",NA,NA,NA,NA,NA,14061,1,0,"","",NA,"",26332,37,NA,"true",0,0,0,0,0,0,NA,"","false","false","","MISSIL","ISS","MSS","Mississippi Silverside","Fish","berryllia","Menidia","Atherinopsidae","Atheriniformes","Actinopterygii","Chordata","Introduced","","","","larvae",FALSE,"Present",NA,"Mississippi Silverside","Fish Larvae","Fish Larvae","fish","fish","Mississippi Silverside",1,"LAMOPE01-LOWE-14DEC2022","Mississippi Silverside",0,56.0061493169381,56.0061493169381,56.0061493169381,1,"LAMOPE01-LOWE-14DEC2022","Mississippi Silverside"
"80","LAMOPE01-LOWE-26MAY2023","9999",345,13430,8027,"true","Seine","LAMOPE","","1. No twists; snags; or tears"," 2= against flow"," ",1.9,NA,NA,NA,"","07:30","",NA,NA,NA,38.338056,121.666676,NA,NA,NA,NA,NA,NA,NA,NA,NA,NA,"Boat"," ",NA,NA,NA,NA,NA,NA,NA,NA," false"," "," ","",3,NA," 0%"," ",NA,""," gps 6 accuracy 3m. depth from handheld.",NA,"true","Mudsucker","AC;ED;AM","Lower Yolo Ranch","05/26/2023","LOWE-CH-ENTRANCE-S","1=0-33% clouds","1=wind 1-3 mph; scaley ripples"," SW"," 4=flood",51,18.9,7.34,447,8,12.3,0.18,0.52,16.7," 1=absent",2," Inside",NA," false"," ",2023-05-26,2023,5,"2023-05-26 07:30","Spring","Handheld depth finder",1.9,1.9,197.300077206198," 1. No twists; snags; or tears",NA,NA,NA,NA,NA,15241,0,0,"","",NA,"",NA,NA,NA,"",NA,NA,NA,NA,NA,NA,NA,"","","","","NOFISH","NOFISHCTCH","NONE","No Catch","Fish","","","","","","","","","","","",FALSE,"Present",NA,"No Catch","","","","","No Catch",NA,"LAMOPE01-LOWE-26MAY2023","No Catch",NA,0,0,0,NA,"LAMOPE01-LOWE-26MAY2023","No Catch"
"81","LAMOPE01-PEYT-03MAY2023","76",122,13465,8063,"true","Seine","LAMOPE","","1. No twists; snags; or tears"," 2= against flow"," ",0.8,NA,NA,NA,"","10:58","",NA,NA,NA,38.217251,122.030953,NA,NA,NA,NA,NA,NA,NA,NA,NA,NA,"Boat"," ",NA,NA,NA,NA,NA,NA,NA,NA," false"," "," ","",3,NA," 0%"," ",NA,""," depth from handheld. gps 5. accuracy 2m. not paired.",NA,"true","Mudsucker","DMC;ED;AM","Peytonia-Suisun","05/03/2023","PEYT-SUIS","3=66-100% clouds","1=wind 1-3 mph; scaley ripples"," NE"," 4=flood",29,15.9,6.59,2253,7.7,38.3,0.98,1.86,53.5," 1=absent",1," Inside",NA," false"," ",2023-05-03,2023,5,"2023-05-03 10:58","Spring","Handheld depth finder",0.8,0.8,85.7504395849216," 1. No twists; snags; or tears",NA,NA,NA,NA,NA,15345,2,2,"","",NA,"",NA,NA,NA,"",NA,NA,NA,NA,NA,NA,NA,"","","","","CRANGO","CRANGON","","Bay Shrimp","Fish","","Crangon","Caridae","Decapoda","Malacostraca","Arthropoda","Native","","","","adult",FALSE,"Present",NA,"","Decapoda Adult","Decapoda","Decapoda","Decapoda","Crangon",NA,"LAMOPE01-PEYT-03MAY2023","Bay Shrimp",NA,233.234955958369,0,233.234955958369,0,"LAMOPE01-PEYT-03MAY2023","Bay Shrimp"
"82","LAMOPE01-PEYT-04APR2023","136",195,12481,7461,"true","Seine","LAMOPE","","1. No twists; snags; or tears"," 2= against flow"," ",3,NA,NA,NA,"","11:15","",NA,NA,NA,38.210998,122.035481,NA,NA,NA,NA,NA,NA,NA,NA,NA,NA,"Boat"," ",NA,NA,NA,NA,NA,NA,NA,NA," false"," "," ","",NA,NA," 0%"," ",NA,""," gps 5; accuracy 2m. not paired. ",NA,"true","Mudsucker","CB;AC;ED;GU","Peytonia-Suisun","04/04/2023","PEYT-SUIS","1=0-33% clouds","1=wind 1-3 mph; scaley ripples"," NW"," 4=flood",26,12.5,8.46,1409,7.7,33.9,0.38,1.49,35.6," 1=absent",2," Inside",1," false"," guest: Danie N C",2023-04-04,2023,4,"2023-04-04 11:15","Spring","",3.3,3.3,309.454345624682," 1. No twists; snags; or tears",NA,NA,NA,NA,NA,14861,1,1,"","",NA,"",NA,NA,NA,"",NA,NA,NA,NA,NA,NA,NA,"","","","","EXOPAL","EXOPAL","SHR","Siberian Prawn","Invertebrate","modestus","Exopalaemon","Palaemonidae","Decapoda","Malacostraca","Arthropoda","Introduced","","","","adult",TRUE,"Present",NA,"","Decapoda Adult","Decapoda","Decapoda","Decapoda","Exopalaemon",NA,"LAMOPE01-PEYT-04APR2023","Siberian Prawn",NA,32.3149444866042,0,0,NA,"LAMOPE01-PEYT-04APR2023","Siberian Prawn"
"83","LAMOPE01-PEYT-16MAR2023","136",195,12453,7433,"true","Seine","LAMOPE","","2. Partial twist; snag; or tear"," 3= unknown"," ",6.8,NA,NA,NA,"","07:52","",NA,NA,NA,38.207697,122.033163,NA,NA,NA,NA,NA,NA,NA,NA,NA,NA,"Boat"," ",NA,NA,NA,NA,NA,NA,NA,NA," false"," "," ","",3,NA," 34-66%"," ",NA,""," gps 5; accuracy 2m. not paired. tow direction: na perpendicular to flow. majority of veg in cod end dead tule. wing caught on patch of dead tule and caused deployment to go sideways",NA,"true","Mudsucker","AC;ED;AM;GP","Peytonia-Suisun","03/16/2023","PEYT-SUIS","1=0-33% clouds","1=wind 1-3 mph; scaley ripples"," NA"," 4=flood",17,13.4,7.95,959,7.6,80.1,0.63,1.28,27.3," 1=absent",1," Inside",NA," false"," ",2023-03-16,2023,3,"2023-03-16 07:52","Spring","",7.1,7.1,332.7," 2. Partial twist; snag; or tear",NA,NA,NA,NA,NA,14842,33,33,"","",NA,"",NA,NA,NA,"",NA,NA,NA,NA,NA,NA,NA,"","","","","EXOPAL","EXOPAL","SHR","Siberian Prawn","Invertebrate","modestus","Exopalaemon","Palaemonidae","Decapoda","Malacostraca","Arthropoda","Introduced","","","","adult",TRUE,"Present",NA,"","Decapoda Adult","Decapoda","Decapoda","Decapoda","Exopalaemon",NA,"LAMOPE01-PEYT-16MAR2023","Siberian Prawn",NA,991.884580703336,0,0,NA,"LAMOPE01-PEYT-16MAR2023","Siberian Prawn"
"84","LAMOPE01-PEYT-19JAN2023","136",195,12269,7265,"true","Seine","LAMOPE","","1. No twists; snags; or tears"," 2= against flow"," ",0.7,NA,NA,NA,"","07:35","",NA,NA,NA,38.226707,122.034588,NA,NA,NA,NA,NA,NA,NA,NA,NA,NA,"Boat"," ",NA,NA,NA,NA,NA,NA,NA,NA," false"," "," ","",1,NA," 0%"," ",NA,""," gps 5; accuracy 2m. not paired. sampled through tule. frp23-503 thrsti 36 0 whole etoh",NA,"true","Mudsucker","AC;ED;GP;KS","Peytonia-Suisun","01/19/2023","PEYT-PEYT","1=0-33% clouds","1=wind 1-3 mph; scaley ripples"," W"," 4=flood",22,10.3,7.95,1026,7.5,38.5,0.93,1.5,37.6," 1=absent",1," Inside",NA," false"," ",2023-01-19,2023,1,"2023-01-19 07:35","Winter","",1,1,107.56568890144," 1. No twists; snags; or tears",NA,NA,NA,NA,NA,14408,15,15,"","",NA,"",NA,NA,NA,"",NA,NA,NA,NA,NA,NA,NA,"","","","","EXOPAL","EXOPAL","SHR","Siberian Prawn","Invertebrate","modestus","Exopalaemon","Palaemonidae","Decapoda","Malacostraca","Arthropoda","Introduced","","","","adult",TRUE,"Present",NA,"","Decapoda Adult","Decapoda","Decapoda","Decapoda","Exopalaemon",NA,"LAMOPE01-PEYT-19JAN2023","Siberian Prawn",NA,1394.49671667553,0,1115.59737334043,0,"LAMOPE01-PEYT-19JAN2023","Siberian Prawn"
"85","LAMOPE01-PEYT-21DEC2022","974",469,12148,7147,"true","Seine","LAMOPE","","1. No twists; snags; or tears"," 2= against flow"," ",1.4,NA,NA,NA,"","08:54","",NA,NA,NA,38.220425,122.044142,NA,NA,NA,NA,NA,NA,NA,NA,NA,NA,"Boat"," ",NA,NA,NA,NA,NA,NA,NA,NA," false"," "," ","",1,NA," 0%"," ",NA,""," gps 5; accuracy 3m; not paired",NA,"true","Mudsucker","AC;DMC;SH;KS","Peytonia-Suisun","12/21/2022","PEYT-PEYT","5=fog","1=wind 1-3 mph; scaley ripples"," NE"," 4=flood",30,7.5,8.81,9683,7.3,25.2,0.46,1.57,50.5," 1=absent",2," Inside",1," false"," hexagon #9",2022-12-21,2022,12,"2022-12-21 08:54","Fall","",1.7,1.7,178.551821933162," 1. No twists; snags; or tears",NA,NA,NA,NA,NA,14147,1,0,"","",NA,"",26752,290,NA,"true",0,0,0,0,0,0,NA,"","false","false","","SPLITT","ST","SPLT","Splittail","Fish","macrolepidotus","Pogonichthys","Cyprinidae","Cypriniformes","Actinopterygii","Chordata","Native","Moderate Concern","","MC","",FALSE,"Present",NA,"Sacramento Splittail","Fish Larvae","Fish Larvae","fish","fish","Sacramento Splittail",1,"LAMOPE01-PEYT-21DEC2022","Splittail",0,56.0061493169381,56.0061493169381,56.0061493169381,1,"LAMOPE01-PEYT-21DEC2022","Splittail"
